,song,time,lyrics
12,Perdu d'Avance,3:33,"Pfff  J'ai la flemme d'enregistrer  Ça enregistre là? Ah ok!    J'crois qu'j'suis perdu, j'crois qu'j'avance dans l'mauvais sens  Bientôt 26 ans, en pleine crise d'adolescence  Le concept c'est : dans ma vie, j'fais des trucs débiles  Comme ça j'peux rapper, en parler, ramasser des billes  J'aime pas trop les filles, j'arrive pas à les accoster  T'facon j'parle pas aux gens qu'j'connais pas tant qu'j'suis pas fonce-dé  Quand j'm'énerve j'pleure, essaye pas d'me contrarier  J'passe des jours entiers chez moi, j'raconte ma vie à mon cahier  Des fois j'vois tout en noir comme Gilbert Montagné  Encore une soirée seul, ma main droite pour m'accompagner  J'arrive même à aimer les gens que j'devrais détester  Viens bébé, on va tester mes nouvelles MST  J'ai aucun ego, j'fais pitié comme un blanc qui s'prend pour un négro  En cours sur le banc, le rang d'devant avec les intellos  Dans la vie tout c'que j'aime c'est rien, même rien faire j'aime pas  J'me fais marcher sur les pieds, mais ça m'gêne pas    J'suis perdu d'avance  Dans l'rap, dans l'taf, dans la vie, avec les filles  J'suis perdu d'avance, perdu d'avance  Nan, j'ai jamais su relever aucun défi  J'suis perdu d'avance  Dans l'rap, dans l'taf, dans la vie, avec les filles  J'suis perdu d'avance, perdu d'avance  Si tu veux faire comme moi : entre dans la danse    J'enchaîne les jobs de merde, j'suis au bout du rouleau  Mes parents s'demandent quand est-ce que j'vais trouver un vrai boulot  J'sais pas, j'crois qu'j'vais essayer d'échouer dans l'monde du rap  Maintenant qu'les comiques chantent, les gens croient qu'j'raconte une blague  J'ai pas d'crédibilité, j'suis une p'tite nature  Ma meuf a seize piges et veut m'lâcher parce que j'suis immature  On squatte chez moi tous les soirs, c'est un dépotoir  J'tiens pas l'shit : après trois lattes, j'vis un vrai cauchemar  J'vais arrêter d'fumer à cause de la nicotine  Arrêter d'baiser à cause de ma p'tite copine  Arrêter l'rap, arrêter d'tiser  En fait j'ai juste envie d'arrêter d'respirer  Avant d'signer, j'me disais : ""On percera jamais""  Maintenant j'me dis qu'j'finirai par m'faire tabasser  J'vais arrêter d'me plaindre, mais bon des fois, j'ai les nerfs en pelote  Un peu comme quand ma chérie couchait avec mon meilleur pote    J'suis perdu d'avance  Dans l'rap, dans l'taf, dans la vie, avec les filles  J'suis perdu d'avance, perdu d'avance  Nan, j'ai jamais su relever aucun défi  J'suis perdu d'avance  Dans l'rap, dans l'taf, dans la vie, avec les filles  J'suis perdu d'avance, perdu d'avance  Si tu veux faire comme moi : entre dans la danse    Quand j'étais encore au collège, j'étais l'fils du directeur  J'entendais des : ""Hé fils de pute, j't'attends à la sortie à 17h""  Imagine en deux ans comment ça m'a mis les nerfs  Depuis j'traîne toujours avec les mêmes amis imaginaires  J'pue la défaite, j'suis en concert dans ta salle des fêtes  J'suis à peu près tout l'contraire de la jet-set  J'cours à ma perte : plus j'dors, plus j'suis fatigué  Mes hobbies c'est sortir et boire de l'alcool fort de basse qualité  J'défie les lois d'la gravité après quelques litres  ""Oui, t'es plus balaise que moi, mais dans ma tête : j'te nique!""  Si tu connais l'refrain par cœur : chante-le pour moi  Ça fait dix ans que j'rappe, et j'assume toujours pas    J'suis perdu d'avance  Dans l'rap, dans l'taf, dans la vie, avec les filles  J'suis perdu d'avance, perdu d'avance  Nan, j'ai jamais su relever aucun défi  J'suis perdu d'avance  Dans l'rap, dans l'taf, dans la vie, avec les filles  J'suis perdu d'avance, perdu d'avance  Si tu veux faire comme moi : entre dans la danse"
13,Peur de l'Échec,5:14,"J’ai peur de jamais finir mon album j’ai plus d’inspi D’façon j’ai plus envie de devenir chanteur, j’ai plus quinze piges Quand j’regarde mes clips j’trouve qu’j’fais pitié C’que j’raconte dans mes chansons c’est des clichés c’est pas la vérité La célébrité m’fait peur J’ai peur d’me griller les ailes à vouloir briller sous les projecteurs Au fond, j’m’en bats pas les couilles d’c’que disent les gens J’me perds entre c’qu’ils attendent de moi et ce qu’j’suis vraiment Tous les jours j’fais l’acteur, j’fais semblant J’maquille la peur en plaisantant J’perds mon temps à m’poser des questions au lieu d’agir J’ai peur de la dépression, j’ai peur de l’avenir et ses déceptions Plus j’grandis, plus l’temps passe et plus j’suis déçu Sous l’emprise de l’angoisse des futures blessures Plus j’me cherche des excuses, plus j’m’enlise J’m’enivre de négativité et j’me sens vivre Souvent, j’ai peur de l’ennui J’ai peur d’avoir aucune raison d’me plaindre pourtant j’me sens triste Tout le temps j’me sens vide j’ai peur d’être normal d’être moyen Ni trop mal ni trop bien, j’crois qu’j’sers à rien J’ai peur de mes proches parce qu’ils connaissant mes faiblesses Mes talons d’Achille, ils savent à quel point mes fondations sont fragiles Ils m’font confiance pour l’instant Mais quand j’les décevrai, ils seront près de moi prêts à frapper les premiers J’ai peur que mes parents m’détestent Depuis que j’ai treize ans j’régresse, j’les blesse, j’les stresse, J’délaisse c’qu’ils m’ont appris pour faire que d’la merde Comme si j’valais mieux qu’mon père, comme si j’valais mieux qu’ma mère Eux croient qu’ils m’aiment, moi j’crois qu’ils se voilent la face J’crois qu’ils aiment celui qu’ils rêvent de voir à ma place Parce qu’ils savent pas c’qu’il s’passe derrière le masque Qui s’cache derrière l’image, parce qu’ils connaissent pas mon vrai visage Quand j’dis qu’j’déteste les filles j’me donne du crédit J’me suis vraiment jamais investi, j’ai fui J’ai triché sur mes sentiments en croyant rester vrai J’ esquivé l’amour par peur de m’faire baiser On dirait qu’plus j’m’attachais moins ça marchait J’ai trahi, j’ai sali, j’ai haï, j’ai banni Qu’est ce que j’ai acquis à part des remords et des maladies Rien à part la peur de rester seul toute ma vie J’crois un peu en Dieu mais pas vraiment J’irai avec les mécréants quand j’partirai les pieds devant J’ai peur d’être attiré par le néant J’me sens tellement bien dans la noirceur, j’me sens dans mon élément J’ai comme envie d’sauter dans l’vide, d’me passer la corde au cou D’me noyer, d’m’entailler les veines du coude au poignet J’ai comme envie d’me mettre une balle dans le crâne mais j’ai pas de flingue Regarde moi dans les yeux tu comprendras qu’j’suis qu’une baltringue  J’ai peur de perdre J’ai peur de l’échec J’ai peur d’affronter les épreuves de la vie J’ai peur de mes erreurs j’ai peur de l’avenir"
14,Pour le Pire,3:34,"Parce qu'en fait j'ai pas eu d'rapports depuis des mois  J'recherche une fille un peu facile un peu naïve qui voudrait sortir avec moi  Physiquement tu m'attires pas plus que ca  Mais j'taperais dans n'importe quoi  J'ai l'intention d'te faire tiser  Jusqu'à c'que tu veuilles bien dormir chez moi  J'irai jamais décrocher la lune pour tes yeux  Mais quitte à rien branler autant le faire tous les deux  Ouh ouh ouh j'veux qu'tu sois plus ou moins ma p'tite copine  En attendant d'avoir trouver mieux    J'vais pas t'mentir  Oh j'suis pas vraiment ton prince charmant  Si tu veux bien sortir avec moi c'est pour le pire  J'ai rien à t'offrir à part des mauvais souvenirs  Ca sera p't'etre pas tous les jours la fete  Je suis qu'un homme j'réfléchis pas toujours avec ma tete  Maintenant tu sais à quoi t'en t'nir  Si tu veux bien sortir avec moi c'est pour le pire    Oublie tes reves d'ado  J'oublie ton anniversaire pour esquiver le cadeau  J'paye meme pas le Mac Do  Si tu cherches un beau gosse, sportif et romantique c'est raté  Parait qu'j'suis juste un pauvre type égocentrique  Si ta meilleure copine est bonne j'essaierai d'l'attraper  Si je me fais cramer j'dirai qu'c'est elle qui m'a dragué  J'serai gentil quand t'auras bien travailler  Un bouquet d'fleurs de rond point, j'débarque chez toi quand j'ai plus rien à grailler  J'fais ni l'ménage ni la cuisine  Si on va au cinéma c'est toi qui payes c'est moi qui choisis l'film  Si on va en boite c'est sans toi  Parce que si j'rencontre n'importe quelle meuf consentante j'rentre dans l'tas  J'préfère te dire la vérité  Oublie les clichés d'amour de série-b  On pourrais p't'etre kiffer t'es p't'etre ma destinée  Mais j'te quitterai dès qu'j'trouve une chienne avec un meilleur pédigree    J'vais pas t'mentir  Oh j'suis pas vraiment ton prince charmant  Si tu veux bien sortir avec moi c'est pour le pire  J'ai rien à t'offrir à part des mauvais souvenirs  Ca sera p't'etre pas tous les jours la fete  Je suis qu'un homme j'réfléchis pas toujours avec ma tete  Maintenant tu sais à quoi t'en t'nir  Si tu veux bien sortir avec moi c'est pour le pire    Bon des fois j'me tromperai de nom  Parce que je kiffe encore mon ex alors j't'appellerai p't'etre par son prénom  Des fois j'rentrerai à l'aube avec 12 grammes dans le sang  D'temps en temps je penserai à une autre quand on couchera ensemble  Tu verras jamais mes parents et j'veux pas rencontrer les tiens  J'veux pas qu'on crée des liens j'te préviens  Si tu me dis je t'aime j'répondrai je t'aime bien  Si tu veux des câlins dès l'matin, c'est mort j'dors j'fais rien  Si tu cherches quelqu'un pour confier tes problèmes, suis une thérapie  J'ai plus de batterie dès qu'tu commences à raconter ta vie  Si tu crois qu't'es enceinte, j'disparais comme par magie  J'aurai changé d'adresse avant qu'tu sois rentrée de la pharmacie  C'est l'amour à sens unique,  Je donne pas d'signes d'affection en public  Tu passes après mes potes et ma musique  ca commence par bébé, p'tite puce, princesse, mon ange  ca finit par où t'était p'tite (bip), quand est-ce qu'on mange?    J'vais pas t'mentir  Oh j'suis pas vraiment ton prince charmant  Si tu veux bien sortir avec moi c'est pour le pire  J'ai rien à t'offrir à part des mauvais souvenirs  ca sera p't'etre pas tous les jours la fete  Je suis qu'un hommej'réfléchis pas toujours avec ma tete  Maintenant tu sais à quoi t'en t'nir  Si tu veux bien sortir avec moi c'est pour le pire    J'suis pas ton prince charmant j'suis pas ton prince charmant"
15,Soirée Ratée,3:05,"T'es pas le plus beau gosse de la terre  T'a pas d'salaire, t'a pas d'quoi te payer plus d'deux trois verres  Toutes les s'maines dans la meme boite avec les meme Nike Air  Avec les meme videur qui t'mettent les memes galères  Tu dragues les memes ados, c'est un fiasco  Parce que t'es trop déchiré pour aligner 3 mots  Si tu danses comme un naze toi et moi on est pareil  Demain on prendra l'temps d'regretter c'qu'on a fait la veille  On sera p't'etre jamais V.I.P  On baisera jamais des betes de schnecks à Miami  On s'en bat les couilles on tise on vit la nuit  On rentre à pieds parce qu'on a jamais d'quoi payer le taxi    Encore une soirée où j'vais rentrer seul chez moi  Encore un soir où j'vais finir dans un sale état  J'essaye d'avoir l'air cool mais j'arrive juste a m'afficher  Ca m'empeche pas d'kiffer  Deux jours plus tard j'suis de retour pour passer la meme soirée ratée    On fait la meme chose toutes les semaines  On sait qu'sa va etre naze mais on sort quand meme  On fait la meme chose toutes les semaines  Tous c'qu'on ramène à la maison c'est des problèmes    On fait la meme chose toutes les semaines  On sait qu'sa va etre naze mais on sort quand meme  On fait la meme chose toutes les semaines  Tous c'qu'on ramène à la maison c'est des problèmes    Les consos sont hors de prix  Au fond de la salle ton ex-meuf sort avec n'importe qui  T'a des sapes de merde et une gueule assortie  Les trois-quart de la boite veulent ta tete à la sortie  T'à pas d'bouteille donc pas d'table pour t'asseoir  Tu fais cotiser tes potes pour qu'ils t'payent à boire  On est pareil si tu fais peine à voir    Si tu fumes ton forfait en appelant toutes les filles du répertoire  Ca s'passe jamais comme dans les clips  J'connais personne qui rentre en boite en équipe  Retour à la réalité, recalé à l'entrée  La fete est finie alors qu'elle a jamais commencé    Encore une soirée où j'vais rentrer seul chez moi  Encore un soir où j'vais finir dans un sale état  J'essaye d'avoir l'air cool mais j'arrive juste a m'afficher  Ca m'empeche pas d'kiffer  Deux jours plus tard j'suis de retour pour passer la meme soirée ratée    On fait la meme chose toutes les semaines  On sait qu'sa va etre naze mais on sort quand meme  On fait la meme chose toutes les semaines  Tous c'qu'on ramène à la maison c'est des problèmes    On fait la meme chose toutes les semaines  On sait qu'sa va etre naze mais on sort quand meme  On fait la meme chose toutes les semaines  Tous c'qu'on ramène à la maison c'est des problèmes    Y a pas d'barre de strip-tease y a que des p'tites grosses qui tisent au bar  Qui font des truc bizarres après trois Whisky-Coca  Tu t'endors sur une banquette au bord du coma  Renverse ton verre imprègne ton t-shirt de vodka  Dehors y'a plus de musique  Plus d'repères tu titubes tu perds l'équilibre ta tete percute le bitume  Demain t'auras le moral à zéro, attrapé froid  Tu t'rapelleras meme pas comment t'es rentré jusqu'à chez toi    Soirée ratée soirée ratée soirée ratée  Soirée ratée soirée ratée soirée ratée  (Et c'est pareil toutes les semaines)  Soirée ratée soirée ratée soirée ratée  Soirée ratée soirée ratée soirée ratée  (Et c'est pareil toutes les semaines)"
16,Ma Grossew/ Nessbeal,4:04,"Ma grosse (Ma grosse)  Ma grosse (Ma grosse)    J’suis avec ma louve, dans la bergerie  Un carnage, pour un love de youv’, ma grosse c’est ma chérie  Si j’ai, si j’ai passé l’permis grutier, c’est pour toutes les soulever  J’suis dans l’bâtiment tout corps d'état  Combien j’ai de femmes, ça c’est du domaine privé  Polygame, Sex Addict, adepte du string-jacking  Aucun régime ma grosse, moi j’veux qu’t’exploses ton legging  Aquaplaning sur tes bourrelets, monté comme King Kong, c’est moi l’King  Petit joueur, je joue la Ligue Master, j’mets ton équipe en Europa League  Moi, j’aime les femmes rondes, pourquoi devrais-je en avoir honte ?  J’suis un ponte, fusil à pompe dans le caleçon, devine pourquoi j’pousse la fonte  J’me défonce, j’roule à fond, imagine une baleine qui touche le plafond  N.E.2.S l’impossible, le rap de tess ma grosse c’est bavon    Les hommes te doivent du respect  Ceux qui n’aiment pas tes formes n’ont jamais dû tester (Yeah)  Ma grosse (Hey)  Ma grosse (Hey)  Ma grosse (Hey)  Ma grosse (Hey)  Ma grosse (Hey)  Ma grosse (Hey)  Ma grosse (Hey)  Ma grosse (Hey)  Ma grosse (Hey)  Ma grosse (Hey)    Tu mouilles, tu transpires, tu m’éclabousses  Tu fais des trucs techniques avec ta bouche, parce que t’aimes la bouffe  J’ai de l’amour, pour, les poids lourds  J’te prendrais dans mes bras même si j’fais pas tout l’tour  C’est Mowgli qui joue avec Balou quand on s’accouple  J’te fais la cour, j’te mets au lit, j’te démolis  Plus mon alcoolémie descend, plus tu grossis  J’ai comme envie d’rôti quand j’vois tes bas résilles sur tes grosses cuisses  En attendant d’en serrer des jolies  J’tapais dans la viande pour m’entrainer, comme si j’étais Rocky  J’y ai pris goût, j’m’en fous maintenant c’est ton heure  Ce soir tu seras la petite baleine échouée sur la plage de mon cœur    Les hommes te doivent du respect  Ceux qui n’aiment pas tes formes n’ont jamais dû tester (Yeah)  Ma grosse (Hey)  Ma grosse (Hey)  Ma grosse (Hey)  Ma grosse (Hey)  Ma grosse (Hey)  Ma grosse (Hey)  Ma grosse (Hey)  Ma grosse (Hey)  Ma grosse (Hey)  Ma grosse (Hey)    J’ai même un numéro spécial quintal  Jeune homme cherche femme forte pour rapport confortable  Prends mon portable  Cet été, sois pas complexée par tes kilos  Moi aussi j’ai du bide, c’est pour mieux t’caresser l’clito    J’te passe la bague au doigt, ton mec veut t’mettre un anneau gastrique  J’ai rendez-vous avec un trois tonnes, j’viens la prendre avec un Fenwick  Ma grande, laisse-les rigoler ils ne peuvent pas nous comprendre  Ma grosse, assume tes rondeurs, t’es la meilleure  J’frais du trampoline sur ton ventre    Les hommes te doivent du respect  Ceux qui n’aiment pas tes formes n’ont jamais dû tester (Yeah)  Ma grosse (Hey)  Ma grosse (Hey)  Ma grosse (Hey)  Ma grosse (Hey)  Ma grosse (Hey)  Ma grosse (Hey)  Ma grosse (Hey)  Ma grosse (Hey)  Ma grosse (Hey)  Ma grosse (Hey)"
17,1990,1:39,"Bonsoir à tous et bienvenu sur la RapLine  L'émission la plus afrocentrique du PAF  Samedi soir tard comme toutes les semaines  La semaine dernière, c'était l'émission numéro 26, et souvenez-vous  on avait retrouvé Suprême NTM et puis IAM leur concurrent  Cette semaine, c'est un peu différent  On va retrouver celui qui s'est révélé avec un premier album intitulé ""Perdu d'avance""  Le second qui sort le 26 septembre 92 s'intitule ""Le chant des sirènes""  Qui est donc ce nouveau venu dans la scène du Rap Français?  Vous allez le découvrir sur la RapLine, voici Monsieur Orelsan    Tchiki tchek le mic quand j'arrive dans la session  Comme mon survêt Adidas, j'augmente la pression  Dans les années 90, nouvelle génération  Ils disent qu'on est des fous parce qu'on écoute nos walkmans à fond  Passe-moi le cro-mi  Que je me serve de ma tête comme le but de Basile Boli  Que je big up big up one love à tout mon possee  J'traine avec plus d'étoiles que si j'étais dans Shinobi  Quand tu vois nos styles dans nos vidéoclips  Les wacks MCs font leur valise comme Groquick  Tout va trop vite, nouvelles technologies  Beeper, tatoo, tam-tam, COBE oh oui  J'utilise plus de bandes qu'une momie  J'écris des rimes sales comme Dolly  Golden  Le RPR trouve ma musique  Obscène  Mais je serai bientôt dans le top 50 avec ma paire de Top Ten  Est-ce que je mens?  Nan  Est-ce qu'on baissera nos futes pour quelques francs?  Nan  Pervers j'ai le cerveau près des couilles comme Krang  Mais j'ai de la bonne poudre comme Tang  Quand on arrive dans la base tout le monde met les mains en l'air assuré  Comme si j'étais le roi de la pomme de terre j'envoie la purée  Toi-même tu sais mon DJ devrait s'appeler Ovomaltine  Boom c'est de la dynamite aux platines  1-9-9-10  MC Orelsan  B-boy, B-girl"
18,2010,2:45,"Hé Skread! Balance cette merde rétro-futuriste!  Konichiwa je suis de retour depuis six mois je m’isole  Je ai regardé One Piece 8 fois, les 460 épisodes  Une sorte de blanc qui se prend pour un chintoc  Je essaye de sortir plus de classiques que les usines Reebok  Un cyborg version 2.0  Je suis toujours dans les temps comme ton père à l’heure de l’apéro  Orelsan c’est Aurélien je ai pas de alter-égo  De toute façon y en avait pas un pour rattraper l’autre  Pourquoi tu me donnes ta démo, je suis pas producteur  Avant que tu me parles je étais de bonne humeur  Charme destructeur je frappe pas je engrosse une sœur  Je traîne avec une bande d’enfoiré mais on file que dalle aux Resto du Cœur  C’est pas du rap de geek, c’est pas du rap comique  C’est la musique d’un type en passe de devenir alcoolique  Je écris avec le sang d’une vierge des versets diaboliques  Je viens détourner plus de gosses que l’Église Catholique  Tu me verras pas aux Francofolies  Mais tu peux me trouver chez le psy en train de discuter de ma transophobie  On m’a dit tais-toi, nettoies (hé!)  Pauvre conne! Lèches-moi les noix!  Cochonne! Mets-toi des doigts!  Je veux faire des tubes en restant moi-même et je garde espoir  Je préfère bosser au Macdo qu’avoir la plume de Grégoire  Je ai la fraîcheur du terroir moi jeunesse du  Shit, des scooters, des bières, des baggy, des superstars  Des textes sur mes devoirs  Trois bandes blanches sur un survête noir  Mes défaites font mes plus belles gloires  Je aime voir l’amour dans les yeux d’une fille  Avant qu’mes spermatozoïdes cherchent à féconder sa pupille  Je suis pas là pour me faire des amis  Je préfère extorquer des gamines suicidaire featuring Jena Lee  Je ai à peu près la même réputation que Cheb Mami  Tant pis comme disent les cainris ""C’est la vie!""  Je viens de Caen ça s’entend je ai l’accent Bas-Normand  Je parle lentement je ai un coup de barre depuis mes 14ans  (Ton album ça sort quand?)  Pitié tu l’auras sûrement téléchargé avant que je ai fini de l’enregistrer  Mais qu’est-ce que tu sais faire à part cliquer  A part critiquer, à part flipper d’te faire griller ton Adresse IP  Ils font pas du rap conscient ils racontent le JT  Rien à foutre de la bonne cause je suis contre le Tibet  Quand je suis sur scène je veux t’entendre crier ""Orelsan!""  Quand je baise je veux t’entendre crier ""Orelsan!""  Des mots des phrases, des mauvaises phases  Des métaphores, des mauvaises vannes  Bientôt je arrête je dépose les armes je commence à m’ennuyer  Je fais que toute la nuit je écris je gratte du papier  Je relève à 15h, je relis, je trouve ça nulle à chier  Le rap je le quitterai de la même façon qu’l’ai kiffé  Mon nom à moi c’est Orelsan oui tu l’as deviné    2010 Maintenant je rap comme je veux  Parce qu’on est en 2010  2010 je me laisse pouser les cheveux  Parce qu’on est en 2010  2010 je porte plus de XXXL  Parce qu’on est en 2010  Y a des voitures qui volent dans le ciel    Haaan la honte!  T’es trop à l’ancienne 2010  Hé c’est fini on est en 2012 maintenant  Ouai je sais mais je m’en fou parce qu’on est en 2010"
