,song,time,lyrics
0,Décembrew/ Karim Ouellet,5:01,"Malgré mes soucis qui vagabondent  Il ne reste rien pour me faire peur  Et si je meurs avant la fin du monde  Et bien je connais la scène par cœur  Quand j'entends la rumeur qui monte  À en réveiller les morts  Quoique l'avenir nous montre  Tous mes amis se le disent encore  J'écoute le son du temps qui passe  J'essaie d'apprendre de nos erreurs  Je souris quand tu m'embrasses  Et je pleure, tu me brises le cœur  Quand j'entends les cloches qui sonnent  Tout le monde se questionne  Et si la raison m'abandonne  Et bien je me le redis encore    Et même au jour le plus court, la nuit ne tombera jamais  Sous les étoiles et le ciel qui se couvrent ensemble  Ah ah ah ah  Et si le vent qui tourne gonfle nos voiles, nous partirons  Sous la pluie qui s'en mêle et sur le sol qui tremble, décembre, ah    Et malgré le niveau de l'eau qui monte  Il me reste encore la mer à boire  Et si je meurs avant la fin du monde  Et bien je connais déjà l'histoire  Quand j'entends tous les laissés-pour-compte acceptant leur sort  Je connais très bien tout ce qu'ils me racontent  Tous mes amis me le disent encore  Les yeux remplis de glaciers qui fondent  Comme un animal à l'abattoir, traversant l'hécatombe  Je connais déjà la fin de l'histoire  Quand j'entends les armées qui s'affrontent au corps à corps dans le noir  Au son des balles et mastodontes  Sous une pluie de météore    Et même au jour le plus court, la nuit ne tombera jamais  Sous les étoiles et le ciel qui se couvrent ensemble  Ah ah ah ah  Et si le vent qui tourne gonfle nos voiles, nous partirons  Sous la pluie qui s'en mêle et sur le sol qui tremble  Qui tremble, qui tremble, qui tremble    Laisse en bordel derrière toi, c'est plus la peine de ranger  Même si t'as pas fait ton sac, même si rien n'est vraiment prêt  Est-ce que c'est tes jambes ou la Terre entière qui se met à trembler?  Affronte le danger, ou soit raisonnable et cours te planquer  Le froid du grand Nord, piéger dans un dernier temps mort  Inutile de rêver d'encore, attends que l'éternité t'emporte  Oublie l'avenir et ses plans, va dire au revoir à la ville et ses gens  Mais n'ai pas peur de partir en décembre  On s'en ira ensemble    Et même au jour le plus court, la nuit ne tombera jamais  Sous les étoiles et le ciel qui se couvrent ensemble  Ah ah ah ah  Et si le vent qui tourne gonfle nos voiles, nous partirons  Sous la pluie qui s'en mêle et sur le sol qui tremble, décembre, ah"
1,Je Rêve En Enferw/ Jena Lee,3:25,"T’as tout de l’homme imparfait, désespéré et torturé T’imagines le pire sans arrêt… (sans arrêt) Un jour tu dis « blanc », l’autre « noir », quels sont les mots que je dois croire ? Si toi-même dit ne pas savoir… (pas savoir) Tu n’es pas l’homme de mes rêves, mais pourquoi J’ai ce poison dans mes veines qui mène mon cœur vers toi?  j’rêve en enfer, plus j’ai mal et plus j’espère, plus tu pars moins j’y vois clair, je t’aime sans repères, pars tu me perds! j’rêve en enfer, plus tu me blesses plus j’espère, Même si t’as toujours été sincère je t’aime sans repères, pars tu me perds! j’rêve en enfer…  On était potes, on s’entendait bien, Puis un matin je me réveille avec un d’tes seins dans une main, Depuis tu t’es transformée en boomerang humain, Plus j’te jette fort et plus tu reviens, Comment t’expliquer sans te faire de mal Que les rares fois où je pense à toi j’ressens rien de spécial ! Tu voulais m’emmener faire un tour sur la route de l’amour, Mais pour moi, tu seras rien d’autre qu’une roue de secours ! Écoute-moi, on a rien faire tous les deux, J’aimerais t’agrafer les paupières pour que t’ouvre les yeux, J’crois que tu rêves d’être en enfer, réveille-toi, Jena, t’as du style mais tout ce que j’aime pas!!!  J’rêve en enfer, (reste en enfer!) Plus j’ai mal et plus j’espère, (plus t’espère) Plus tu pars moins j’y vois clair, (ouvre les yeux) Je t’aime sans repères, pars tu me perds! J’rêve en enfer, (reste en enfer!) Plus tu me blesses plus j’espère, (plus t’espère) Même si t’as toujours été sincère (ouvre les yeux) Je t’aime sans repères, pars tu me perds! J’rêve en enfer…  J’choisis l’enfer, et seul, c’est tellement mieux…  J’voulais pas t’faire de mal (t’faire de mal), Mais j’t’ai laissé croire des choses et j’assume que dalle…  J’choisis l’enfer, J’n’aime pas assez pour deux…  Incapable de m’investir dans une relation, J’me retrouve seul avec mes frustrations…  J’rêve en enfer, (reste en enfer!) Plus j’ai mal et plus j’espère, (plus t’espère) Plus tu pars moins j’y vois clair, (ouvre les yeux) Je t’aime sans repères, pars tu me perds! J’rêve en enfer, (reste en enfer!) Plus tu me blesses plus j’espère, (plus t’espère) Même si t’as toujours été sincère (ouvre les yeux) Je t’aime sans repères, pars tu me perds! J’rêve en enfer…  J’rêve en enfer, j’rêve en enfer… Même si je vois que tu tiens à moi, dans tes yeux Dans tes yeux, dans tes yeux, dans tes yeux, dans tes yeux Même si je vois que tu tiens à moi"
2,50 Pourcents,4:40,"Souviens-toi on s'était rencontré n'importe comment J'étais bourré j'rentrais j'me suis gouré d'appartement T'était pas très belle, des tresses presque un beau visage En détresse j'venais d'passer une soirée abominable Petite fille embobinable, technique de drague d'ado minable En un quart d'heure j'avais ma bite dans ta ceinture abdominale T'étais pas un modèle de chasteté Y'avait la photo d'ton keum dans un coeur sur la table de chevet Au bout d'trois mois t'as fini par me jeter On avait pourtant de bons rapports pas toujours protégés Mais t'avais changé d'avis, tu voulais à peine me faire la bise Tu voulais construire ta vie avec ton vrai p'tit ami Et j'me suis dit: "" Y a 24 heures elle était sur moi en grand écart Maintenant on s'sépare elle est super amoureuse de son vrai gars"" J'sais pas mais jaimais pas, ça sentait l'embrouille et c'était l'cas J'ai arrêté d'la voir afin d'éviter les dégâts J'pétais des câbles, j'commençais à l'aimer cette pute Quand j'me suis retrouvé tout seul j'me suis barré en cettesu J'calculais plus personne j'me suis enfermé dans une bulle Et une bouteille de Pitterson ça aide pas trop à prendre du recul  Bref, avec le temps j't'ai mis de côté Jusqu'à ce que tu sonnes chez moi et m'annonces que tu veux discuter T'as des problème et ça m'concerne, t'as lâché ton mec Tu veux qu'on s'remette ensemble et qu'on s'aime T'as besoin d'mes conseils, tu veux arrêter les études T'essayes de trouver du taf et tu sais pas où récolter de thunes T'es enceinte de trois mois et demi, Tu veux le garder mais tu sais pas s'il est de moi ou de lui  D'abord, on s'est kiffé dès les premiers abords On a eu des rapports puis tu m'as quitté d'un commun désaccord Tu tombes enceinte tu lâches ton keum t'es prise de remords Tu comptes sur moi pour te sortir de ton triste sort  D'abord, on s'est kiffé dès les premiers abords On a eu des rapports puis tu m'as quitté d'un commun désaccord Tu tombes enceinte tu lâches ton keum t'es prise de remords Tu comptes sur moi pour te sortir de ton triste sort  ""Et donc voilà en fait j'suis enceinte et j'voudrais qu'on s'remette ensemble Et j't'aime et j'suis désolée""  J'espère que tu blagues, j'espère que tu t'moques de moi J'suis pas comme toi moi, j'avale pas n'importe quoi Tu me la feras pas deux fois, compte pas sur moi pour tes étrennes Tu récoltes seulement c'que t'as semé même si c'est moi qui ai planté les graines Ok t'es enceinte, ok j'suis p't'être le père du gamin Mais pour les coup d'timp t'es loin d'avoir perdu la main A part ton baratin t'as rien à m'apporter J't'aiderai jamais à élever ta portée Je sais que tu trouves ça super cool, tu l'assortiras à ton sac à main Tu seras une vrai mère poule quand tu l'emmeneras faire les magasins C'est malsain, qu'est-ce tu veux qu'j'te dise de plus ? Félicitations, tu vas mettre au monde un futur fils de pute Tu voulais un enfant avant d'avoir dix-neuf ans Mais tu connaitras pas son père sans lui faire une prise de sang J'ai pas confiance, je serai pas à la maternité J'te déteste, peu importe les tests de paternité  J'suis p't'être le père de ton fils,  J'sais pas, p't'être, p't'être pas Tous ce que je sais c'est que tu veux jouer avec moi 50 pour cent de chance que je sois l'père J'étais prêt à l'faire mais tu m'as piégé laissé plus bas que terre  J'suis p't'être le père de ton fils,  J'sais pas, p't'être, p't'être pas Tous ce que je sais c'est que tu veux jouer avec moi 50 pour cent de chance que je sois l'père J'étais prêt à l'faire mais tu m'as piégé laissé plus bas que terre  ""Petit viens voir par ici, viens voir demi-papounet J'vais te raconter une belle histoire avant de t'endormir ""  J'suis la moitié d'ton père, comme si j'avais vidé qu'une seule boule Jusqu'à ce qu'on s'embrouille, j'trouvais qu'ta maman c'était une meuf cool Mais elle à pris des mauvaises habitudes, Comme de pas prévenir ses p'tits amis quand elle arrête la pilule Elle va t'mener la vie dure, elle à un sale caractère Ca lui donne un côté chienne, j'la kiffais jusqu'à c'qu'elle m'laisse en galère Donc en gros c'est la guerre entre elle et moi J'mettrai les voiles avant d'savoir qui a engrossé ta mère Depuis elle s'est remise avec l'autre et il croit que c'est ton vrai papa Parce qu'il sait pas qu'elle se faisait déboîter quand il était pas là T'es dans de sales draps, tu vas grandir dans une famille de merde C'est a moitié ma faute, j'dirai plus jamais à une fille que j'l'aime On s'croisera p't'être dans un tribunal ou une émission En attendant moitié de fiston, prends les bonnes décisions Choisis tes fréquentations, résiste à la tentation Et si tu baises sans capote évite de cracher pendant l'action  J'ai 50 pour cent d'chances d'avoir mis ta mère en cloque Quand elle trompait ton papa avec moi Personne connait la vérité sur cette affaire Donc garde-le pour toi, mais j'suis p't'être ton père Ou p't'être pas  J'suis p't'être ton papa"
3,Changement,3:17,"Putain!  Plus j'avance, plus j'grandis, plus j'comprends rien    Les sites de boules, c'est comme la vraie vie  T'attrapes des virus  Quand j'étais p'tit, y avait pas d'Internet  On trainait dans les abribus  Fallait attendre dimanche soir pour voir des filles nues  Depuis j'me fais ouij' en moins d'cinq minutes avec E-mule  On trouvait jamais d'meufs, on trainait qu'entre testicules  Maintenant les gens s'regroupent dans les champs pour prendre des pilules  En boite la CC circule, les pédés gesticulent,  Les particules sur les p'tits pulls c'est pas des pellicules  Putain, on dirait qu'ca suffit plus d'fumer des spliffs  Ma génération GameBoy sniffe plus de lignes qu'à Tetris  Depuis qu'on préfère les paquets d'clopes aux paquets d'chips  Le sports d'équipe partent en vrille, y a des grizzlis à Memphis  Maintenant les radios s'torchent avec la playlist  Maintenant faut passer sous l'bureau pour qu'on passe tes disques  Plus la carotte est grosse, plus l'auditeur écarte les cuisses  Le top albums 2006 c'est la banane d'Elvis    Les vieux comprennent pas c'qu'il s'passe dans la tete des jeunes  Ils sont pas élevés par la télé, par la PlayStation  Ils comprennent pas à quel point on est felés  Ils connaissent pas Internet, les boites, les grecs, les DVD  Les vieux comprennent pas c'qu'il s'passe dans la tete des jeunes  Ils sont pas élevés par la télé, par la PlayStation  Ils comprennent pas à quel point on est felés  Ils connaissent pas l'rap, les portables, le shit, la Despe    Les mecs fashion sont plus pédés qu'la moyenne des phoques  Les vieux revent d'etre morts, sont nostalgiques de la bonne vieille époque  Les jeunes sont complètement paumés donc ils prennent des drogues    Les plus jeunes sont cons, sont bons qu'a faire des blogs  Meme pour draguer, faut qu'tu connaisses les codes  Est-ce que tu voudrais bien m'sucer sur MSN? LOL!  C'est plus qu'un effet d'mode, c'est la doctrine des écoles  T'es personne si t'as pas une bete de sonnerie téléphone  Les p'tits croient qu'la télé c'est la réalité  Mais leurs stars préfabriquées r'tournent vite à la précarité  Maintenant les meufs portent du Vuitton, des grosses lunettes dorées  Avant c'était qu'pour les vieilles putes blondes décolorées  Les gars s'habillent comme des meufs et les meufs comme des chiennes  Elles kiffent les mecs efféminés comme si elles étaient lesbiennes  Maintenant tous les centre villes de France c'est les memes  Les memes putains d'Fnac, Mc Do, Foot Locker, Célio, Zara, H&M  Les médias lâchent les memes mythos, si on mord à l'hamecon  C'est parce qu'on recoit trop d'informations à la seconde  Avant j'achetais les sons, j'écoutais meme ceux que j'aimais pas  Maintenant j'ai 40 Gigas d'mp3s que j'écoute meme pas    Tu vas rester sur la touche si tu bouges trop lentement  C'est la course, on a tous du mal à suivre le changement  Poursuivre le mouvement c'est du taf à plein temps  J'suis en r'tard, toujours en r'tard, j'suis en r'tard, en r'tard  Tu vas rester sur la touche si tu bouges trop lentement  C'est la course, on a tous du mal à suivre le changement  Poursuivre le mouvement c'est du taf à plein temps  J'suis en r'tard, tout l'temps, comme cette salope de lapin blanc    Les vieux comprennent pas c'qu'il s'passe dans la tete des jeunes  Ils sont pas élevés par la télé, par la PlayStation  Ils comprennent pas à quel point on est felés  Ils connaissent pas Internet, les boites, les grecs, les DVD  Les vieux comprennent pas c'qu'il s'passe dans la tete des jeunes  Ils sont pas élevés par la télé, par la PlayStation  Ils comprennent pas à quel point on est felés  Ils connaissent pas l'rap, les portables, le shit, la Despe"
4,Courez Courez,4:03,"C’est perdu d’avance, j’sortirai mon album en cassette  Rajoute San derrière et devine qui baise ta mère en 4 lettres  J’veux que les gosses achètent mon disque en criant « mon précieux »  Si t’as pas confiance en moi tant mieux parce qu’on est deux  J’écris des textes comme si c’était des cours pour les vicieux  J’rappe à la sueur de mes boules et mes couplets ont un goût délicieux  J’me réveille avec des p’tits yeux après 19h  Ensuite j’me branle machinalement et j’lis des Hunter X Hunter  Les dep qui disent que je suis homophobe peuvent aller s’faire enculer  Ceux qui marchent pas avec nous peuvent aller s’faire amputer  J’suis complètement fumé comme les grands brûlés  Ma mère trouve mes chansons vulgaires alors qu’c’était les versions censurées  Petite essaie pas d’me fréquenter  Ou tu vas perdre ton pucelage avant d’avoir perdu tes dents de lait  J’ai toujours été une victime mais j’vais me venger  A moins qu’j’tente le suicide ou d’refaire ma vie à l’étranger    Quand j’étais petit j’me faisais courser du collège jusqu’à chez moi  Courez, courez vous m’attraperez pas  Y’avait toujours un p’tit bâtard qui voulait m’casser le bras  Courez, courez vous m’attraperez pas  Depuis j’considère qu’la terre entière a une dette envers moi  Courez, courez vous m’attraperez pas  J’ai trouvé les 7 boules de cristal, priez pour que j’m’en serve pas  Courez, courez vous m’attraperez pas    J’suis pour de vrai de vrai, j’dis c’que j’pense, j’pense c’que j’dis  Tout c’que j’écrit c’est du premier degré  J’sais qu’j’ai des fans dans ce délire et j’voudrais pas les vexer  Mais quand tu me compares à des TTC c’est comme si tu m’manquais de respect  Les féministes me persécutent, me prennent pour Belzébuth  Comme si c’était d’ma faute si les meufs c’est des putes  Elles ont qu’à arreter d’se faire péter le uc  Et m’dire merci parce que j’les éduque, j’leur apprends des vrais trucs  Des fois j’sais plus si j’suis misogyne ou si c’est ironique  J’serai peut etre fixé quand j’arreterai de faire des textes où j’frappe ma p’tite copine  Tous les jours mon boss menace d’me virer d’mon taf    Ma voisine me casse les couilles alors j’menace de tuer son chat  Certains disent qu’j’suis un génie, d’autres un gosse irresponsable  Moi si j’étais toi j’opterais pour la réponse A  Skread ? Ca fait combien d’mesures?  15  Cool, cool, la seule chose que j’kiffe dans cette chanson c’est le  Quand j’étais petit j’me faisais courser du collège jusqu'à chez moi  Courez, courez vous m’attraperez pas  Y’avait toujours un p’tit bâtard qui voulait m’casser le bras  Courez, courez vous m’attraperez pas  Depuis j’considère qu’la terre entière a une dette envers moi  Courez, courez vous m’attraperez pas  J’ai trouvé les 7 boules de cristal, priez pour que j’m’en serve pas  Courez, courez vous m’attraperez pas    Cherche pas, la mienne est plus grosse que la tienne  J’parle de la chienne que j’ai fait aboyer la veille  J’me rappelle plus d’sa tete, j’sais juste qu’elle était dégueulasse  J’ai mal au dos, j’ai dormi par terre parce qu’elle prenait deux places  J’suis veilleur de nuit slash baiseur de truie  J’sais pas qui c’est ton rappeur préféré mais sache que j’suis meilleur que lui  Avec un SMIC, les putes sont hors de prix  Alors j’me soûle à l’alcool de riz et j’saute ta poule en Fosburry  La force de Wolverine, le feu d’Aquaman  J’veux mourir à 33 ans comme Jésus, Bruce Lee et Balavoine  J’déteste aller à Paname, rapper, j’ai du mal à gérer le stress  En plus, j’suis nul à chier à PES    Quand j’étais petit j’me faisais courser du collège jusqu’à chez moi  Courez, courez vous m’attraperez pas  Y’avait toujours un p’tit bâtard qui voulait m’casser le bras  Courez, courez vous m’attraperez pas  Depuis j’considère qu’la terre entière a une dette envers moi  Courez, courez vous m’attraperez pas  J’ai trouvé les 7 boules de cristal, priez pour que j’m’en serve pas  Courez, courez vous m’attraperez pas"
5,Différent,3:44,"Orelsan 25 ans célibataire, rappeur Craqueur sous pression, amateur de films amateurs Mon seul moyen d'expression c'est d'm'enfermer sur moi-même Des fois j'rappe, des fois j'fais des sons des fois une dépression J'suis président de mon club d'échecs perdant résident dans le cœur des schnecks Bobby la défaite alias Johnny j'm'en bats les steaks Rien ne m'arrête si j'commence à tiser Alors passe-moi l'JB et fais tourner ton hépatite B J'finirai par acheter ma femme en Malaisie Les putes à blog sont plus bonnes en photos qu'dans la vraie vie Nan, j'suis pas un produit marketing J'suis sensible, j'me sens sale après avoir été voir les filles A Caen la nuit t'es sûr de t'faire contrôler par les flics J'essaye de tout mettre sur le dos d'mon jumeau maléfique J'voulais dédicacer mon sponsor Adedi J'ai trop d'leust dans mon nouveau survet' quand j'vais pointer aux Assedic  Nous on s'en bat les couilles de c'que disent les gens On vit pas dans le même monde on est différent J'suis resté beaucoup trop longtemps à cirer l'banc Si j'rentre sur le terrain c'est pour mettre une droite à mon coach Nous on s'en bat les couilles de c'que disent les gens On vit pas dans le même monde on est différent J'suis resté beaucoup trop lontemps à cirer l'banc Si j'rentre sur le terrain ça devient dangereux pour les deux camps  J'veux pas d'une femme soumise ni d'une sale groupie Par contre j'échangerais mon bras gauche contre une nuit avec Katsumi Là où j'vis on s'ennuie à mourir Une bonne soirée c'est une soirée dont j'ai aucun souvenir Anti-héros j'raconte mes aventures sur le net en vidéo J'suis la version humaine de Calimero Mes idéaux c'est prendre ma retraite après avoir percé Passer l'restant d'mes jours à mater des films de karaté Renseigne-toi sur les pansements et les poussettes J'peux t'faire un enfant ou te casser l'nez sur un coup d'tête Poulette pourquoi tu veux pas sortir avec moi ? J'adore passer par les p'tits trous j'adore me sentir à l'étroit Avant j'voulais construire ma vie avec mes beaux diplômes Depuis j'ai vue 8mile et j'rêve d'habiter dans un mobil home Haut les mains Casseurs Flowteurs c'est mon binôme La crédibilité j'm'en branle tu peux pas test Aurelien et Guillaume  Nous on s'en bat les couilles de c'que disent les gens On vit pas dans le même monde on est différent J'suis resté beaucoup trop longtemps à cirer l'banc Si j'rentre sur le terrain c'est pour mettre une droite à mon coach Nous on s'en bat les couilles de c'que disent les gens On vit pas dans le même monde on est différent J'suis resté beaucoup trop lontemps à cirer l'banc Si j'rentre sur le terrain ça devient dangereux pour les deux camps  Avec mes chansons ma meuf croit que j'la trompe et elle a bien raison Chérie se soir j'rentrerai pas à la maison J'vais aller voir mes potes, on ref'ra l'monde autour d'un film de boules On critiquera les gens qu'on connait pas dans les articles de Groove J'écris des lyrics de ouf, pas d'la provoc gratuite A la Star-ac en t-shirt avec une photo d'ma bite Mélange du coca et du Sky dans tes Chocapic J'viens récupérer mes paninis j'suis nostalgique J'suis plus proche d'la blague de cul que d'l'art de rue J'fais ça pour les thunes dans mon album y aura des pages de pub J'suis un mélange entre hardcore et farfelu Orelsan parce qu'on change pas une équipe qui fait match nul  Nous on s'en bat les couilles de c'que disent les gens On vit pas dans le même monde on est différent J'suis resté beaucoup trop longtemps à cirer l'banc Si j'rentre sur le terrain c'est pour mettre une droite à mon coach Nous on s'en bat les couilles de c'que disent les gens On vit pas dans le même monde on est différent J'suis resté beaucoup trop lontemps à cirer l'banc Si j'rentre sur le terrain ça devient dangereux pour les deux camps  Nous on s'en bat les couilles de c'que disent les gens On vit pas dans le même monde on est différent J'suis resté beaucoup trop longtemps à cirer l'banc Si j'rentre sur le terrain c'est pour mettre une droite à mon coach Nous on s'en bat les couilles de c'que disent les gens On vit pas dans le même monde on est différent J'suis resté beaucoup trop lontemps à cirer l'banc Si j'rentre sur le terrain ça devient dangereux pour les deux camps"
