,song,time,lyrics
49,Notes pour trop tard,7:34,"Okay, j'avais ton âge y a à peu près ton âge  Le passage à l'âge adulte est glissant dans les virages  Devenir un homme y a pas d'stage, pas d'rattrapage  Maintenant, t'es dans l'grand bain, devine comment on nage  T'auras toujours une espèce de rage, envie d'prendre le large  D'éclater les types qui jouent d'la guitare sur la plage  Comme à chaque fois qu'tu déménages, c'est un monde qui s'écroule  Écoute, l'histoire s'écrit en tournant les pages  Écoute  J'ai pris quelques notes    Si t'as l'impression qu'personne te comprend, c'est parce que personne te comprend  C'est plus facile à vivre une fois qu't'en es conscient  Comment tu peux leur en vouloir? Tu t'comprends pas toi-même  Souvent seul avec tes problèmes, souvent, c'est toi l'problème  La plupart des conseils d'adultes sont des clichés d'merde  Parce qu'ils ont pas compris l'jeu mais ils suivent les règles  Alors écoute pas trop tes parents, fais semblant  Ils ont pas la science infuse, t'es leur premier enfant  Tu perdrais tellement d'temps à batailler  Y a des combats qu'tu peux pas gagner, surtout quand tu paies pas l'loyer  Fais-toi une raison, y a très peu d'raisons d'foutre la merde  Dans sa propre maison, même quand t'as raison  Si y a une chose que tu dois pas remettre en question  T'es plus intelligent qu'avant mais t'es toujours très con  T'es trop sensible, tu vis tout comme une agression  Demande à un fou s'il est fou et tu verras c'qu'il t'répond  Autre chose que tu dois savoir, tu baiseras pas, c'soir  Une fois qu't'auras compris ça, ça t'enlèvera un poids  Parce que t'as beaucoup trop la dalle et ça va s'voir  Parce que t'es beaucoup trop timide, tu vas beaucoup trop boire  Apprends à la fermer, t'auras l'air mystérieux  Apprends à t'vendre un peu mieux, tu baiseras dans un mois ou deux  C'est toujours le même style de fille dont tu tombes amoureux  Tu sais, le style de fille qui t'rend malheureux  Donc fais pas la pleureuse le jour où elle t'brise le cœur  Sur la longueur, t'économises des pleurs  Ensuite, t'auras peur de t'investir, tu t'diras qu'c'est mieux ailleurs qu'chez toi  Tu vas rater l'meilleur de c'que t'as déjà  En gros, tu couches avec ta meuf en pensant à une autre  T'as pas kiffé  Tu penses à elle quand tu couches avec l'autre une fois qu'elle t'a quittée    Okay  T'empêcheras jamais les gens d'parler  Et, comme t'es chelou, y a p't-être moyen qu'les gens veuillent te frapper  Tu peux faire des pompes, tu peux apprendre à t'battre  Mais même musclé, ça fait toujours mal de prendre une droite  Ton cerveau et ton ego fonctionnent à l'envers  Plus tu cherches à prouver quelque chose, plus ça fait l'contraire  Quand tu dis qu't'as pas peur, c'est qu't'as peur  Quand tu dis qu't'as pas mal, c'est qu'tu commences à sentir la douleur  Connais ta hauteur, va pas t'surclasser  Tu verras, des fois, tu perdras contre des gars qu'tu trouvais nuls à chier  Bien sûr, la vie est injuste  Si t'aimes pas les lois, sois pas un putain d'juge  Ne crois pas les insultes, y a pas d'race pour être un bâtard  Pour être un fils de pute, pas besoin d'avoir une daronne sur un trottoir  Y a pas d'sexualité pour être un enculé  Plus tu réagis, plus on dirait qu'tu t'sens visé, laisse glisser  Les meilleures blagues sont les plus méchantes ou les plus bêtes  Mais les pires êtres humains sont des losers cruels  T'en prends jamais au plus faible, garde les vannes dans un coin d'ta tête  Ça rentrera dans un texte, dans un film ou dans un sketch  L'école est un calvaire, y a pas grand-chose à faire  Arrêter, c'est partir trop tôt dans une autre galère  Tèj' ton sac-à-dos en l'air, t'auras l'poids d'la société sur les épaules  Un patron, ton père et ta mère  Trois-quarts des cours servent à rien  Mais les actrices de boule en soient témoins, rien branler fait qu'éloigner la fin  Tu dis qu'on verra bien, tu fais l'malin mais t'es fragile  Comme le dépistage, tu regrettes à l'examen  L'école est un filtre qui rend tout très chiant  Comme les films en noir et blanc, le plus dur, c'est d'rentrer dedans  C'est plus dur quand t'appréhendes, comme ta première fois  J'fais des métaphores sexuelles depuis tout à l'heure parce que tu penses qu'à ça  Dis-toi qu'les latinas sont les plus bonnes du monde  Écoute en espagnol, dis-toi qu'en chimie tu pourrais faire d'la drogue  Arrête d'apprendre par cœur des trucs que t'as pas compris  Et, en philo, t'étais pas censé raconter ta vie  Ah oui, personne t'oblige à fumer d'la weed  En fait, ça marche mieux sur les hyperactifs  Être défoncé, c'est même pas la partie qu'tu préfères  Quand t'es déchiré, tout c'que tu fais, c'est faire semblant d'être clair  La partie qu'tu préfères, c'est partir en bande à Jardiland  Voler du bambou et fabriquer un bong  T'as juste besoin d'une passion  Donc écoute bien les conseillers d'orientation et fais l'opposé d'c'qu'ils diront  En gros, tous les trucs où les gens disent ""tu perds ton temps""  Faut qu'tu t'mettes à fond d'dans et qu'tu t'accroches longtemps  Si tu veux faire des films, t'as juste besoin d'un truc qui filme  Dire ""j'ai pas d'matos ou pas d'contacts"", c'est un truc de victime  On t'dira d'être premier, jamais d'être heureux  Premier, c'est pour ceux qu'ont besoin d'une note, qu'ont pas confiance en eux  T'es au moment d'ta vie où tu peux devenir c'que tu veux  Le même moment où c'est l'plus dur de savoir c'que tu veux  À part traîner avec ta bande  Surtout pas rater la dernière rumeur, le dernier truc marrant  Honnêtement, tu raterais pas grand-chose si tu partais quatre ans  Quoi que, c'est important, fais d'la merde tant qu'il est encore temps  Pour pas qu'un jour tu te réveilles à quarante ans  Genre ""putain, j'vais crever mais j'ai jamais kiffé  Ma famille m'empêche de vivre, j'vais devoir les quitter  Pour sniffer en boîte de nuit, trouver des gamines à vampiriser""  J'en vois plein, donc, petit terroriste, va t'éclater  Sors en soirée même si, j'avoue, tu vas t'faire recaler  Tu rentreras la semaine prochaine ou l'année d'après  D't'façons, t'allais pas baiser, c'soir, si j'dois t'le rappeler  Si tu rentres, prends ton ticket d'vestiaire en photo  Rends-toi compte que tu sais pas boire, t'es mort trop tôt  Quand ça devient une fierté d'te mettre des grandes doses  C'est qu'tu t'attaches à pas grand-chose  Arrête de flipper, si tu veux, va danser  La seule règle sur la piste, c'est fais pas des trucs que t'as jamais tenté  Si jamais tu t'endors en premier dans une soirée  S'regarder dans la glace, c'est la base dès qu'tu viens d'te lever    Au cas où  Ça t'évitera d'passer les repas d'famille avec une bite dessinée sur la joue  Ces repas d'famille où tu t'ennuies, où on parle très fort  Pour dire des choses très banales, déjà, on s'parle et c'est pas mal  Les vérités sont compliquées, les clichés sont stables  Désolé si y a pas que des experts à ta table  Tu bloques sur les défauts des autres, et c'est ton pire défaut  La vie, c'est des cycles, c'est pour ça qu'j'retombe sur les mêmes mots  Sois pas parano sur qui sont tes vrais amis  Y a qu'un seul moyen d'le savoir, laisse le temps faire le tri  J'ai jamais regretté d'demander conseil ni d'appeler quelqu'un  Souvent, tu crois qu'ils sont chelous, c'est juste qu'ça capte pas très bien  La même histoire a plein d'versions  La meilleure façon d'sortir d'une embrouille, c'est d'poser des questions  Arrête de passer ta vie à fuir, angoissé par l'avenir  Parce qu'y a rien à faire pour s'préparer au pire  Comme les attentats, les mauvaises nouvelles frappent quand tu t'y attends pas  Des proches un peu pressés partiront avant toi  Tu verras des gens heureux prendre un appel  Leur visage se décompose et rien n'est plus jamais pareil  Y a rien à faire, à part être présent  Panser les plaies, changer les pansements, le seul remède, c'est l'temps"
50,Paradis,3:49,"Qu'est-ce que j'irais faire au paradis  Quand tu t'endors près de moi?  Qu'il le donne à d'autres, le paradis  Je n'en voudrais pas    Ils disent que, pour tenir un couple, faut l'entretenir tous les jours  Ces connards n'y connaissent rien en amour  Comme si j'devais faire un effort pour t'écouter, comme si j'avais déjà douté  J'aimerais tes défauts si jamais j'arrive à en trouver  Rien n'a bougé depuis nos premiers ""je t'aime""  Ça fait sept ans qu'on sort ensemble depuis deux s'maines (paradis)  Ta peine est ma peine, ma vie est la tienne  Ta famille et la mienne sont la même  J'ai abandonné ces chiennes sur le bord de la route  C'est moi qui devrais avoir des doutes parce que tu les baises toutes  J'comprends pas pourquoi tu t'inquiètes quand tu prends du poids  Pour moi, c'est ça d'pris, ça fait toujours plus de toi (paradis)  Tu serais là, si j'repartais à zéro  À m'rappeler les vraies choses, à calmer mes névroses (paradis)  J'avais un p'tit diable sur mon épaule, maintenant, j'ai ta tête sur mon épaule    Qu'est-ce que j'irais faire au paradis  Quand tu t'endors près de moi?  Qu'il le donne à d'autres, le paradis  Je n'en voudrais pas    Notre amour est la seule vérité  Nos enfants donneront aux Nazis l'envie d'avoir des enfants métissés  Main dans la main, vieux et fripés  On s'rappellera les soirées qu'on faisait tous les deux à fumer des clopes, déchirés  À danser au milieu du salon, tu taffais dans deux heures  Les yeux imbibés d'alcool, déguisés en Chopper  Quand tu t'marrais à mes blagues les plus nulles  Quand on s'donnait des surnoms ridicules  On dit qu'le temps détruit mais l'temps n'est pas notre ennemi  Parce que plus j'te connais et plus j'me sens béni  Assez béni pour t'emmener à l'église  Dire au prêtre ""oublie l'truc où la mort nous sépare, on va rester dans cette vie"" (paradis)  On aura plein d'enfants parce que y'a qu'ça qui compte  On dormira empilés comme des Maximonstres (paradis)  J'vais enfin pouvoir me poser  La réponse à toutes mes questions s'endort à mes côtés    Qu'est-ce que j'irais faire au paradis  Quand tu t'endors près de moi?  Qu'il le donne à d'autres, le paradis  Je n'en voudrais pas    Paradis, paradis  Paradis, paradis, paradis  Paradis, paradis, paradis  Paradis, paradis, paradis  Paradis"
51,La Pluie,2:55,"J'viens d'la France où on danse la chenille  Où on prend plus de caisses que des crash tests dummies  J'ai des potes diplômés, d'autres qu'ont pas lu deux livres  Qui sont sûrement sur un muret, dans les rues du centre ville  Mon père a gravi l'échelle pour devenir c'qu'il voulait être  Ma mère est la ménagère à qui les publicitaires veulent la mettre  J'connais la campagne et ses gros sabots  Où ça vole pas haut, les ragots et les oiseaux    Toujours autant d'pluie chez moi  Toujours autant d'pluie chez moi  Mais il fait quand même beau, il fait beau  Il fait beau, il fait beau, chez moi, il fait beau, il fait beau  Il fait beau, il fait beau  Chez moi, il fait beau    J'viens d'la terre du milieu où y a plein de p'tits vieux  Où l'chômage et la tisane forment un cercle vicieux  Où on critique les invités qui viennent de partir  C'est pas qu'on est lent, c'est qu'on prend notre temps pour réfléchir  J'viens d'la classe moyenne, moyennement classe  Où tout l'monde cherche une place, Julien Clerc dans l'monospace  J'freestylais dans ma tête sur le bruit des essuie-glaces  Y a la pluie en featuring dans toutes mes phrases    Toujours autant d'pluie chez moi  Mais il fait quand même beau, il fait beau  Il fait beau, il fait beau, chez moi, il fait beau, il fait beau  Il fait beau, il fait beau    Chez moi, y a du soleil quarante jours par an  Tu peux passer la plupart de l'année à l'attendre  J'regardais par la fenêtre, enfermé dans ma chambre  J'priais pour la fin d'l'averse et aller faire d'la rampe  J'connais qu'le bruit d'la pluie, l'odeur du béton mouillé  Si j'suis parti, c'est parce que j'avais peur de rouiller  Trempé, j'aurais jamais pensé  Qu'le mauvais temps finirait par me manquer    Il fait quand même beau, il fait beau  Il fait beau, il fait beau, chez moi, il fait beau, il fait beau  Il fait beau, il fait beau mais il fait quand même beau, il fait beau  Il fait beau, il fait beau, chez moi, il fait beau, il fait beau  Il fait beau, il fait beau    Toujours autant d'pluie chez moi  Toujours autant d'pluie chez moi  Toujours autant d'pluie chez moi  Toujours autant d'pluie chez moi  Toujours autant d'pluie chez moi"
52,Quand est-ce que ça s'arrête,2:57,"J'croyais qu'en étant connu, ça résoudrait tous mes problèmes  Fini d'taffer comme un connard et pas pouvoir s'payer un grec  Fini, les bâtards qui me snobbent, les numéros d'meufs avec un mauvais chiffre  Fini, mes parents qui s'demandent comment ils ont raté un fils    Sauf que, maintenant, y'a plus rien d'excitant  J'baise toujours la même meuf depuis six ans  Pas besoin d'nouveaux potes, j'vois d'jà pas les miens  Dans mon répertoire, y'a trente-quatre ""Julien""  Tu m'trouves marrant, dommage, j'en fais pas exprès  J'suis mal à l'aise dans leurs émissions télé  J'me fais siffler comme un iench' ou une meuf bonne  Trop d'merdes à gérer pour écrire l'album    T'aimais mieux quand j'étais moins connu  Sauf que tu m'connaissais pas non plus  J'croyais qu'c'était cool d'être célèbre    Quand est-ce que ça s'arrête?  Quand est-ce que ça s'arrête?  Quand est-ce que ça s'arrête?  Quand est-ce que ça s'arrête?    J'croyais qu'en étant fidèle, ça résoudrait tous mes problèmes  Fini, les remords après la baise et le temps perdu sur le net  Si j'avais Tinder, j'aurais l'das', fini, les techniques de drague de merde  Fini, les connasses qui t'allument et qui sucent du bout des lèvres    Mais si tu savais comment j'm'ennuie maintenant  Dire que, tous les ans, des meufs ont vingt ans  Quand j'vois mes potes, j'sais plus quoi raconter  J'vais plus en soirée car j'ai peur de craquer  J'ai maté trop d'films de boule, ça m'fait plus rien  Ma meuf est cool mais c'est pas pareil, putain  Les mannequins des magasins d'lingerie m'excitent  J'ose plus voir ma bite, ça m'rend nostalgique    Prévenez tous les couples de lesbiennes  J'sais pas quoi faire de tout ce sperme  J'pensais changer quand j'serai honnête    Quand est-ce que ça s'arrête?  Quand est-ce que ça s'arrête?  Quand est-ce que ça s'arrête?  Quand est-ce que ça s'arrête?  Quand est-ce que ça s'arrête?  Quand est-ce que ça s'arrête?  Quand est-ce que ça s'arrête?"
53,San,4:02,"J'suis dans l'premier Mario  À chaque fois, j'crois qu'j'ai fini l'jeu, ça repart à zéro  En plus rapide, en plus dur  J'devais être plus mûr, j'ai dû m'tromper d'futur  J'aimerais retrouver la magie du début  Rien n'fonctionne quand l'cœur n'y est plus  Ça fait mal à la fierté, j'ai du mal à l'admettre  Mais j'ai jamais été aussi perdu  Le monde est un PMU  Où n'importe qui donne son mauvais point d'vue  Où la télé passe des infos déjà vues  Pendant qu'la radio joue des sons qu'on n'écoute même plus  J'essaye de trier, entre les snobs pointus  Et les mongoles incultes, je sais plus où cliquer  J'essaye de feater, rester d'actualité  Sans devenir ma propre télé-réalité  J'veux pas rester figé, piégé  Dans mon personnage comme une prise d'otages à Disney  Mal vieillir comme un vieux punk  Quand tu crois qu't'es Bart mais t'es M. Burns  J'suis pas chez moi dans la capitale  J'continue d'écrire sur une ville où j'habite pas  J'essaie d'être un homme bien mais j'suis plutôt moyen  J'crois qu'j'suis juste un génie du mal  J'regrette mes vieux démons  Roi dans l'mensonge, esclave dans l'vrai monde  Vigilent à chaque seconde  Si j'le laisse seul, mon esprit s'égare dans la pénombre  J'pensais m'lever un matin, être un homme  Sûr que la vie qu'j'ai choisie est la bonne  Fiable, avoir construit quelque chose de stable  J'suis qu'un sale gosse sur un château d'sable  Marre de faire des grands sacrifices pour des p'tites gloires  Sans même savoir savourer la victoire  Mes nuits sont blanches, mes idées noires  C'est comme chaque fois qu'j'ai arrêté d'boire  Et qu'les journées sont plus qu'des gueules de bois  Pourquoi tu veux m'mettre un bébé dans les bras?  J'ai déjà du mal à m'occuper d'moi  J'essaye d'être droit, de faire des choix  De faire plaisir à tout l'monde à la fois  La famille, les amis, les amis de la famille  La famille des amis, les amis des amis  Divertir un public qui m'connaît pas  Peu importe c'qu'ils croient, j'suis toujours à deux doigts  Du craquage, à deux doigts du pétage de cable  T'étonne pas si tu m'vois marcher dans la rue en pyjama    Mais j'craquerai pas  J'craquerai pas, j'craquerai pas  J'craquerai pas    J'pourrai plus m'enfuir  Mon frère a deux enfants, j'veux les voir grandir  J'veux plus faire semblant, plus jamais mentir  J'suis déjà fou, autant rester dans l'délire, haan  J'serai celui qui fait une blague avant d'mourir  Celui qui part dans un fou rire, haan  J'veux laisser mon propre souvenir  Pas faire du sous le mec à la mode en pourri, haan  Les temps changent, les gens changent  Mais j'm'ennuie vite, j'aime le changement  J'étais déjà différent  J'le serai jusqu'à la nuit des temps, vie rapide, mec lent  Avant, j'avais peur d'être pas normal  Quand j'vois les gens normaux, j'suis fier d'être pas normal  Le monde est vénéneux, mon cerveau fait des nœuds  J'me fais à l'idée d'aller jamais mieux  J'voulais écrire pour les haineux, mais j'vais faire mieux  Écrire pour ceux qui m'aiment, eux  C'est toujours pour ma ville quand j'mets l'feu  J'ai tout l'reste de ma vie pour être vieux  Où sont passées les stars de ma jeunesse?  Morts ou devenus des parodies d'eux-mêmes  J'veux jamais faire pareil  Retour vers le futur, j'veux pas rater l'troisième  J'veux faire des chansons d'amour homicide  Qui poussent un célibataire au suicide  J'aimais l'rap avant qu'la hype gentrifie  Vodka, Doliprane, maintenant j'anticipe  J'ai dit ""je t'aime"" à des connasses qui n'en valaient pas la peine  J'ai jamais dit ""je t'aime"" à ma mère  J'veux plus faire marche arrière  J'arrive à peine à la fin du début d'ma carrière  J'ai fait des erreurs, j'ai fait des choses louches  J'ai fait des rappeurs, j'ai fait des fausses-couches  Quand j'disais ""c'est nous, l'futur"", j'parlais d'maintenant  J'parlais d'cet instant, le futur, c'est maintenant  J'ai tous les flows, j'serai jamais sec  Ablaye et Skread, j'vais jamais perdre  On a commencé dans une salle des fêtes  On va devenir c'qu'on voulait être  Merde, j'arrive en Gun Kata  Jeune bâtard, me revoilà  Saitama, punch fatale  J'écris chaque phrase comme si Michael pouvait voir ça  J'laisserai pas la médiocrité m'avoir  J'ai vu assez d'bâtards tristes pour croire au karma  Orelsan, part trois  Le dernier volet d'la saga  ""San"", ça veut dire ""trois""  ""San"", ça veut dire ""monsieur""  San, j'ai mis la moitié d'ma vie pour savoir c'que j'veux  La fête est finie"
54,Tout va bien,2:29,"Dors  Dors    Si le monsieur dort dehors, c'est qu'il aime le bruit des voitures  S'il s'amuse à faire le mort, c'est qu'il joue avec les statues  Et si, un jour, il a disparu, c'est qu'il est devenu millionnaire  C'est qu'il est sûrement sur une île avec un palmier dans sa bière    Tout va bien  Tout va bien  Petit, tout va bien  Tout va bien  Tout va bien  Petit, tout va bien  Tout va bien  Tout va bien    Si la voisine crie très fort, c'est qu'elle a pas bien entendu  Si elle a du bleu sur le corps, c'est qu'elle a joué dans la peinture  Et si, un jour, elle a disparu, c'est qu'elle est partie en lune de miel  En attendant les jours de pluie, elle met ses lunettes de soleil    Tout va bien  Tout va bien  Petit, tout va bien  Tout va bien  Tout va bien  Petit, tout va bien  Tout va bien  Tout va bien    Si les hommes se tirent dessus, c'est qu'y'a des vaccins dans les balles  Et si les bâtiments explosent, c'est pour fabriquer des étoiles  Et si, un jour, ils ont disparu, c'est qu'ils s'amusaient tellement bien  Qu'ils sont partis loin faire une ronde, tous en treillis, main dans la main    Tout va bien  Tout va bien  Petit, tout va bien  Tout va bien  Tout va bien  Petit, tout va bien  Tout va bien  Tout va bien    Dors  Dors"
55,Zone,4:46,"Laissez-moi, j'suis dans ma zone  Laissez-moi, j'suis dans ma zone  Laissez-moi, j'suis dans ma zone  Laissez-moi, j'suis dans ma zone    J'baise ta meuf et j'me fais des pâtes  Pour partir plus vite, j'respecte même pas l'temps d'cuisson  Sous pression, toujours en mission  J'ai rien fait par rapport à mes ambitions  J'veux faire mal, faire un truc viral  En gros, j'veux faire comme les mecs qu'ont inventé l'SIDA  J'veux plus jamais faire les même erreurs  Hanté par le passé, pressé d'avoir Alzheimer  Avant, j'étais mauvais, 'Sky dans les gobelets  Une demie bouteille avant d'aller bosser  Toutes ces conasses à mes côtés  Terroristes sexuelles, elles veulent juste se faire sauter  Ta vie, c'est d'la merde, à qui la faute?  T'es figurant dans l'film de la vie d'un autre  T'assumes pas, tu critiques c'que t'aimes  Combien d'fois tu vas dire qu'j'suis mort avant qu'j'revienne?  Vous rappez comme des rastas blancs  Pourquoi tu rappes comme un rasta blanc?  T'as pris les codes d'une musique et tu l'appliques bêtement  Pendant qu'on va d'l'avant  Tu peux m'trouver dans les rues d'Caen  Avec un mélange où tout l'monde a bu dedans  Entre deux mondes en suspens  C'est criminel, la façon dont j'tue le temps  Nekfeu, Orelsan, Neksan, Orelfeu  Qu'est-ce que t'attendais d'mieux? Étoiles dans les yeux  Yes, j'ai grandi dans l'Ouest  J'ai les même potes qu'à l'époque, nous d'abord et fuck le reste  Yes, j'faisais ça pour le kiff à la base  J'faisais mes clips et mes disques à l'arrache  Mais, comme d'hab', y'a toujours un type qu'a la rage  Un truc de business qui détruira la vibe  Yes, j'ai vu la célébrité comme un mirage  Plus qu'un album et je m'fais refaire l'visage  Histoire de pouvoir retrouver l'même feeling  Qu'à l'époque où j'recopiais les flows d'Dizzee    Laissez-moi, j'suis dans ma zone  Laissez-moi, j'suis dans ma zone  Laissez-moi, j'suis dans ma zone  Laissez-moi, j'suis dans ma zone    Fin d'contrôle, j'avais rien sur moi mais la keuf guette  Elle est mignonne mais elle aura pas la queue d'Ken  Je mets les femmes en confiance comme un club gay  Elles veulent enlever le haut comme un cupcake  Non, mais dis donc, mais dis donc  Tu veux ma confiance, ça met du temps, met du temps  J'ai construit mon empire de mes dix doigts, mes dix doigts  2017, j'attends toujours ma Dido, ma Dido  Y'a comme un décalage entre mon époque et moi  Même à l'école, les professeurs ne comprenaient pas  Comment je pouvais niquer mon avenir, je devais trouver ma voie  J'avais du mal à choisir entre les trois premiers Pokémon  Certaines nuits, je ne savais pas où aller  C'est pas mon genre de mendier  Y'a ceux qui disent ""oui"" mais, quand on me demandait  ""Ken, t'as des ennuis?"", je disais ""non"" comme Wallen  Dans ce siècle, sans la banque, t'as aucune chance  Autant faire la sieste sur la bande d'arrêt d'urgence  La vie, c'est speed, génération 16 bit  Loin des suce bites, tes MCs sans inspi'  ""T'as la pression quand Orel t'invite  Depuis 2011, on t'avait dit que t'aurais ton feat'  Alors on va bien t'niquer si tu tailles pipe  Et tu vas retourner kicker sur des tight beat""  Il nous reste peut-être quelques secondes à vivre  Tu me demandes de mes nouvelles mais c'est qu'une tactique  Dis-moi, pourquoi les gens d’aujourd'hui se contactent-ils  Si c'est pour faire l'amour avec des écrans tactiles?  Tous ingrats, l’état du Monde s'aggrave  Cinq grammes dans le crâne, c'est le saint Graal  Les uns craquent, les autres tiennent mais ça craint, ils obtiennent  Du chagrin qui s’accroît, mais les plaies s'aggravent  Dehors, ça crame, c'est crade, on pense au bien de chacun  J'ai ouvert mes chakras, un peu des miens dans chaque rap, chacal  L'Entourage, Casseurs Flowteurs  Neksan, Orelfeu, Orelfeu, Neksan    Laissez-moi, j'suis dans ma zone  Laissez-moi, j'suis dans ma zone  Laissez-moi, j'suis dans ma zone  Laissez-moi, j'suis dans ma zone    I don’t speak French but whatever he's saying  That work a rasclat flow, I ain't playing  I met him just the other day in L.A  He told me that he had a riddim that he wanted to play  And I should listen, if it’s really something different, okay  Had a suspicion that he wouldn't just go out of his way  Must be official, I don’t really see an issue  What’s the worst that could happen?  Could be another crappy rapper talking about they're in the trap  And all that other skatty shit that they yapping  And then they turned the riddim on, it was snapping  It wasn’t lacking, had me bopping and tapping  I had to jack it, I told them I would definitely back it  I've just got to figure how to attack it  Could be an asset  Can't be just out here making a racket  For the sake of a pay packet, let’s make it a classic  It’s a dirty little beat, it reminds me of The Streets, Mike Skinner and them  I've got that old school feeling again  Two stepping in the ends, gun finger to the ceiling again  I give it a ten out of ten  Told the producer he should send me the stems  Somebody get me a pen  The beat's leng, I can’t even pretend  Give me the microphone and let me what I do best  Give me the microphone and check one, two, three, test  It's all bless, say it with your chest and all the rest  I don’t rest and I’m never gonna settle for less  The success, invest in a flat in the West  Have Jess with the 32F breasts telling me she's very impressed  I digress, took a holler, I messed  But ingest so it’s jiggy I guess"
