,song,time,lyrics
25,Mauvaise Idée,3:21,"Réfléchis,  Réfléchis, prends ton temps  Réfléchis,  Réfléchis, prends ton temps  Réfléchis, prends ton temps  Réfléchis    Han, si tu souffles dans le ballon t'es mort  Si t'accélères ils pourront peut-être pas t'rattraper  Mauvaise idée  T'as l'impression que ta petite copine veut se barrer  Tu cherches à lui faire un enfant pour la garder  Mauvaise idée  Tu veux faire marrer ton beau-père  Tu fais des allusions sur la nuit dans sa fille que t'as passé  Mauvaise idée  Commencer la clope à trente ans  Mauvaise idée  Les mélanges d'alcools différents  Mauvaise idée    Pourtant les gens m'avaient dit  Réfléchis prends ton temps (prends ton temps)  Ça se passe comme ça dans la vraie vie  Jamais comme dans ton plan (jamais)  Pourtant mes parents m'avaient dit  Réfléchis prends ton temps  Mais bien souvent surtout quand je m'ennuie  Je trouve toujours une mauvaise idée    Les texto dans les virages  Chauffer le moteur dans le garage  Les tatouages sur les visages  Hum non!  Les déguisements d'Hitler  Les soirées dans les cimetières  Les roues arrières en hiver  Hum non!  Sortir en boîte avec sa mère  Se servir des dents de devant pour décapsuler sa bière  Dire à son boss ""j'ai plus rien à faire"" (jamais)  Les maillots du PSG sur la Canebière  Le périph en marche-arrière  Écraser sa clope par terre en faisant le plein  La vodka pomme enceinte  L'ordinateur, l'iPhone, le sèche-cheveux dans le bain  Tromper sa meuf lui dire la vérité  Les capotes périmées  À peu près tout ce qui te passe par la tête déchirée  Mauvaise idée    T'es petit tu te réveilles en pleine nuit  Tu rentres dans la chambre de tes parents sans frapper  Mauvaise idée  Ton gosse arrête pas de chialer  Tu mélanges somnifères et Blédina pour kiffer ta soirée  Mauvaise idée  Tu crois faire des rêves prémonitoires  Tu paries la moitié de ton salaire que Caen va gagner  Mauvaise idée  L'entretien d'embauche en survêt  Mauvaise idée  Remettre un coup dans une ex  Mauvaise idée    Pourtant les gens m'avaient dit  Réfléchis prends ton temps (prends ton temps)  Ça se passe comme ça dans la vraie vie  Jamais comme dans ton plan (jamais)  Pourtant mes parents m'avaient dit  Réfléchis prends ton temps  Mais bien souvent surtout quand je m'ennuie  Je trouve toujours une mauvaise idée  Mauvaise idée"
26,La  Morale,4:03,"T'as toujours été le plus populaire de la bande  T'inventais une expression, j'étais fier de la reprendre  Le soir je me sauvais par la fenêtre de ma chambre  Pour aller descendre des bières dans la caisse de ta tante  On était les maîtres de la glande  Comme si la terre nous devait quelque chose  Faudrait peut-être qu'on arrête de l'attendre  Que t'arrête de l'attendre et qu'on se tire autre part  Faire partie des connards moyens c'était notre pire cauchemar  On perdait notre temps à fuir l'avenir  Tirer des plans sur la comète c'est plus facile quand on vit la nuit  Sadique avec une tête d'ange un charisme étrange  T'enchaînais plus de filles que la traite des blanches  Tu voulais devenir basketteur  Et tu t'es découragé quand t'as compris que t'étais pas le meilleur  Un peu comme le reste maintenant tu cherches ta jeunesse face à tes peurs  Sur une montagne d'erreurs    (Ah ah ah ah ah)  J'ai l'impression de faire la morale (ah ah ah ah ah)  Ça m'énerve moi même quand je cause (ah ah ah ah ah)  Mais j'ai l'impression que ça va mal (ah ah ah ah ah)  Même si je peux pas faire grand chose    Combien de wagons, combien de trains t'as raté?  Comment faire pour les rattraper?  Allongé dans quinze mètres carrés  À te demander ou sont passer les dix dernières années  Tu vis sur les aides, tu vis sur les nerfs  Tu supportes plus qu'on te chambre, tu t'énerves  Les jours se ressemblent, tu te réveille  Avec une boule dans le ventre tu fais des tours dans le centre  Comme si y avait des trucs à faire en ville  Tu poses un CV pour avoir la conscience tranquille  Mais t'aurais sûrement plus de chance de trouver du taff en écrivant ton nom sur une feuille blanche  Les filles faciles voulait vivre une passion  Maintenant elles veulent une vie de famille, une situation  Le moindre rendez-vous c'est une mission  Quand ton cerveau ralentit, anéanti par le feignantise    (Ah ah ah ah ah)  J'ai l'impression de faire la morale (ah ah ah ah ah)  Ça m'énerve moi même quand je cause (ah ah ah ah ah)  Mais j'ai l'impression que ça va mal (ah ah ah ah ah)  Même si je peux pas faire grand chose (ah ah ah ah ah)    Tu voudrais changer, te ranger  Difficile d'affronter la vérité  Tes mauvaise habitudes sont presque une fierté  Tes défauts sont devenus ta personnalité  Envie de tout foutre en l'air tu supportes plus la gravité  T'enfonce dans le mensonge tu commences à paniquer  Méfie-toi a qui tu demande du réconfort  Tu pourrais trouver de quoi t'apitoyer sur ton sort    (Ah ah ah ah ah)  J'ai l'impression de faire la morale (ah ah ah ah ah)  Ça m'énerve moi même quand je cause (ah ah ah ah ah)  Mais j'ai l'impression que ça va mal (ah ah ah ah ah)  Même si je peux pas faire grand chose (ah ah ah ah ah)  J'ai l'impression de faire la morale (ah ah ah ah ah)  Ça m'énerve moi même quand je cause (ah ah ah ah ah)  Mais j'ai l'impression que ça va mal (ah ah ah ah ah)  Même si je peux pas faire grand chose (ah ah ah ah ah)    Allô?  Ouais c'est Gringe, ça va?  Ouais, ça va et toi?  Ouais ça va  Eh, dis moi j'ai écouté la chanson d'avant là (Euh?)  Tu parles pas de moi?  Ah! non, le, euh (ah bon?)  Ça te dis qu'on fasse un morceau ensemble? (bah, ouais)  Okay!"
27,La  Petite Marchande de Porte-Clefs,4:17,"Sa mère voulait attendre et la marier  Son père voulait la pendre ou la noyer  Un seul enfant par foyer  Il voulait un garçon  Mais sa connasse de femme a fait le taff qu'à moitié  À la campagne on a besoin d'hommes forts pour travailler  Pas d'une bouche à nourrir, pas d'une pisseuse bonne qu'à chialer  C'est presque impossible de vivre à trois  Une fille unique, c'est perdre son nom de famille, c'est la honte pour un villageois  Qu'est ce qu'il pouvait faire d'un déchet humain?  Lui éclater le crâne entre deux pierres, l'enterrer a côté du chien?  Il partit emprunter une pelle chez son voisin  Mais son voisin lui dit d'attendre, il lui dit qu'il pourrait la vendre    Et la chance leur sourit  Un marchand leur proposa d'acheter l'enfant pour la vendre à des touristes  Ils l'ont lâché pour environ un tiers de SMIC français  Le soir de son départ, mélancolique, sa mère chantait    Elle chantait    Douze ans plus tard la jeune fille dort tranquillement chez son hôte  Son réveil? C'est un grand coup de pieds dans les côtes  Son petit dèj? C'est du pain à la vapeur et de l'eau  Puis direction la salle des machines pour rejoindre les autres  Elle s'est jamais faite adopter par deux riches occidentaux  Son propriétaire l'a élevée, l'a gardée sous le manteau  Neuf dans le même endroit  Sa chambre? Une caisse en bois  À huit ans elle a décroché son premier emploi  Une sorte de garderie où on fabrique des shorts de foot  Avec ses mains en formes de pieds à force de coudre  Avec sa colonne vertébrale en forme de voûte  Vingt minutes de pause déjeuner, un peu de riz, un bol de soupe  Interdiction de parler, à peine le droit de faire des gestes  Elle doit garder la tête baissée pour s'adresser à ses chefs  Le bruit la hante au point qu'elle entend plus quand il s'arrête  Pour pas sombrer dans la folie elle chante cette chanson dans sa tête    Elle chantait    De retour dans son village natal après dix années  En quête d'un cocon familial, à la recherche de son passé  Finalement, son maître lui apprit qui elle était vraiment  Juste avant qu'il aille finir sa vie dans les geôles du gouvernement  Son usine s’étant faite démanteler discrètement  La presse n'étant pas autorisée à couvrir l’événement, bref  La plupart des gens du village avaient levé le camp  Partis loin, ouvrir des restaurants ou divers magasins de vêtements  Pour les rejoindre elle traversa des océans  Frôla la mort, laissant son destin voguer au gré des vents  Sans personne, sans argent, sans carte d'identité  De toute façon elle avait pas de nom, à part «La mendiante bridée»  Après avoir contracté presque toutes les maladies  Elle atterrit miraculeusement à Paris  Je rentrais chez moi après le travail, à la tombée de la nuit  Quand nos regards se sont croisés, elle s'est approchée et m'a dit    Hum, excusez moi Monsieur, Porte-clefs, Deux euros?  Euh non, désolé, j'ai rien sur moi, bonne soirée!    Et je l'entends encore chanter    Elle chantait    Elle chantait"
28,Plus Rien Ne M'étonne,3:38,"Alors  Plus j'avance, plus je gr  Ah je l'ai déjà, je me répète    Y a deux ans je comprenais pas grand chose  Maintenant c'est pire  Depuis quand pour devenir populaire faut faire des trucs de geek  Ils posteraient des sextapes de leurs parents pour plus de clics  Personne trouve de travail fixe même avec un bac +8  Mon livreur de pizza sait réparer des satellites  La mode c'est des cols en V, des pulls, des chemises et des gilets  Les professeurs, les banquiers, les comptables sont devenus stylés  On raconte nos vies à des étrangers pour se sentir exister  Je viens de voir une vieille faire une crise cardiaque (premier réflexe)  Je l'ai tweeté!  Ça me choquerait pas que les insultes dans nos pensées soient bippées  Profilé, à ta sonnerie je connais ta personnalité  Autour de moi la cocaïne parait tellement cliché  Ça me choquerait pas si j'apprenais que mes grands-parents sniffaient    Plus rien ne m'étonne (non non)  Plus rien ne m'étonne (on y va)  Plus rien ne m'étonne (non non)  Plus rien ne m'étonne (on y va)  Plus j'avance et plus je suis blasé    Plus j'avance et plus j'avance et plus j'avance et plus je suis blasé  Plus j'avance et plus j'avance et plus j'avance et plus je suis blasé    Des gens normaux y en a pleins dehors mais je les regarde à la télé  Tu peux être une célébrité et travailler chez ED l'épicier  Plus l'émission m'abrutis plus j'ai envie de la regarder  Ça me poserait pas de problèmes que Direct8 remplace Arté  Les petits vont en cours Guccisés, Louis Vuitonnisés  Bientôt y'aura des carrés VIP dans les lycées  Nos scoots étaient débridés maintenant c'est leur sexualité  Ça me choquerait pas si Marc Dorcel rachetait Walt Disney  Les mères se font lifter, les filles se font plastifier  Bientôt les gamines de huit piges feront du 90B  Ça me choquerait pas de trouver du lubrifiant dans les Kinder  J'ai comme envie de gifler tous ces clones de Justin Bieber    Plus rien ne m'étonne (non non)  Plus rien ne m'étonne (on y va)  Plus rien ne m'étonne (non non)  Plus rien ne m'étonne (on y va)  Plus j'avance et plus je suis blasé    Plus rien ne m'étonne (non non)  Plus rien ne m'étonne (on y va)  Plus rien ne m'étonne (non non)  Plus rien ne m'étonne (on y va)  Plus j'avance et plus je suis blasé    Suis-moi    Elles touchent des bourses pour se payer leurs études  Mais pas celles de l’État  Ils mettraient des caravanes à la fac ça me choquerait pas  Fermez les bibliothèques on a des PS3  Y a des caméras partout vos 15 minutes de gloire m'intéressent pas  Tu connais les pas t’espère que la tecktonik revienne  Tu portes encore des Wayfarer c'est plus la mode depuis deux semaines  On sème la terreur dans le crâne des électeurs  Ça me choquerait pas que Wes Craven fasse le journal de 13 heure  J'ai peur les capacités de mon cerveau diminuent  Docteur ma planète est déréglée comme un oubli de pilule  Je pourrais croiser Michael au prochain coin de rue  Plus rien ne m'étonne j'suis plus assez naïf pour avoir un point de vue    Plus rien ne m'étonne (non non)  Plus rien ne m'étonne (on y va)  Plus rien ne m'étonne (non non)  Plus rien ne m'étonne (on y va)  Plus j'avance et plus je suis blasé    Plus rien ne m'étonne (non non)  Plus rien ne m'étonne (on y va)  Plus rien ne m'étonne (non non)  Plus rien ne m'étonne  Plus j'avance et plus je suis blasé"
29,Raelsan,4:15,"Lève ton verre  Lève ton verre  Lève ton verre  Santé    Je porte un toast à la mort de l'industrie  Sortez les huit six on viens fêter la fin du disque  Écouter la radio c'est devenu un supplice  Sauf que j'aime pas non plus les putains de puristes  Musique rétro futuriste, la bande originale des aventures d'Ulysse  J'habiterais dans les abysses, j'aurais pas plus de pression  Tout ce que je veux, foutre le feu dans ma ville, Néron    Donner mon corps à la science inclus la dissection  Des jours entiers je récite mes leçons  Tourmentés dans une pute qu'est sous rer  Qu'en un an ça m'a saoulé je voulais tout plaqué, quitté le son  J'ai presque abandonné sans faire ma deuxième livraison  Mais bordel j'ai fais le plus dur  Autant tenter un salto avant d'échouer au pied du mur  Je suis de retour avec ma sous-culture  Ouais, sauf que c'est nous le futur, hein, (c'est nous le futur)  Je viens retourner l'opinel entre les points de suture  Ils sont la censure, plus tard on aura l'usure  Plus tard on ira danser sur leur sépulture  Le chant des succubes, au bord de la luxure  Sans concessions les sentiments sont plus pures  Voilà pourquoi j'écris des chansons de rupture  J'essaye de prendre du recul, j'essaye d'avancer  Les gens murmurent j'ai du mal à m'entendre penser  Fils d'extraterrestre, étoile céleste  Je viens féconder une femelle de chaque espèces  J'apprends à contrôler mes sales réflexes, je me fais jouir avant d'écrire  J'en ai marre de parler de sexe  Je sais que ta petite copine n'aime pas mes textes  Mais si j'écoutais toutes les juments je ferais du rap équestre  Ça m'énerve pas je respecte  Je fais comme Rocky dans la réserve, je m'en bas les steaks  J'aimerais faire parti des optimistes  J'aime rapporter une sorte de message positif  Comme l’héroïne dans un test d'urine, comme le dépistage de Freddy Mercury  Je reviens faire du bruit, j'ai le son qui frappe  Skread m'a ordonné d'enfoncer le clou comme Ponce Pilate  Comme Ablaye et Gringe font les bacs on est quatre  Les chevaliers de l'apocalypse on débarque  En an de grâce MJ+1, la moitié de ma jeunesse est morte le vingt-cinq juin  Je continue de faire du chemin pour devenir moi même  Dans l'amour, dans la haine, dans la moyenne  Je resterais pas bloqué dans une parodie de succès  Dans une version d'entourage à petit budgets  Je ferais que ce qui me plaît jusqu'à ma dernière quête  Jusqu’à retourner dans l’hôtel Ri plié des serviette  La peur n'existe plus dans mon dojo, eh eh, j'ai retiré mon Mojo (baby)  Dites à la ménagère qu'on a ressuscité CloClo  Dites aux connards d'intermittents d'allumer les projos  Appelez les pogos, on va déterrer la hache de guerre  Ramener la concurrence à l'age de pierre  Si t'as la fureur de vaincre moi j'ai la rage de perdre  Je prends même plus la peine de répondre à vos clashs de merde  Je prêterais ni mon beuz, ni mon temps  (Ni mon temps) Je verserais ni ma sueur, ni mon sang  (Ni mon sang) Tu parles de moi pour rien dans tes titres  Tu ferais même pas de buzz avec un album antisémite  Merci quand même pour le coup de pub (merci)  Merci les chiennes de garde pour le coup de pute (merci)  Merci à tout ceux qui m'ont soutenus  J'oublie trop souvent de remercier les gens qui m'ont soutenu  Faut qu'on s'offre une nouvelle vie, faut qu'on s'ouvre l'esprit  Faut que les pantins coupe les fils  Prend la route et fuis, j'ai une soucoupe en double file  Je te ramène avec oim, RaelSAn"
30,Si Seul,4:07,"J’attends, pas grand-chose de spécial  Les jours passent et se ressemblent un peu  Tout le temps, la tête dans les étoiles  Des tonnes de personnes défilent sous mes yeux  Pourtant je me sens si seul, hey, hey, hey, hey  Pourtant je me sens si seul, nanana, na nanana  Pourtant je me sens si seul, hey, hey, hey, hey  Pourtant je me sens si seul, nanana, na nanana    Des fois je me sens vraiment bien des fois c’est du bluff  Des fois je fais des blocages, j’parle pas de faire du smurf  Rien de neuf, à part un coup de vieux dans les rues de ma ville  Je dors plus la nuit, je dialogue avec une machine  Je sors de chez moi sous les insultes de ma voisine  Elle a pas de voiture mais sa vie c’est surveiller sa place de parking  Quand je pense qu’elle a traversé le temps pour ça je ressens tellement de pitié  Vieillir me fait vraiment flipper  Quand je grandissais je remplissais des trous avec du vide  Je peux pas devenir le plus intelligent je serai le plus stupide!  Je portais l’adolescence comme un fardeau  Passe-moi une craie blanche je veux plus noircir le tableau  Passe-moi des explosifs une masse ou un marteau  J’en ai marre d’escalader la pyramide de Maslow  Je transpire à grosses goûtes chaque fois que le jour se lève  Je passe mes nuit à courir après mes rêves    J’attends, pas grand-chose de spécial  Les jours passent et se ressemblent un peu  Tout le temps, la tête dans les étoiles  Des tonnes de personnes défilent sous mes yeux  Pourtant je me sens si seul, hey, hey, hey, hey  Pourtant je me sens si seul, nanana, na nanana  Pourtant je me sens si seul, hey, hey, hey, hey  Pourtant je me sens si seul, nanana, na nanana    On passe nos vies dans des files d’attentes  Y a toujours un papier qui manque  (Numéro 4!)  Ça tombe bien j’ai pris le 60!  Les jaloux croient que je suis blindé, c’est pas l’avis de ma banque  Te façon j’habite à Caen, j’entends que la pluie battante  Les Trésors Publics doit être rempli d’amiante  J’ai mal au crâne quand on me demande de remplir mes fiches à temps  Je prends le volant après 15 vodkas je conduis bizarrement  Je parle de Super Mario Kart sur Wii, évidement!  En ce moment je vois moins mes potes qu’à l’époque  Je commence à saturer de raconter les mêmes anecdotes  J’essaye le plus possible de voir mes grands-parents  Je me sens tellement feignant quand j’écoute leurs histoires du temps d’avant  Souvent absent, j’ai la tête ailleurs  Je m’entends parler sans convictions comme si je me voyais de l’extérieur  Toujours 60 minutes de retard au compteur  Tous les soirs je m’égare dans la 25ème heure    J’attends, pas grand-chose de spécial  Les jours passent et se ressemblent un peu  Tout le temps, la tête dans les étoiles  Des tonnes de personnes défilent sous mes yeux  Pourtant je me sens si seul, hey, hey, hey, hey  Pourtant je me sens si seul, nanana, na nanana  Pourtant je me sens si seul, hey, hey, hey, hey  Pourtant je me sens si seul, nanana, na nanana"
31,Suicide Social,5:42,"Aujourd'hui sera le dernier jour de mon existence  La dernière fois que je ferme les yeux  Mon dernier silence  J'ai longtemps cherché la solution à ces nuisances  Ça m’apparaît maintenant comme une évidence  Fini d'être une photocopie  Finies la monotonie, la lobotomie  Aujourd'hui je mettrai ni ma chemise ni ma cravate  J'irai pas jusqu'au travail, je donnerai pas la patte  Adieu les employés de bureau et leurs vies bien rangées  Si tu pouvais rater la tienne, ça les arrangerait  Ça prendrait un peu de place dans leurs cerveaux étriqués  Ça les conforterait dans leur médiocrité  Adieu les représentants grassouillets  Qui boivent jamais d'eau comme s'ils ne voulaient pas se mouiller  Les commerciaux qui sentent l'after-shave et le cassoulet  Mets de la mayonnaise sur leur mallette, ils se la boufferaient  Adieu, adieu les vieux comptables séniles  Adieu les secrétaires débiles et leurs discussions stériles  Adieu les jeunes cadres fraîchement diplômés  Qu'empileraient les cadavres pour arriver jusqu'au sommet  Adieu tous ces grands PDG  Essaie d'ouvrir ton parachute doré quand tu te fais défenestrer  Ils font leur beurre sur des salariés désespérés  Et jouent les vierges effarouchées quand ils se font séquestrer  Tous ces fils de quelqu'un  Ces fils d'une pute snob  Qui partagent les trois quarts des richesses du globe  Adieu les petits patrons  Ces beaufs embourgeoisés  Qui grattent des RTT pour payer leurs vacances d'été  Adieu les ouvriers, ces produits périmés  C'est la loi du marché, mon pote, t'es bon qu'à te faire virer  Ça t'empêchera d'engraisser ta gamine affreuse  Qui se fera sauter par un pompier, qui va finir coiffeuse  Adieu la campagne et ses familles crasseuses  Proches du porc au point d'attraper la fièvre aphteuse  Toutes ces vieilles, ces commères qui se bouffent entre elles  Ces vieux radins et leurs économies de bouts de chandelles  Adieu cette France profonde  Profondément stupide, cupide, inutile, putride  C'est fini, vous êtes en retard d'un siècle  Plus personne n'a besoin de vos bandes d’incestes  Adieu tous ces gens prétentieux dans la capitale  Qui essaient de prouver qu'ils valent mieux que toi chaque fois qu'ils te parlent  Tous ces connards dans la pub, dans la finance  Dans la com', dans la télé, dans la musique, dans la mode  Ces Parisiens, jamais contents, médisants  Faussement cultivés, à peine intelligents  Ces répliquant qui pensent avoir le monopole du bon goût  Qui regardent la province d'un œil méprisant  Adieu les sudistes abrutis par leur soleil cuisant  Leur seul but dans la vie c'est la troisième mi-temps  Accueillants, soi-disant  Ils te baisent avec le sourire  Tu peux le voir à leur façon de conduire  Adieu ces nouveaux fascistes  Qui justifient leurs vies de merde par des idéaux racistes  Devenu néo-nazis parce que t'avais aucune passion  Au lieu de jouer les SS, trouve une occupation  Adieu les piranhas dans leur banlieue  Qui voient pas plus loin que le bout de leur haine au point qu'ils se bouffent entre eux  Qui deviennent agressifs une fois qu'ils sont à 12  Seuls ils lèveraient pas le petit doigt dans un combat de pouce  Adieu les jeunes moyens, les pires de tous  Ces baltringues supportent pas la moindre petite secousse  Adieu les fils de bourges  Qui possèdent tout mais ne savent pas quoi en faire  Donne leur l'Eden ils t'en font un Enfer  Adieu tous ces profs dépressifs  T'as raté ta propre vie, comment tu comptes élever mes fils?  Adieu les grévistes et leur CGT  Qui passent moins de temps à chercher des solutions que des slogans pétés  Qui fouettent la défaite du survêt' au visage  Transforment n'importe quelle manif' en fête au village  Adieu les journalistes qui font dire ce qu'ils veulent aux images  Vendraient leur propre mère pour écouler quelques tirages  Adieu la ménagère devant son écran  Prête à gober la merde qu'on lui jette entre les dents  Qui pose pas de question tant qu'elle consomme  Qui s'étonne même plus de se faire cogner par son homme  Adieu, ces associations bien-pensantes  Ces dictateurs de la bonne conscience  Bien contents qu'on leur fasse du tort  C'est à celui qui condamnera le plus fort  Adieu lesbiennes refoulées, surexcitées  Qui cherchent dans leur féminité une raison d'exister  Adieu ceux qui vivent à travers leur sexualité  Danser sur des chariots, c'est ça votre fierté?  Les Bisounours et leur pouvoir de l'arc-en-ciel  Qui voudraient me faire croire qu'être hétéro c'est à l'ancienne  Tellement tellement susceptibles  Pour prouver que t'es pas homophobe faudra bientôt que tu suces des types  Adieu ma nation, tous ces incapables dans les administrations  Ces rois de l’inaction  Avec leur bâtiments qui donnent envie de vomir  Qui font exprès d'ouvrir à des heures où personne peut venir  Bêh, tous ces moutons pathétiques  Change une fonction dans leur logiciel, ils se mettent au chômage technique  Á peu près le même Q.I. que ces saletés de flics  Qui savent pas construire une phrase en dehors de leur sales répliques  Adieu les politiques, en parler serait perdre mon temps  Tout le système est complètement incompétent  Adieu les sectes, adieu les religieux  Ceux qui voudraient m'imposer des règles pour que je vive mieux  Adieu les poivrots qui rentrent jamais chez eux  Qui préfèrent se faire enculer par la Française des Jeux  Adieu les banquiers véreux  Le monde leur appartient  Adieu tous les pigeons qui leur mangent dans la main  Je comprends que j'ai rien à faire ici quand je branche la 1  Adieu la France de Joséphine Ange-Gardien  Adieu les hippies leur naïveté qui changera rien  Adieu les SM, libertins et tous ces gens malsains  Adieu ces pseudo-artistes engagés  Pleins de banalités démagogues dans la trachée  Écouter des chanteurs faire la morale ça me fait chier  Essaie d'écrire des bonnes paroles avant de la prêcher  Adieu les petits mongoles qui savent écrire qu'en abrégé  Adieu les sans papiers, les clochards, tous ces tas de déchets  Je les hais!  Les sportifs, les hooligans dans les stades  Les citadins, les bouseux dans leur étables  Les marginaux, les gens respectables  Les chômeurs, les emplois stables, les génies, les gens passables  De la plus grande crapule à la Médaille du Mérite  De la première dame au dernier trav' du pays!"
