,song,time,lyrics
138,Yesterday When I Was Young, ,"Yesterday when I was young The taste of life was sweet as rain upon my tongue I teased at life as if it were a foolish game The way the evening breeze may tease a candle flame The thousand dreams I dreamed, the splendid things I planned I always built, alas, on weak and shifting sand I lived by night and shunned the naked light of day And only now I see how the years ran away Yesterday when I was young So many drinking songs were waiting to be sung So many wayward pleasures lay in store for me And so much pain my dazzled eyes refused to see I ran so fast that time and youth at last ran out I never stopped to think what life was all about And every conversation I can now recall Concerned itself with me, and nothing else at all Yesterday the moon was blue And every crazy day brought something new to do I used my magic age as if it were a wand And never saw the waste and emptiness beyond The game of love I played with arrogance and pride And every flame I lit too quickly, quickly died The friends I made all seemed somehow to drift away And only I am left on stage to end the play There are so many songs in me that won't be sung I feel the bitter taste of tears upon my tongue The time has come for me to pay for yesterday when I was young"
139,Ménilmontantw/ Patrick Bruel,3:39,"Ménilmontant mais oui madame  C'est là que j'ai laissé mon cœur  C'est là que je viens retrouver mon âme  Toute ma flamme  Tout mon bonheur    Quand je revois ma petite église  Où les mariages allaient gaiement  Quand je revois ma vieille maison grise  Où même la brise  Parle d'antan    Elles me racontent  Comme autrefois  De jolis contes  Beaux jours passés je vous revois    Un rendez-vous  Une musique  Des yeux rêveurs tout un roman  Tout un roman d'amour poétique et pathétique  Ménilmontant!    Quand midi sonne  La vie s'éveille à nouveau  Tout résonne  De mille échos  La midinette fait sa dînette au bistro  La pipelette  Lit ses journaux    Voici la grille verte  Voici la porte ouverte  Qui grince un peu pour dire ""Bonjour bonjour  Alors te v'là de retour?""    Ménilmontant mais oui madame  C'est là que j'ai laissé mon cœur  C'est là que je viens retrouver mon âme  Toute ma flamme  Tout mon bonheur    Quand je revois ma petite gare  Où chaque train passait joyeux  J'entends encore dans le tintamarre  Des mots bizarres  Des mots d'adieux    Je suis pas poète  Mais je suis ému  Et dans ma tête  Y a des souvenirs jamais perdus  Un soir d'hiver  Une musique  Des yeux très doux les tiens maman  Tout un roman d'amour poétique  Et pathétique  Ménilmontant!"
140,For Me... Formidable,2:23,"You are the one for me, for me, formi, formidable  You are my love, very, very, véri, véritable  Et je voudrais un jour enfin pouvoir te le dire  Te l'écrire  Dans la langue de Shakespeare    My daisy, daisy, dési, désirable  Je suis malheureux  D'avoir si peu de mots à t'offrir en cadeau  Darling I love you, love you, darling, I want you  Et puis c'est à peu pres tout  You are the one for me, for me, formi, formidable    You are the one for me, for me, formi, formidable  But how can you see me, see me, si mi, si minable  Je ferais mieux d'aller choisir mon vocabulaire  Pour te plaire  Dans la langue de Molière    Toi, tes eyes, ton nose, tes lips adorables  Tu n'as pas compris  Tant pis, ne t'en fais pas et  Viens-t'en dans mes bras  Darling I love you, love you, darling, I want you  Et puis le reste, on s'en fout  You are the one for me, formi, formidable    Je me demande même pourquoi je t'aime  Toi qui te moque de moi et de tout  Avec ton air canaille, canaille, canaille  How can I love you?"
141,La Critique,5:03,"Ils sont là tranquilles sans la moindre bile lorsque l'on panique et que mort de trac tous nos membres claquent devant le public avec un air sombre ils guettent dans l'ombre armés d'un stylo quoi qu'on dise ou fasse de notre cuirasse le moindre défaut  de gauche ou de droite ceux que l'on mandate pour faire un papier n'ont je le présume pas trempé leur plume dans un bénitier et que peut-on faire  pauvre pot de terre vulnérable et seul lorsque l'on en crève rengainer ses rêves et fermer sa gueule  la critique, la critique on a beau dire au fond que l'on s'en contrefout la critique, la critique vous détruit le moral et vous en fout un coup  frappé de névrose en lisant ces proses qui sauf exception ressemblent oh surprise a des entreprises de démolition si certains paniquent et neurasthéniques consultent des psys d'autres se libèrent remuent ciel et terre étant dieu merci  du genre opiniâtre sont prêts à se battre et pour être mieux cherchent un autre style changent de profil plantent des cheveux Ça ne change guère il reste une guerre de papier journal fait de mots qui touchent là où ça fait mouche là où ça fait mal  la critique, la critique on a beau dire au fond que l'on s'en contrefout la critique, la critique vous détruit le moral et vous en fout un coup  sorti du calvaire des années galères de crève-la-faim des galas sordides des soirées à bides lorsqu'on voit enfin son nom qui se niche en haut de l'affiche Ça fait chaud au coeur puis vient la première où faut se les faire contrôlant sa peur  après la soirée les dés sont jetés déjà dans le hall c'est fait de silence inquiétant et dense miel ou vitriol que ce soit le sacre ou bien le massacre faudra faire avec se dit en coulisses l'artiste au supplice sans un poil de sec  la critique, la critique on a beau dire au fond que l'on s'en contrefout la critique, la critique vous détruit le moral et vous en fout un coup  mais dis-toi que puisque tu as pris tes risques t'as choisi ton bord il te faut admettre que le sien est d'être même s'il a tort celui qui informe même s'il déforme souvent ta pensée chacun sa manière et son savoir-faire chacun son métier  les articles passent d'autres prennent place dans les quotidiens ainsi va la vie nul ne s'en soucie nul ne s'en souvient quand l'artiste en scène joue et se démène rien n'est important adieu la critique salut le public bravo le talent  la critique, la critique qu'elle vous porte aux nues ou en trois mots vous tue la critique, la critique donne son unique opinion qu'est pas forcément du béton en fin de compte, seul le public a raison"
142,Des Mots,3:02,Des mots pour parler de ces mots  Pour parler fort pour parler haut  Des mots prononcés pour l'histoire  Des mots sortis de la mémoire    Des mots charmants  Des mots d'enfants  Des mots pour papa et maman    Des mots nouveaux de dictionnaire  Des mots en langues étrangères  Des mots écrits des petits mots  Des mots crachés qui font gros mots    Des mots des mots toujours des mots  Il faudrait se méfier des mots    Des mots pour jouer avec les mots  Des mots riches et des mots idiots  Des mots pour mentir sans vergogne  Des mots tendres et des mots qui cognent    Des mots insensés ou abscons  Des mots savants ou des mots cons  Des mots chuchotés à la messe  Et des mots pour parler de fesses    Des mots pour aider son prochain  Des mots pour vendre son voisin  Des mots des mots toujours des mots  Il faudrait se méfier des mots    Des mots pour rassurer parfois  Des mots semant le désarroi  Des mots chantant des mots intimes  Des mots cruels qui poussent au crime    Des mots snobs et des mots d'argot  Des mots tranchants comme un couteau  Des mots auquel le coeur succombe  Des mots prononcés sur les tombes    Des mots vides et des mots ronflants  Des mots qui détruisent les gens  Des mots des mots toujours des mots  Il faudrait se méfier des mots    Des mots perfides et sentencieux  Des mots pour s'adresser à Dieu  Des mots qui restent symboliques  Des mots pour les nuits érotiques    Des mots qu'on voudrait oublier  Des mots très durs à prononcer  Des mots qui vous envoient vous battre  Des mots prestigieux de théâtre    Des mots simples des mots d'amour  Des mots rimant avec toujours  Des mots des mots toujours des mots  Il faudrait se méfier des mots
143,On S'Éveille à La Vie,3:29,On s'éveille à la vie Quand apparaît l'amour Sur la terre endormie La nuit fait place au jour Je vivais les yeux fermés Je cheminais sans but Comme si je m'éveillais Dans un monde inconnu Quelle métamorphose En trouvant le bonheur Je souris à des choses Je parle avec mon coeur Et découvre chaque jour Des rêves par milliers On s'éveille à la vie Quand l'amour apparaît Les ruisseaux font rouler Leurs rires en cascades La nature étonnée Laisse éclater sa joie  Et parfume le vent Qui chante son aubade Au soleil se levant Pour la première fois On s'éveille à la vie Quand apparaît l'amour Sur la terre endormie La nuit fait place au jour Je vivais les yeux fermés Je cheminais sans but Comme si je m'éveillais Dans un monde inconnu Quelle métamorphose En trouvant le bonheur Je souris à des choses Je parle avec mon coeur Et découvre chaque jour Des rêves par milliers On s'éveille à la vie Quand l'amour apparaît
144,Gosse de Paris, ,"Gosse de Paris   Pour s'embrasser   Nous n'avions pas de chambre   Pas de sous   Pas même un lit   Même cassé   Juste un coin d'herbe verte   Loin de tout   Mais c'était là que dans la nuit   Nous entendions crier les grands trains fous   Courant vers l'inconnu, courant sans nous   En emportant nos cœurs jusqu'aux îles     Gosse de Paris   On a pleuré   Sur le quai d'une gare   Mon amie   En dénouant   Nos mains, serrées   Sur toute une romance   De Paris     J'aurai pas dû m'en aller   J'aurai pas dû te laisser   Il fallait nous contenter   D'un bonheur de quatre sous     Rien qu'à toi   Rien qu'à moi   Rien qu'à nous   Tu sais   Gosse de Paris   C'était promis   Ni mon cœur   Ni mes lèvres   N'ont menti   Si je ne t'ai jamais écrit   C'est que la bonne étoile   M'a trahie   Crois moi j'ai fait ce que j'ai pu   Mais nous ne verrons pas l'île au trésor   Bien trop d'années me sont tombés dessus   Trop de temps loin de toi mais qu'importe     Gosse de Paris   Gosse de ma rue   Ombre parmi les ombres   Du faubourg   Je t'aime encore   Amie perdue   De ma première enfance   Mon amour"
145,Ville, ,"Un jour j'ai quitté mon village  Pour la ville, et en arrivant  J'ai cru qu'une main de géant  Venait de frapper mon visage  La ville dansait à mes yeux  Comme un ballet exceptionnel  Réglé par les forces du ciel  Animé par le feu de Dieu, feu de Dieu  De la terre semblaient jaillir  Les accords d'une symphonie  Composée de sons et de bruits  De larmes, de cris et de rires  Et des feux rouges, jaunes et verts  S'allumaient pour réglementer  La marche plus ou moins pressée  De tout un monde bariolé  Des uniformes battaient la mesure avec un bâton blanc  Dirigeant le grand trafic de cette masse en mouvement  Ce monstre gris à mille bouches appelé métropolitain  Semblait happer ou rejeter l'immense flot humain  Je pensais attention, attent-oin, la ville est une étrange dame  Dont le cœur à le goût du drame  Elle est sans feu, elle est sans âme  Elle est comme un gouffre sans fond  Et je restais émerveillé  De ce que j'avais découvert  Cœur battant, les yeux grands ouverts  Avec l'impression de rêver, éveillé  Sans savoir que je pénétrais  Dans le temple des illusions  Entraîné dans un tourbillon  Insensé  Quand dans la houle incessante  De la foule puissante  Une fille avec un teint de plâtre  M'a dit, viens, toi qui porte en ton cœur  Les eaux fortes d'ailleurs  Sans regrets entre dans mon théâtre  Moi dans l'atroce cohue  Comme un gosse perdu  Croyant que c'était ma providence  Je l'ai suivie tout le jour  Mais dans ma nuit d'amour  Elle a ri, elle a ri, elle a ri  Attention, attention, la ville est une étrange dame  Dont le cœur a le goût du drame  Elle est sans feu, elle est sans âme  Elle a brisé mes illusions  Adieu, ma ville au cœur cruel  Faux paradis pour malheureux  Qui me jetait la poudre aux yeux  Pour m'empêcher de voir le ciel, réel  Et dans le froid du petit jour  Si je repars désemparé  C'est dans l'espoir de retrouver  Ma maison  Mon soleil  Mes amis  Mes amours"
146,Hier Encore,2:20,"Hier encore, j'avais vingt ans, je caressais le temps  J'ai joué de la vie  Comme on joue de l'amour et je vivais la nuit  Sans compter sur mes jours qui fuyaient dans le temps  J'ai fait tant de projets qui sont restés en l'air  J'ai fondé tant d'espoirs qui se sont envolés  Que je reste perdu, ne sachant où aller  Les yeux cherchant le ciel, mais le cœur mis en terre    Hier encore, j'avais vingt ans, je gaspillais le temps  En croyant l'arrêter  Et pour le retenir, même le devancer  Je n'ai fait que courir et me suis essoufflé  Ignorant le passé, conjuguant au futur  Je précédais de moi toute conversation  Et donnais mon avis que je voulais le bon  Pour critiquer le monde avec désinvolture  Hier encore, j'avais vingt ans mais j'ai perdu mon temps  À faire des folies  Qui me laissent au fond rien de vraiment précis  Que quelques rides au front et la peur de l'ennui  Car mes amours sont mortes avant que d'exister  Mes amis sont partis et ne reviendront pas  Par ma faute j'ai fait le vide autour de moi  Et j'ai gâché ma vie et mes jeunes années  Du meilleur et do pire en jetant le meilleur  J'ai figé mes sourires et j'ai glacé mes pleurs  Où sont-ils à présent?  À présent  Mes vingt ans"
147,Je Bois,3:09,"Je bois pour oublier mes années d'infortune  Et cette vie commune  Avec toi mais si seul  Je bois pour me donner l'illusion que j'existe  Puisque trop égoïste  Pour me péter la gueule  Et je lève mon verre à nos cœurs en faillite  Nos illusions détruites  À ma fuite en avant  Et je trinque à l'enfer qui dans mon foie s'impose  En bouquet de cirrhose  Que j'arrose en buvant  Je bois jour après jour à tes fautes, à mes fautes  Au temps que côte à côte  Il nous faut vivre encore  Je bois à nos amours ambiguës, diaboliques  Souvent tragi-comiques  Nos silences de mort  À notre union ratée, mesquine et pitoyable  À ton corps insatiable  Roulant de lit en lit  À ce serment, prêté la main sur l'évangile  À ton ventre stérile  Qui n'eut jamais de fruit  Je bois pour échapper à ma vie insipide  Je bois jusqu'au suicide  Le dégoût, la torpeur  Je bois pour m'enivrer et vomir mes principes  Libérant de mes tripes  Ce que j'ai sur le cœur  Au bonheur avorté, à moi et mes complexes  À toi, tout feu, tout sexe  À tes nombreux amants  À ma peau boursouflée, striée de couperose  Et à la ménopause  Qui te guette au tournant  Je bois aux lois bénies de la vie conjugale  Qui de peur du scandale  Poussent à faire semblant  Je bois jusqu'à la lie, aux étreintes sommaires  Aux putes exemplaires  Aux froids accouplements  Au meilleur de la vie qui par lambeaux nous quitte  À cette cellulite  Dont ton corps se rempare  Au devoir accompli comme deux automates  Aux ennuis de prostate  Que j'aurai tôt ou tard  Je bois à en crever et peu à peu j'en crève  Comme ont crevé mes rêves  Quand l'amour m'a trahi  Je bois à m'en damner le foie comme une éponge  Car le mal qui me ronge  Est le mal de l'oubli  Je m'enivre surtout pour mieux noyer ma peine  Et conjurer la haine  Dont nous sommes la proie  Et je bois comme un trou qu'est en tout point semblable  À celui que le diable  Te fait creuser pour moi  Je bois mon Dieu, je bois  Un peu par habitude  Beaucoup de solitude  Et pour t'oublier toi  Et pour t'emmerder toi  Je bois, je bois"
148,Au Creux de Mon Épaule, ,"Si je t'ai blessée  Si j'ai noirci ton passé  Viens pleurer au creux de mon épaule  Viens tout contre moi  Et si je fus maladroit  Je t'en prie, chérie, pardonne-moi    Laisse ta pudeur  Du plus profond de ton coeur  Viens pleurer au creux de mon épaule  Oublie si tu peux  Nos querelles d'amoureux  Et, chérie, nous pourrons être heureux    Ô, mon amour  Ne m'enlève pas le souffle de ma vie  Ni mes joies  Pour ce qui ne fut qu'un instant de folie    Ne dis pas adieu  Nous serions trop malheureux  Viens pleurer au creux de mon épaule    Car si tu partais  Si mon bonheur se brisait  Mon amour, c'est moi qui pleurerais    Ô, ô mon amour  Ne m'enlève pas le souffle de ma vie  Ni mes joies  Pour ce qui ne fut qu'un instant de folie    Ne dis pas adieu  Nous serions trop malheureux  Viens pleurer au creux de mon épaule  Car si tu partais  Si mon bonheur se brisait  Mon amour, c'est moi qui pleurerais"
149,O ! Toi la Vie, ,"Ô toi! la vie   Que je porte en souffrant   Comme on porte un enfant   Donne-moi l'amour et l'argent   Ma vie   Aux voies impénétrables   Fais que de grain de sable   Je deviens géant     Ô toi! la vie   Dont je ne connais rien   Qui fuit entre mes mains   J'appréhende tes lendemains   Ma vie   J'ai peur de ta jeunesse   Un matin disparaisse   Me laissant sur ma faim   Tu sais la vie   Je ne t'ai pas cherchée   C'est toi qui t'es donnée     Comme une fille en mal d'aimer   Je peux depuis   Me vautrer dans tes bras   Faire un feu de tes joies   Et l'amour avec toi     La vie   Pour te serrer très fort   Et réchauffer mon corps   Et te garder longtemps encore   Je suis   Un enfant de la terre   Un passant solitaire   Aux mains tendues vers toi   Ne m'abandonne pas   Tu sais, je crois en toi   En toi   La vie"
150,Tu Exagères, ,"Tu exagères Tu en fais trop C'est pourquoi je n'ai jamais pu, comme il faut, Séparer tes qualités de tes défauts Tant ils se mêlent et se confondent  Y a rien à faire Tu vas et viens Tu te fatigues et te donnes un mal de chien Je suis pour toi plus un enfant qu'un mari Et ton amour tourne à la tyrannie  Tu exagères Toute l'année, Quand tu me fais des petits plats mijotés Et te régales à me regarder manger Ces repas pantagruéliques  Si je tempère Mon appétit,  Tu deviens triste, alors, pour être gentil Sachant que dans un instant tu vas pleurer, Je reprends de tout, tout, tout, quitte à en crever  Tu exagères Tu vas trop loin Lorsque tu cires tes parquets, le matin Tu m'obliges à marcher avec des patins Qui me font perdre l'équilibre  Tu fais les poussières Bats les tapis Ne pouvant être ni debout ni assis Si je m'étends pour te laisser travailler Tu viens alors battre les oreillers  Tu exagères C'est insensé, Si par hasard j'ai le malheur de tousser L'instant d'après je me retrouve couché Avec le dos plein de ventouses  Telle un cerbère Tu veilles au grain, Le thermomètre à la portée de la main Tu me fais prendre, que je le veuille ou non, D'horribles trucs de ta composition  Tu exagères Depuis toujours, Y a donc pas de raison que tu cesses un jour Pourtant, pour moi, ne change rien, mon amour Car c'est pour tout ça que je t'aime  Ton caractère, Ta bonne humeur, Ta fraîcheur d'âme et tes qualités de coeur Font que, dans la vie, je ne m'ennuie jamais Tu exagères, mon coeur, tu exagères, je sais Tu exagères mais... ça me plaît !"
151,Autobiographie,9:04,"J'ai ouvert les yeux sur un meublé triste Rue Monsieur Le Prince au Quartier Latin Dans un milieu de chanteurs et d'artistes Qu'avaient un passé, pas de lendemain Des gens merveilleux un peu fantaisistes Qui parlaient le russe et puis l'arménien  Si mon père était chanteur d'opérette Nanti d'une voix que j'envie encore Ma mère tenait l'emploi de soubrette Et le troupe ne roulait pas sur l'or Mais ma sœur et moi étions à la fête Blottis dans un coin derrière un décor  Tous ces comédiens chargés de famille Mais dont le français était hésitant Devaient accepter pour gagner leur vie Le premier emploi qui était vacant Conduire un taxi ou tirer l'aiguille Ça pouvait se faire avec un accent  Après le travail les jours de semaine Ces acteurs frustrés répétaient longtemps Pour le seul plaisir un soir par quinzaine De s'offrir l'oubli des soucis d'argent Et crever de trac en entrant en scène Devant un public formé d'émigrants  Quand les fins de mois étaient difficiles Quand il faisait froid, qui le pain manquait On allait souvent honteux et fébrile Au Mont de piété où l'on engageait Un vieux samovar, des choses futiles Objets du passé, auxquels on tenait  On parlait de ceux morts près du Bosphore Buvait à la vie, buvait aux copains Les femmes pleuraient et jusqu'aux aurores Les hommes chantaient quelques vieux refrains Qui venaient de loin, du fond d'un folklore Où vivaient la mort, l'amour et le vin  Nous avions toujours des amies à table Le peu qu'on avait on le partageait Mes parents disaient: « Ce serait le diable Si demain le ciel ne nous le rendait « Ce n'est pas là geste charitable: Ils aimaient les autres et Dieu nous aidaient  Tandis que devant poêles et casseroles Mon père cherchait sa situation Jour et nuit sous une lampe à pétrole Ma mère brodait pour grande maison Et nous avant que d'aller à l'école Faisions le ménage et les commissions  Ainsi je grandis sans contrainte aucune Me soûlant la nuit, travaillant le jour Ma vie a connu diverses fortunes J'ai frôlé la mort, j'ai trouvé l'amour J'ai eu des enfants qui m'ont vu plus d'une Fois me souvenir le coeur un peu lourd  Rue Monsieur Le Prince au Quartier Latin Dans un milieu de chanteurs et d'artistes Qu'avaient un passé, pas de lendemain Des gens merveilleux un peu fantaisistes Qui parlaient le russe et puis l'arménien"
152,Rentre Chez Toi et Pleure, ,"Rentre chez toi et pleure   Moi j'ai tant pleuré pour toi   J'en ai passé des heures   À me tourmenter   Sans pouvoir t'oublier     Laisse couler tes larmes   Ton grand chagrin sur tes joues   La vie a tant de charme   Qu'elle effacera tout     Peines d'amour sont brèves   Ce n'est qu'un mauvais rêve   Dont tu t’éveilleras   Crois-moi     Laisse crier ta peine   Demain c'est un cri de joie   Qui brisera tes chaînes   Te ramenant vers moi   Rentre chez toi et pleure   Pleure, pleure"
153,L' Amour a Fait de Moi,2:09,"J'entendais depuis mon jeune âge   Mon papa qui me disait   Prends bien garde aux femmes volages   À l'amour et ses attraits   J'avais ça dans la mémoire   Je me croyais le plus fort   Mais depuis hier quelle histoire   J'ai changé mon sort     L'amour a fait de moi un amoureux madame, madame   L'amour a fait de moi, c'est merveilleux, madame, madame   Il a fait de moi tout ce qu'il a voulu   Quand j'y pense je ne me reconnais plus   Non plus     L'amour a fait de moi votre valet madame, madame   L'amour a fait de moi un adepte de plus   Qui se promène simplement en rêvant dans les rues   L'amour a fait de moi un amoureux de plus     Je vais comme un somnambule   Répétant votre prénom   Les passants que je bouscule me disent   ""Alors quoi faites attention""   Je ne sais ce qu'il se passe   Je crois vous voir à chaque pas   Et les femmes que j'embrasse   Je ne les reconnais pas     L'amour a fait de moi un amoureux madame, madame   L'amour a fait de moi, c'est merveilleux, madame, ah madame   Il a fait de moi tout tout tout ce qu'il a voulu   Quand j'y pense je ne me reconnais plus   Non plus   L'amour a fait de moi votre valet madame   L'amour a fait de moi un adepte de plus   Qui se promène simplement en rêvant dans les rues   L'amour a fait de moi, oui   L'amour a fait de moi, ah   L'amour a fait de moi   Un amant plein de joies"
154,Le Palais de Nos Chimères,2:19,"Nous nous sommes mariés par un jour de printemps  Sans prêtre, sans mairie, sans amis, ni parents  Nous n'avions tout au plus elle et moi que vingt ans  Mais un désir d'adulte brûlait nos cœurs d'enfants    L'amour en une nuit émancipa nos cœurs  Nous étions enlacés tout honteux de bonheur  Dans nos yeux agrandis ne passait nulle peur  Car la jeunesse rit quand l'enfance se meurt    Le palais de nos chimères  Nous l'avions bâti sur l'horizon  Et nous ceinturions la terre  Elle et moi, comme des vagabonds    Pour s'abreuver à la source  De l'amour cet éternel printemps  Nous nous partagions la mousse  Du château de la rose des vents    À présent je suis seul je marche toujours  Mais quand je sentirai venir mon dernier jour  Sur la tombe où déjà repose mon amour  Heureux j'irai m'étendre et mourir à mon tour    Et sous la même croix nos deux corps dormiront  Nos yeux seront cernés par le même horizon  Et de la même terre nos bouches s'empliront  Quand pour l'éternité nos âmes s'uniront    Le palais de nos chimères  A croulé avec mes illusions  Et sous le poids de ses pierres  Se lézarde un coeur de vagabond    Mon passé qui me domine  Me pousse à errer par tous les temps  Et dormir parmi les ruines  Du château de la rose des vents"
155,You Make Me Feel so Youngw/ Frank Sinatra,3:05,You make me feel so young  You make me feel as though spring has sprung  And every time I see you grin  I'm such a happy individual    The moment that you speak  I want to go and play hide and seek  I wanna go and bounce the moon  Just like a toy balloon    You and I  Are just like a couple of tots  Running across a meadow  Pickin' up lots of forget me nots    You make me feel so young  You make me feel there are songs to be sung  Bells to be rung  And a wonderful fling to be flung    And even when I'm old and gray  I'm going to feel the way I do today  Because you make me feel so young    You make me feel so young  You make me feel as though spring has sprung  And every time I see you grin  I'm such a happy individual    The moment that you speak  I want to go and play hide and seek  I wanna go and bounce the moon  Just like a toy balloon    You and I  Are just like a couple of tots  Running across a meadow  Pickin' up lots of forget me nots    You make me feel so young.  You make me feel there are songs to be sung  Bells to be rung  And a wonderful fling to be flung    And even when I'm old and gray  I'm going to feel the way I do today  Because you make me feel so young
