,song,time,lyrics
0,Les Amantsw/ Édith Piaf, ,"LES AMANTS  Quand les amants entendront cette chanson C'est sûr ma belle, c'est sûr qu'ils pleureront Ils écout'ront les mots d'amour que tu disais Ils entendront ta voix d'amour quand tu m'aimais Quand tu croyais Que tu m'aimais Que je t'aimais Que l'on s'aimait Quand les amants entendront cette chanson C'est sûr ma belle c'est sûr qu'ils pleureront.  COUPLET (Récitatif)  J'entends toujours, j'entends ton rire Quand quelque fois je te disais si un jour tu ne m'aimais plus Si un jour je ne t'aimais plus Tu répondais c'est impossible Et tu riais, et tu riais Et bien tu vois, tu n'aurais pas dû rire  Quand les amants entendront cette chanson C'est sûr ma belle, c'est sûr qu'ils pleureront Ils écout'ront les mots d'amour que tu disais Ils entendront ta voix d'amour quand tu m'aimais Quand tu croyais Que tu m'aimais Que je t'aimais Que l'on s'aimait Quand les amants entendront cette chanson C'est sûr ma belle c'est sûr qu'ils pleureront."
1,Eteins La Lumière,3:45,"Éteins la lumière Viens contre mon coeur Que mes bras te serrent Prennent ta tiédeur Que la nuit entière Nous comble de joie Éteins la lumière Rampe contre moi  Éteins la lumière Tire les rideaux Coule sur la terre Faible de ma peau Deviens la rivière La source d'amour Qui me désaltère Jusqu'au petit jour A l'heure où tout sombre Et devient murmure A l'heure où les ombres  Se collent au mur Dans la chambre sombre Mordons dans le fruit De ces joies sans nombre Qui vivent la nuit  Éteins la lumière Love-toi sur moi Que l'amour éclaire Nos tendres ébats Et nous pourrons faire Détachés du temps Le doux inventaire De nos sentiments  Éteins la lumière Dans l'obscurité Mes mains qui te serrent Vont remodeler Ton front, tes paupières Tes lèvres et ton cou Éteins la lumière La nuit est à nous  Éteins la lumière Couvre nos folies D'un peu de mystère D'un peu de magie Laisse tes chimères Sombrer tendrement Dans l'aimable guerre Que font les amants  A l'heure où les choses Semblent délaissées A l'heure où la rose Attend la rosée Le bonheur propose Ses rêves pour deux Et l'amour s'impose Pour les amoureux  Éteins la lumière Pour dans la grandeur Extraordinaire De notre bonheur N'être que matière N'être que pensée Éteins la lumière Viens, on va s'aimer"
2,Quand Tu Vas Revenir,2:10,"Quand tu vas revenir Tout va refleurir Et je vais renaître Quand au bout du chemin Me tendant les mains Tu vas apparaître Moi je vais courir, courir Sur la route Me jeter dans tes bras Sur la route Me serrer contre toi Et sans doute Rire et pleurer de joie Joie de t'avoir enfin Pour ces lendemains Qui se désespèrent Joies de te retrouver Et de te garder Pour ma vie entière Quand l'amour reviendra  Que l'on entendra A nouveaux des rires Mon coeur au bois dormant S'éveillera quand Tu vas revenir Quand tu vas revenir Bâtir l'avenir Qui dort dans nos têtes Quand tu vas pour toujours Donner à l'amour Un air de conquête Moi je vais crier, crier Que je t'aime Pour que tu saches bien Que je t'aime Et dire à mon destin Que tu m'aimes Puisque tu me reviens Viens, viens toi pour qui les nuits J'implore et je prie La force éternelle Viens crever l'horizon Vers notre maison Où j'attends fidèle Car pour combler mon coeur Je veux le meilleur J'ai vécu le pire Mes maux et mes tourments S'effondreront quand Tu vas revenir"
3,Ne Dis Rien,2:13,"Ne dis rien   Mais reste contre moi encore   Ne dis rien   Mais laisse-moi serrer ton corps   Que j'adore   Ne dis rien   Et si tu vois poindre l'aurore   Ne dis rien   Oublie tout on est trop bien     On est trop bien dans le silence   Avec les gestes de l'amour   Trop bien pour reprendre conscience   Avec le jour   Demain commence la semaine   Qui nous verras compter les nuits   Avant que la vie nous ramène   Au paradis     Ne dis rien   Mais reste contre moi encore   Ne dis rien   Mais laisse-moi serrer ton corps   Que j'adore   Ne dis rien   Et si tu vois poindre l'aurore   Ne dis rien   Oublie tout on est trop bien     On est trop bien l'un contre l'autre   Au bout du monde bien caché   Dans l'univers qu'on a fait nôtre   Pour mieux s'aimer   Pour mieux s'aimer à tête folle   À cœur troublé, à corps perdu   Sans échanger une parole   Superflue     Ne dis rien   Mais reste contre moi encore   Ne dis rien   Mais laisse-moi serrer ton corps   Que j'adore   Ne dis rien   Et si tu vois poindre l'aurore   Ne dis rien   Oublie tout on est trop bien"
4,Si tu m'emportes,2:22,"Si tu m'emportes dans le torrent de joies De la jeunesse qui s'éveille et parle en toi Je pourrai sans mesure Me baigner dans l'eau pure Et blanche de ton corps  Si tu m'emportes dans ton printemps nouveau J'y cueillerai la fleur sauvage de ta peau Avant que de m'étendre Au jardin des mots tendres Et fort comme la mort  Rien que toi et moi La nuit, le jour Rien que toi et moi Et pour toujours Rien que toi et moi Nous et notre amour Nous et notre amour  Si tu m'emportes sur le bateau léger De tes espoirs et de tes rêves insensés J'amènerai la voile Et nous ferons escale Aux rives du bonheur  Si tu m'emportes dans le désert brûlant Où naissent les folies de ton âme d'enfant J'y bâtirai un monde Pour qu'à chaque seconde On vive coeur à coeur  Rien que toi et moi La nuit, le jour Rien que toi et moi Et pour toujours Rien que toi et moi Nous et notre amour Nous et notre amour  Mais que tu m'emportes vers le printemps, la mer Dans le torrent de tes idées ou le désert Qu'importe où tu m'emportes, mais verrouilles la porte Et viens, viens contre moi Emporte-moi"
5,C'Est Fini,2:44,Je ne peux détacher  Mes yeux de ton visage  Et ne peux m'empêcher  De penser à demain  Qui s'annonce déjà  Comme un mauvais orage  Qui lavera nos rires  A l'eau de mon chagrin    J'ai le cœur déchiré  Et j'ai mal de comprendre  Que les mots que tu dis  Veulent tous dire adieu  Je regarde sans voir  J'écoute sans entendre  Le chagrin me surprend  Debout silencieux    Je rêve de passé  Quand le présent t'emporte  Qu'il ne me reste plus  Qu'à te serrer la main  Je voudrais la garder  Mais nos amours sont mortes  A deux pas de mon cœur  Tu es déjà si loin    C'est fini fini fini fini fini fini fini    Se peut-il qu'un bonheur  Qui tenait tant de place  Et donnait tant de joie  Disparaisse à jamais  Effaçant de ta vie  Même jusqu'à la trace  Du moindre souvenir  Que l'amour nous a fait    Je ne sais comment faire  Et je ne sais que dire  Je veux paraître fort  Une dernière fois  Les larmes au coin des yeux  Je me force à sourire  D'un sourire forcé  Qui ne te trompe pas    Trop lâche pour mourir  Bien qu'effrayé de vivre  Je compte sur l'oubli  Pour trouver le repos  Il faudra m'habituer  Dans les années à suivre  A des jours sans ta voix  A des nuits sans ta peau    C'est fini fini fini fini fini fini fini
6,Une Enfant,3:41,"Une enfant,  Une enfant de seize ans,  Une enfant du printemps,  Couché sur les chemins.    Elle vivait dans un de ces quartiers  Ou tout le monde riche a crevé.  Elle avait quitté ses parents  Pour suivre un garçon, un bohème,  Qui savait signer et dire je t'aime,  Et sans que ça devenait bouleversant,  Et leur cœurs parait-il sans laisser d'adresse,  Emportant juste la jeunesse  Et le douceur de leur pêché.    Une enfant    Leurs cœurs n'avaient pas le saison  Et ne voulaient pas de prison.  Tout de vivait au jour de jour,  Restant jamais à la même place.  Leurs cœurs avaient besoin d'espace  Pour contenir un tel amour.  Son présent comme son futur,  C'était cet amour magnifique,  Qu'il avait refait un cantique  Et perdit ses yeux dans l'azure.    Une enfant    Mais son amour était trop grande,  Trop grande pour l'âme d'une enfant.  Elle ne vivait que par son cœur  Et son cœur faisait un monde,  Mais Dieu n'acceptait pas le monde  Quand Il n'est pas le créateur.  L'amour était leur seul festin  Et la guitare pour quelques miettes,  Alors sa vie bâtit en retraite  Et puis l'enfant connaît la fin.    Une enfant,  Une enfant de seize ans,  Une enfant, un printemps,  Couché sur le chemin."
7,A T'Regarder,2:23,"Tout le jour tu es loin de moi   Mais lorsque tombe la nuit   Que tu viens dormir près de moi   J'oublie toute ma vie   Quand se ferment sur notre amour   Les portes de ton sommeil   En moi que de tourments s'éveillent     À t'regarder   J'ai le cœur qui soupire   J'voudrais crier, sangloter ou bien rire   À t'regarder   Je sens comme une angoisse   Si tu savais ce que tu tiens de place     À t'regarder   J'ai le cœur qui chavire   Et mes pensées me font mal   Me déchirent   Si tu devais rêver à quelqu'un d 'autre   Et partager ces joies qui sont les nôtres     À t'regarder   Quand la peur me domine   Pour libérer   Ce cri de ma poitrine   J'veux t'éveiller   Te voir de venir blême   Et m'effondrer   En te criant   Je t'aime"
8,A Tout Jamais,2:37,"Quand nous aurons fermé les yeux   À tout jamais, à tout jamais   À l'instant du dernier adieu   J'en aurai encore du regret   J'en aurai encore du remords   Et partirai avec ma peine   Et pour peu que je me souvienne   Ce mal n'en sera que plus fort   Car nous avons fermé nos cœurs   À tout jamais, à tout jamais   Pour remplacer tant de bonheur   Par du chagrin et des regrets     Lorsque les siècles bout à bout   À tout jamais, à tout jamais   Aurons mis le passé sur nous   Et que l'oubli sera complet   S'il reste encore une lueur   S'il reste encore un rien de flamme   Sous la cendre tiède de l'âme     Qui paraît-il jamais ne meurt   Pour trouver le calme infini   À tout jamais, à tout jamais   Tout comme au temps de notre vie   Mon amour je te chercherai   T'appellerai   Te trouverai   Te garderai   À tout jamais"
9,Retiens la nuit,4:00,"Retiens la nuit  Pour nous deux jusqu'à la fin du monde  Retiens la nuit  Pour nos cœurs, dans sa course vagabonde    Serre-moi fort  Contre ton corps  Il faut qu'à l'heure des folies  Le grand amour  Raye le jour  Et nous fasse oublier la vie    Retiens la nuit  Avec toi elle paraît si belle  Retiens la nuit  Mon amour qu'elle devienne éternelle    Pour le bonheur  De nos deux cœurs  Arrête le temps et les heures  Je t'en supplie  A l'infini  Retiens la nuit    Ne me demande pas d'où me vient ma tristesse  Ne me demande pas que tu ne comprendrais pas  En découvrant l'amour je frôle la détresse  En croyant au bonheur la peur entre mes joies    Serre-moi fort  Contre ton corps  Il faut qu'à l'heure des folies  Le grand amour  Raye le jour  Et nous fasse oublier la vie    Retiens la nuit  Avec toi elle paraît si belle  Retiens la nuit  Mon amour qu'elle devienne éternelle    Pour le bonheur  De nos deux cœurs  Arrête le temps et les heures  Je t'en supplie  A l'infini  Retiens la nuit"
10,Embrasse-Moi,5:16,"Des lueurs on fond de tes yeux Un regard trouble et malicieux Qui veut me suggérer des choses Embrasse-moi Un corps lascif et alangui Des gestes faits au ralenti Qui prennent d'affolantes poses Embrasse-moi Moi j'ai la gorge contractée Je reste comme hypnotisé Tandis qu'en moi monte une fièvre Embrasse-moi Quand mon coeur sur écran géant Fébrilement fait un gros plan Sur ta langue au bord de tes lèvres  Embrasse-moi Comme on mord dans un fruit Et partons dans la nuit De nos amours  Embrasse-moi Jusqu'à la déraison Quand nos lèvres n'auront Plus de contour J'ai soif de toi, de tout Du confort de la bouche Du désordre farouche De ton corps tendre et fou Embrasse-moi Je veux par tes baisers Trouver l'éternité Entre tes gras Embrasse-moi  Dans un malaise merveilleux Tu me fais partager des jeux Où tu te révèles géniale Embrasse-moi Entre deux battements de coeur J'entends ta voix qui de bonheur L'amour aidant devient un râle Embrasse-moi Pudique dans ta nudité De tes fantasmes libérée Tu n'es plus tout à fait la même Embrasse-moi Quand pour moi dans un tourbillon De feu, de chair et de passion Tu réinventes tes «Je t'aime»  Embrasse-moi Comme on mord dans un fruit Et partons dans la nuit De nos amours Embrasse-moi Jusqu'à la déraison Quand nos lèvres n'auront Plus de contour J'ai soif de toi, de tout Du confort de la bouche Du désordre farouche De ton corps tendre et fou Embrasse-moi Je veux par tes baisers Trouver l'éternité Entre tes bras Embrasse-moi"
11,Toi Contre Moi,4:36,"Toi contre moi, il est bête à pleurer cet orgueil des parents déchirés. Toi contre moi c'est un combat, on se déchire on se bat aidés par nos avocat! Toi contre moi, contre le monde entier, sans répit, sans merci, sans pitié. Quand l'amour meurt, ça devient chacun pour soi, mais les enfants dans tout ça? Quel est leur tort, quel est leur crime, pourquoi seraient-ils victimes de notre échec à nous deux, pourquoi eux? Qu'ont-ils fait pour souffrir de nos problèmes, eux qui sont ce que quand même nous avons fait de mieux?! Toi contre moi, quelle raison donner au pourquoi des enfants étonnés? Toi tu voudrais me les ôter, je devrais les emprunter, les prendre et les rapporter! Toi contre moi, à ce jeu sans issue, il ne sort ni vainqueur ni vaincu. Au bout du compte, il n'y a que les enfants  qui pour finir sont perdants! Non aux sorties à la sauvette, aux dimanches et jours de fêtes que peut accorder la loi chaque mois! Tes amis auront beau dire et beau faire: Je remuerai ciel et terre, tu ne les auras pas! Toi contre moi, c'est l'enfer, c'est l'horreur, et pourtant hier, c'était le bonheur! Toi contre moi, c'était la vie, ses merveilles et ses folies, dans tes bras et dans ton lit! Toi contre moi, ce passé qui nous lie, il faudrait le garder à tout prix. Se retrouver face à face au Tribunal ne nous ferait que du mal! Viens! Faisons amende honorable, évitons l'irréparable et le point de non retour, pour qu'un jour affleurant de ce drame pitoyable il ne reste plus que toi contre moi, mon amour!"
12,Jezebel, ,Ce démon qui brûlait mon coeur  Cet ange qui séchait mes pleurs  C'était toi  Jézebel c'était toi  Ces larmes transpersées de joie  Jézebel c'était toi  Jézebel c'était toi  Mais l'amour est anéanti  Tout s'est écroulé sur ma vie  Ecrasant piétinant  Emportant mon coeur  Jézebel mais pour toi  Je ferai le tour de la terre  J'irai jusqu'au fond des enfers  Où es-tu ?  Jézebel où es-tu ?  Mes souvenirs que je vois fannés  Sont des êtres vivants  Avec des yeux de mort  Courant encore  De passer  Mon coeur est perdu d'obsessions  Il bat en répétant  Tout au fond de moi même  Ce mot que j'aime  Ton nom  Mais l'amour est anéanti  Tout s'est écroulé sur ma vie  Ecrasant piétinant  Emportant mon coeur  Jézebel mais pour toi  Je ferai le tour de la terre  J'irai jusqu'au fond des enfers  En criant  Jour et nuit  Sans répt  Jézebel  Jézebel  Jézebel
13,Ma Main a Besoin de Ta Main, ,"Ma main a besoin de ta main Pour parcourir la vie Et flâner en chemin Mes yeux ont besoin de tes yeux Pour fouiller l'horizon D'un amour sans limite Mon coeur a besoin de ton coeur Pour rythmer l'harmonie De l'élan de nos coeurs Ma voix a besoin d'un écho Et l'écho c'est ta voix Qui s'unit à ma voix Ma main a besoin de ta main Pour faire le parcours Qui conduit à l'amour  Tu sens l'soleil en plein hiver C'est merveilleux quand on y pense Et dans tes yeux, tes yeux si clairs J'ai découvert ma ligne de chance  Dis-moi que tu m'aimeras toujours Dis-le puisque tu n'en sais rien Et dépensons tout notre amour Même si nous sommes ruinés demain  Ma main a besoin de ta main Pour parcourir la vie Et flâner en chemin Mes yeux ont besoin de tes yeux Pour fouiller l'horizon D'un amour sans limite Mon coeur a besoin de ton coeur Pour rythmer l'harmonie De l'élan de nos coeurs Ma voix a besoin d'un écho Et l'écho c'est ta voix Qui s'unit à ma voix Ma main a besoin de ta main Pour faire le parcours Qui conduit à l'amour"
14,Sur Ma Vie, ,"Sur ma vie, je t'ai juré un jour  De t'aimer jusqu'au dernier jour de mes jours,   Et le même mots devait très bientôt  Nous unir devant dieu et les hommes    Sur ma vie, je t'ai fait le serment  Que ce lien tiendrait jusqu'à la fin de temps  Ainsi nous vivions ivres de passion  Et mon cœur voulait t'offrir mon nom    Près des orgues qui chantaient  Face à dieu qui priait   Heureux je t'attendais  Mais les orgues se sont tues  Et dieu a disparu, car  Tu n'es pas venue    Sur ma vie, j'ai juré que mon cœur   Ne battrait jamais pour aucun autre cœur  Et tout est perdu car il ne bat plus  Mais il pleure mon amour déçu    Sur ma vie, je t'ai juré un jour  De t'aimer jusqu'au dernier jour de mes jours  Et même à présent Je tiendrai serment  Malgré tout, le mal que tu m'as fait  Sur ma vie, cherie Je t'aimerai"
15,A Contre Amour,4:13,"De contretemps en contretemps On ne se voit qu'à contre-jour Et vivons à contre-courant À contre-amour  Jouant ensemble à contrecoeur Au vu des autres sans détour La contrefaçon du bonheur À contre-amour  En contrepoint de nos sourires Au chapitre des illusions De plus en plus nous ressemblons À de fats mannequins de cire En vitrine pour dérision  De contre-pied en contre-pas Notre vie a changé de cours Et tu te contrefous qu'on soit À contre-amour  Je sais, de l'amour à la haine Il n'y a qu'un pas à franchir Et que l'on fait sans réfléchir Du bonheur on passe à la peine Et me voilà avec les chaînes Forgées par trop de souvenirs  À contre-voie de nos serments Le contre faisant place au pour Je n'entends plus le contre-chant De mon amour À contre-amour  De contretemps en contretemps On se se voit qu'à contre-jour Et vivons à contre-courant À contre-amour  Jouant ensemble à contrecoeur Au vu des autres sans détour La contrefaçon du bonheur À contre-amour  En contrepoint de nos sourires Au chapitre des illusions De plus en plus nous ressemblons À de fats mannequins de cire En vitrine pour dérision  De contre-pied en contre-pas Notre vie a changé de cours Et tu te contrefous qu'on soit À contresens de nos beaux jours Moi contre toi, toi contre moi À contre-amour"
16,Il  Faut Savoir,3:05,"Il faut savoir encore sourire  Quand le meilleur s'est retiré  Et qu'il ne reste que le pire  Dans une vie bête à pleurer    Il faut savoir, coûte que coûte  Garder toute sa dignité  Et malgré ce qu'il nous en coûte  S'en aller sans se retourner    Face au destin qui nous désarme  Et devant le bonheur perdu  Il faut savoir cacher ses larmes  Mais moi, mon cœur, je n'ai pas su    Il faut savoir quitter la table  Lorsque l'amour est desservi  Sans s'accrocher l'air pitoyable  Mais partir sans faire de bruit    Il faut savoir cacher sa peine  Sous le masque de tous les jours  Et retenir les cris de haine  Qui sont les derniers mots d'amour    Il faut savoir rester de glace  Et taire un cœur qui meurt déjà  Il faut savoir garder la face  Mais moi, je t'aime trop    Mais moi, je ne peux pas  Il faut savoir mais moi  Je ne sais pas"
17,For Me Formidable,3:05,"You are the one for me, for me, formi, formidable  You are my love, very, very, véri, véritable  Et je voudrais un jour enfin pouvoir te le dire  Te l'écrire  Dans la langue de Shakespeare    My daisy, daisy, dési, désirable  Je suis malheureux  D'avoir si peu de mots à t'offrir en cadeau  Darling I love you, love you, darling, I want you  Et puis c'est à peu pres tout  You are the one for me, for me, formi, formidable    You are the one for me, for me, formi, formidable  But how can you see me, see me, si mi, si minable  Je ferais mieux d'aller choisir mon vocabulaire  Pour te plaire  Dans la langue de Molière    Toi, tes eyes, ton nose, tes lips adorables  Tu n'as pas compris  Tant pis, ne t'en fais pas et  Viens-t'en dans mes bras  Darling I love you, love you, darling, I want you  Et puis le reste, on s'en fout  You are the one for me, formi, formidable    Je me demande même pourquoi je t'aime  Toi qui te moque de moi et de tout  Avec ton air canaille, canaille, canaille  How can I love you?"
18,Je Rentre Chez Nous,3:46,Tous mes démons calmes tous mes volcans éteins Rongé par le cancer de ton corps et tes lèvres Plus réfléchi qu'hier moins sage que demain Je rentre chez nous en fièvre J'étais parti jurant que c'était pour toujours Je devrais me cracher cent fois à la figure Et m'arracher le coeur pour l'offrir aux vautours Je rentre chez nous parjure Ma bouche étais salive et mon coeur était sec Quand je faisais l'amour sans amour par réflexe Aux vierges effrayées prises du bout du bec Comme on prend un café sur le comptoir du sexe Et comme un roi déchu abdiquant par amour Avec encore aux lèvres un âpre goût de cendre Mon coeur au grand galop fait le compte à rebours Je rentre chez nous me rendre  Sorti de mes enfers en voulant voir les cieux J'ai eu des paradis artificiels et fades N'ayant ni vu le diable ni rencontré Dieu  Je rentre chez nous malade Étouffant tout orgueil tout en me vomissant Aux sources de mes maux pour retrouver mes chaînes Et célébrer nos noces de larmes et de sang Je rentre chez nous sans haine Ouvertes ou fermées mes prisons sont en moi Ma vie n'est pas ma vie si tu n'en es le centre Et crever pour crever autant crever sur toi Esclave de ton corps planté dans ton bas-ventre N'ayant rien résolu je reviens sur mes pas Pour toute honte bue rabâcher mes - je t'aime - Sachant qu'à petit feu tu me suicideras Le coeur à genoux Revenu de tout Je rentre chez nous quand même
19,Ay! Mourir Pour Toi, ,Ay mourir pour toi A l’instant où ta main me frôle Laisser ma vie sur ton épaule Bercé par le son de ta voix  Ay mourir d’amour T’offrir ma dernière seconde Et sans regret quitter le monde En emportant mon plus beau jour  Pour garder notre bonheur Comme il est là Ne pas connaître la douleur Par toi Et la terrible certitude De la solitude  Ay mourir pour toi Prendre le meilleur de nous-mêmes Dans le souffle de ton je t’aime Et m’endormir avec mes joies  Parle moi Console-moi J’ai peur du jour qui va naître Il sera le dernier peut-être Que notre bonheur va connaître  Serre-moi Apaise-moi Quand j’ai l’angoisse du pire Ne ris pas quand tu m’entends dire Qu’au fond mourir Pour mourir  Ay mourir d’amour A l’instant où ta main me frôle Laisser ma vie sur ton épaule Bercé par le son de ta voix  Ay mourir d’amour T’offrir ma dernière seconde Et sans regret quitter le monde En Emportant mon plus beau jour  Pour garder notre bonheur Comme il est là Ne pas connaître la douleur Par toi Et la terrible certitude De la solitude  Ay mourir pour toi Prendre le meilleur de nous-mêmes Dans le souffle de ton je t’aime Et m’endormir avec mes joies Mourir pour toi
20,Je Veux Te Dire Adieu, ,Et puisque d'autres mains sur ton corps impudique   Sont venues prendre place où mes doigts ne sont plus   Et puisque un autre cœur donne au tien la réplique   Et que tes joies se fondent aux joies d'un inconnu   Je veux te dire adieu     Puisque tes reins se cambrent aux nouvelles étreintes   Et que ta peau frémit sous un souffle nouveau   Puisque un autre que moi peut arracher tes plaintes   Faisant jaillir de toi des râles et des mots   Je veux te dire adieux     Et puisque sur sa couche tu nies mon existence   En oubliant mon nom pour mieux crier le sien   Que tu mords dans sa vie pour tisser ta jouissance   En lui disant ces mots que je croyais les miens   Blessé dans mon cœur même   Et parce que je t'aime   Je veux te dire adieu
21,On Ne Sait Jamais, ,"On sait jamais  Comment l'amour vient aux amants  Comment il fait ou il s'y prend  Pour nous tenir dans ses filets  Mais tout à coup c'est merveilleux  Il y a des larmes plein nos joies  Des caresses au bout de nos doigts  Et des rêves au fond de nos yeux  On ne sait jamais  Mais pourquoi chercher à savoir  Nul n'a jamais eu ce pouvoir  On oublie tout quand l'amour naît  Plus rien ne peut nous retenir  Et fou d'amour et de désir  On se dit tant pis  Si l'on ne sait jamais    On ne sait jamais  Quand on est pris par le bonheur  Si c'est l'esprit ou bien le cœur  Qui nous apporte ce bienfait  On a confiance en l'avenir  C'est à la vie comme à la mort  Et tant pis si l'on a eu tort  On met ça dans les souvenirs  On ne sait jamais  Et l'on se fiche éperdument  Du qui, du quoi, et du comment  On est heureux comme l'on est  Plus rien ne compte à notre vue  Que ce bonheur à cœur perdu  Qui nous dit  Tant pis  Si l'on ne sait jamais    On ne sait jamais  L'amour fait de nous ce qu'il veut  On est heureux ou malheureux  Tout est parfait ou rien n'est vrai  Parfois il reprend d'une main  Ce que de l'autre il a donné  Mais quand tout semble s'écrouler  Lorsque l'on croit n'avoir rien  On ne sait jamais  Nos yeux sont à peine séchés  Qu'un autre amour vient à s'annoncer  Et tout est à recommencer  On est fébrile et haletant  A chaque fois comme à vingt ans  Nous faisons toujours d'autres folies  Au cours de notre vie  Tout ça parce qu'on ne sait jamais."
