,song,time,lyrics
41,Prends le Chorus,2:36,"Quand tu es abattu, que certains soirs Tu es emprisonné par ton cafard Décroche un instrument, viens vite nous voir Allez prends le chorus Tout changera pour toi et peu à peu Tu laveras tes peines avec ton jeu Si tu veux être seul en fermant les yeux Allez prends le chorus Tu oublieras tout et pris par l'ambiance Tous tes ennuis perdront leur importance Fais comme ça et tu verras Le rythme t'offriras d'autres idées Et te délivrera de tes pensées Laisse tomber le reste et pour balancer Allez prends le chorus Quand t'auras perdu la notion du temps Que tes lèvres ou tes doigts seront en sang Va jusqu'au limite de l'épuisement Allez prends le chorus Donne-toi sans compter vas-y à fond  Joue ton amour déçu, joue ta passion Que ton coeur explose en improvisation Allez prends le chorus Tu ressentiras un bien fantastique Et trouveras la paix par la musique Et tu comprendras que l'on n'a Pas besoins de discours ni de grands mots Le jazz est un remède à bien des maux Si rien ne va pour toi, c'est-ce qu'il te faut Allez prends le chorus En rythmant la musique avec ton pied En remuant le corps pour balancer En t'extériorisant pour te libérer Allez prends le chorus Sans jamais t'écarter de l'harmonie Dirige avec chaleur ta mélodie Donne à ton instrument un souffle de vie Allez prends le chorus Et tu croiras l'éclair d'une seconde Être l'être le plus heureux du monde Qu'est-ce que t'attends, tu perds ton temps Chauffe avec nous jusqu'au lever du jour Et la musique ira à ton secours Toi ne pense à rien mais quand viendra ton tour Allez prends le chorus"
42,"La bohème, song",4:05,"Je vous parle d'un temps  Que les moins de vingt ans  Ne peuvent pas connaître  Montmartre en ce temps-là  Accrochait ses lilas  Jusque sous nos fenêtres  Et si l'humble garni  Qui nous servait de nid  Ne payait pas de mine  C'est là qu'on s'est connu  Moi qui criait famine  Et toi qui posais nue    La bohème, la bohème  Ça voulait dire  On est heureux  La bohème, la bohème  Nous ne mangions qu'un jour sur deux    Dans les cafés voisins  Nous étions quelques-uns  Qui attendions la gloire  Et bien que miséreux  Avec le ventre creux  Nous ne cessions d'y croire  Et quand quelque bistro  Contre un bon repas chaud  Nous prenait une toile  Nous récitions des vers  Groupés autour du poêle  En oubliant l'hiver    La bohème, la bohème  Ça voulait dire  Tu es jolie  La bohème, la bohème  Et nous avions tous du génie    Souvent il m'arrivait  Devant mon chevalet  De passer des nuits blanches  Retouchant le dessin  De la ligne d'un sein  du galbe d'une hanche  Et ce n'est qu'au matin  Qu'on s'asseyait enfin  Devant un café-crème  Épuisés mais ravis  Fallait-il que l'on s'aime  Et qu'on aime la vie    La bohème, la bohème  Ça voulait dire  On a vingt ans  La bohème, la bohème  Et nous vivions de l'air du temps    Quand au hasard des jours  Je m'en vais faire un tour  À mon ancienne adresse  Je ne reconnais plus  Ni les murs, ni les rues  Qui ont vu ma jeunesse  En haut d'un escalier  Je cherche l'atelier  Dont plus rien ne subsiste  Dans son nouveau décor  Montmartre semble triste  Et les lilas sont morts    La bohème, la bohème  On était jeunes  On était fous  La bohème, la bohème  Ça ne veut plus rien dire du tout"
43,C'est merveilleux l'amour,2:09,"C'est merveilleux l'amour   C'est fantastique   C'est trop compliqué pour   Que ça s'explique   Ça va, ça vient, ça court   C'est lunatique   C'est merveilleux l'amour     Heureux ou malheureux   C'est un dilemme   Qui pose aux amoureux   Plus d'un problème   C'est un jeu dangereux   Mais quand on aime   C'est merveilleux l'amour     Ça crie   Ça mène notre vie   Sur terre   Ça pleure     Et ça nous prend des heures   Entières   Et l'on a beau dire   Et l'on a beau faire     Quand on est dans ses doigts   Notre vie change   Car on subit sa loi   Qu'est un mélange   De tourments et de joies   Vraiment étrange   C'est merveilleux l'amour     C'est merveilleux l'amour   Qu'on se le dise   Ces instants qu'on savoure   Et qui nous grisent   Dont dépendent nos jours   Nous électrisent   C'est merveilleux l'amour     Ça vient sans s'annoncer   Sans crier gare   Un regard, un baiser   Hop! ça démarre   Le bonheur est lâché   Dans la bagarre   C'est merveilleux l'amour     Ça vit   De rêves et d'ennuis   Qui passent   C'est fier   Ça fait un bruit d'enfer   Ça casse   Et quoi que l'on pense   Et quoi que l'on fasse     Quand dans son tourbillon   Il nous entraîne   Ça prend des proportions   Surhumaines   Et qu'on le veuille ou non   C'est une chaîne   Qui nous tient nuit et jour   C'est merveilleux, merveilleux l'amour"
44,Je t'aime comme ca,2:31,Tu es toute ma vie   Je ne sais pas pourquoi   Tu n'es pas très jolie   Mais je t'aime comme ça   Tes joies sont enfantines   Tes gestes maladroits   T'as l'air d'une gamine   Mais je t'aime comme ça   Tu cries sans raison   Tu mens avec aplomb   Et me donnes des noms   Insensés   Qui font rire mes amis   Et lorsque je te dis   Que tout cela un jour doit changer   Tu te mets à  pleurer   Moi pour te consoler     Dans mes bras je t'emporte   Et blottie contre moi   C'est bien toi la plus forte   Mais je t'aime comme ça   Mes yeux sont pleins de larmes   Comment expliquer ça   Tout en toi me désarme   Mais je t'aime comme ça   Tu as des défauts   Souvent tu parles trop   Et quand je suis par trop   Excédé   Je m'écrie ça suffit   Mais lorsque tu souris   Avec un regard désemparé   Devant ton air perdu   Je me sens tout ému     Tu es toute ma vie   Je ne sais pas pourquoi   Tu n'es pas très jolie   Mais je t'aime comme ça
45,Parce que tu crois,3:09,"Parce que tu crois  Que tu es ma faiblesse  Tu me blesses  Me meurtris  Et tu te joues de moi  Comme de toutes choses  Et disposes  De ma vie  Et jour et nuit    Parce que tu crois  Être ma raison d'être  Tu fais naître  Ma douleur  Et bien malgré toi  En tout cas je le pense  Tu dépenses le bonheur  Qui vit dans mon coeur    Un jour peut venir  Demain peut-être ou bien dans l'avenir  Où qui sait mon Dieu  Le destin viendra pour brouiller les jeux    Tout ce que tu crois  Être à toi sans réserve  Comme un rêve au matin  Peut, brisant ta loi  Laisser tes yeux humides  Et le vide dans tes mains    Parce que tu crois  Que je suis un esclave  Une épave  De l'amour  Tu puises tes joies  Et tu forges tes armes  Dans les larmes  Sans secours  De mon coeur lourd    Parce que tu crois  Que je fus mis au monde  Pour que blonde  Déchaînée  Tu me mènes au pas  Sans faire sacrifice  D'un caprice  D'une idée  D'enfant gâtée    Quand tout sera mort  Quand la passion aura quitté mon corps  Je me reprendrai  Et je te quitterai sans un regret    Parce que je crois  Qu'un jour dans un sourire  Je vais dire  Que nous deux  C'est fini tu vois  Et qu'enfin il ne reste  Que le geste  De l'adieu"
46,Paris Au mois d'aout,3:24,Balayé par septembre  Notre amour d'un été  Tristement se démembre  Et se meurt au passé  J'avais beau m'y attendre  Mon coeur vide de tout  Ressemble à s'y méprendre  A Paris au mois d'août  De larmes et de rires  Était fait notre amour  Qui redoutant le pire  Vivait au jour le jour  Chaque rue chaque pierre  Semblait n'être qu'à nous  Nous étions seuls sur terre  A Paris au mois d'août  Pour te dire je t'aime  Aussi loin que tu sois  Une part de moi-même  Reste accrochée à toi  Et l'autre solitaire  Recherche de partout  L'aveuglante lumière  De Paris au mois d'août  Dieu fasse que mon rêve  De retrouver un peu Du mois d'Août sur tes lèvres  De Paris dans tes yeux  Prenne forme et relance  Notre amour un peu fou  Pour que tout recommence  A Paris au mois d'août
47,A propos de pommier,3:06,"Un jour le Bon Dieu  Le front soucieux  Se dit mon vieux  Ton grand ciel bleu  N'a rien de rose  Plus j'y réfléchis  Plus je me dis  Qu'il manque ici  Un paradis  Ou autre chose  Il fit tant et bien  Avec ses mains  Et presque rien  En un peu moins  D'un semaine  Qu'il avait créé  Les champs, les prés  L'hiver, l'été  Et aussi les  Formes humaines  Il les convoqua  Leur dit ""voilà  Avec tout ça  Vous n'avez qu'à  Vivre tranquilles  Je vous en fais don  Tout y est bon  Mais attention  D'être dociles  Et de me faire la promesse  De ne pas toucher  Non de ne pas toucher au pommier  Non de ne pas toucher au pommier""  Le bon Dieu parti  Adam se dit  Ben mon ami  T'es mieux ici  Que dans une usine  T'as une poupée  Une beauté  Qui est roulée  Comme pour tourner  À la Goldwine  Et ce brave Adam  Passait le temps  En souriant  Béatement  Comme bien des hommes  Sans avoir idée  Que sa moitié  Puisse flirter  Avec un r'présentant en pomme  Eve trouvait charmant  Et affolant  Ce beau Tarzan  Nommé Serpent  Dit à sornettes  Qui sut l'envoûter  La fasciner  Lui fair' croquer dans la pomme  Et perdre la tête  Au point d'oublier sa promesse  De ne pas toucher au pommier  Non, de ne pas toucher au pommier  Non, de ne pas toucher au pommier  Tout commence ici  Eve en folie  Pris un beau fruit  Et le tendit  A son p'tit homme  Et le brave Adam  Toujours confiant  À belles dents  Mordit dedans  Comme une pomme  Lorsque Dieu l'apprit  Avec mépris  Il leur a dit  Plus d'paradis  Non, je vous condamne  À vivre et lutter  À travailler  Hiver, été  Et tout ça c'est  À cause d'une femme  C'est ainsi depuis  Que la vie  Même aujourd'hui  L'homme est trahi  Dans l'ignorance  Et le vieux pommier  Presque oublié  Est remplacé  Par le péché  De complaisance  Car les femmes tiennent leur promesse  De ne pas toucher au pommier  Non de ne pas toucher au pommier  Car, elles préfèrent goûter au péché  C'est si doux, c'est si doux  De goûter au péché  Ah! C'est doux, de goûter au péché  De goûter au péché"
48,La route,2:33,"Quand les tambours ont cessé de rouler   Les clairons de sonner   L'adjudant de gueuler   Moi j'ai repris la route   Moi j'ai repris la blanche et belle grande route     Quand le soleil dans le ciel s'est pointé   Ivre de liberté   Sans savoir où aller   Moi j'ai repris la route   D'un petit pas léger     Il y avait une gosse   Qui gardait ses moutons   Laridondon   Pas futée mais précoce   Un bien joli tendron   L'air tendre et l'herbe verte   Quelques banalités   Laridondé     La fille s'est offerte   On s'est laissé glisser   Quand ses parents ont crié ""au voleur!""   Car j'avais pris le cœur   De la fillette en pleur   Moi j'ai repris la route   Moi j'ai repris la blanche et belle grande route     Quand les gendarmes ont cessé de chercher   Et moi de me cacher   Lorsque tout fut calmé   Moi j'ai repris la route   Mais je l'ai enlevée     À Paris sur la Butte   Où l'on s'est installés   Laridondé   Elle a fait la culbute   Avec tout le quartier   Quand j'étais en colère   Elle m'ouvrait les bras   Laridonda   Il n'y avait rien à faire   Elle ne comprenait pas     Quand dans mes yeux les larmes ont perlé   Quand ma vie fut brisée   Et mon cœur dévasté   Moi j'ai repris la route   Moi j'ai repris la blanche et belle grande route     Quand la caserne a ouvert ses battants   Que j'ai vu grimaçant   Mon amour d'adjudant   Ça ne fait aucun doute   Je me suis engagé   Et j'ai repris la route   Dans les rangs de l'armée"
49,Sarah,2:12,"Dans la boutique do tailleur  Tes vieux parents, tes frères, tes surs  Nous avons tant de peine au cœur  Sarah, Sarah reviens vers nous    Mamie ne cesse de pleurer  Sa grande enfant, son adore  Tu fus toujours sa préféré  Sarah, Sarah reviens vers nous    De quoi avais-tu donc besoin  Chez nous tu ne manquais de rien  Pourquoi es-tu partie si loin?  Ici quel vide tout coup    Papy commence être vieux  Il a DJ des mauvais yeux  Te sachant l il irait mieux  Sarah, Sarah reviens vers nous    Dans la boutique do tailleur  Tes vieux parents, tes frères, tes surs  Retrouveront l'ancien bonheur  Sarah, Sarah si tu reviens    Quand attablés les soirs d'hiver  Lorsqu'un un Mamie nous sert  Nous sentons qu'il manque un couvert  Sarah, Sarah que c'est le tien    On lit tes lettres d’Amérique  T'as fait un parti magnifique  Alors tes sentiments s'expliquent  Tu veux oublier d’où tu viens    Hélène aura bientôt vingt ans  Elle s'en ira peut-être avant  On ne vit pas pour ses parents  Sarah, Sarah je le sais bien    Sois donc heureuse et sans regret  Mais ne nous oublie tout fait  Tu as la vie dont tu rêvais  Sarah, Sarah tant pis pour nous"
50,Sur le chemin du retour,2:23,"Pour tromper ma vie et rompre le temps Avec mon chagrin pour fardeau Fuyant ton sourire et tes vingt printemps Qui me collent encore à la peau Pour voir d'autres yeux, trouver d'autres joies Oublier ton nom pour toujours Et puiser ma force au sein d'autres bras J'ai choisi l'exil mon amour.  Passe le vie et meurt le temps Seul l'amour peut tuer l'amour, Mon coeur se trouve à tout instant Sur le chemin du retour Du retour  Croyant m'enrichir du sel et du miel D'une vie au triple galop J'ai jeté mon âme à l'assaut du ciel Il ne m'a rendu qu'un sanglot Que me reste-t-il du temps gaspillé  A vaincre les monts et les mers ? Des années perdues à fuir un passé Qui s'accroche à mon univers ?  Passe la vie et meurt le temps Seul l'amour peut tuer l'amour, Mon coeur se trouve à tout instant Sur le chemin du retour Du retour !  Mais l'amour en moi Brisera l'orgueil Car je n'en peux plus de t'aimer Et mon coeur vaincu franchira ton seuil Pour ne plus jamais s'en aller."
51,Bon Anniversaire,4:07,"J'ai mis mon complet neuf, mes souliers qui me serrent  Et je suis prêt déjà depuis pas mal de temps  Ce soir est important, car c'est l'anniversaire  Du jour où le bonheur t’avait vêtue de blanc    Mais je te sens nerveuse, au bord de la colère  Alors je ne dis rien, mieux vaut être prudent  Si je disais un mot, ton fichu caractère  M'enverrais sur les roses, et l'on perdrait du temps    Il est huit heures un quart, et tu attends la robe  Qu'on devait te livrer ce matin au plus tard  Pour comble tes cheveux au peigne se dérobent  Tout semble se liguer pour qu'on soit en retard    Si tout va de ce train, la soirée au théâtre  Et l'auteur à la mode, on s’en fera un deuil  Adieu pièce d'Anouilh, d'Anouilh, ou bien de Sartre  Je ne sais plus très bien, mais j’ai deux bons fauteuils    Bon anniversaire  Bon anniversaire    Ta robe est arrivée, enfin, et tu respires  Moi pour gagner du temps je t'aide de mon mieux  Tout semble s'arranger mais soudain c'est le pire  La fermeture s'arrête et coince au beau milieu    On s'énerve tous deux, on pousse et puis l’on tire  On s'y mêle les doigts, on y met tant d’ardeur  Que dans un bruit affreux, le tissu se déchire  Et je vois tes espoirs se transformer en pleurs    Aux environs d'onze heures, enfin te voilà prête  Mais le temps d'arriver le théâtre est fermé, viens  Allez viens, nous irons souper tous deux en tête à tête  Non, tu as le coeur gros, tu préfères rentrer    Par les rues lentement, nous marchons en silence  Tu souris, je t'embrasse, et tu souris encore  La soirée est gâchée, mais on a de la chance  Puisque nous nous aimons, l'amour est le plus fort    Bon anniversaire  Bon anniversaire  Bon anniversaire"
52,Comme Ils Disent,4:53,"J'habite seul avec maman  Dans un très vieil appartement  Rue Sarasate  J'ai pour me tenir compagnie  Une tortue, deux canaris  Et une chatte    Pour laisser maman reposer  Très souvent je fais le marché  Et la cuisine  Je range, je lave, j'essuie  À l'occasion je pique aussi  À la machine    Le travail ne me fait pas peur  Je suis un peu décorateur  Un peu styliste  Mais mon vrai métier  C'est la nuit  Où je l'exerce travesti  Je suis artiste    J'ai un numéro très spécial  Qui finit a nu intégral  Après strip-tease  Et dans la salle je vois que  Les mâles n'en croient pas leurs yeux  Je suis un homme, oh!  Comme ils disent    Vers les trois heures du matin  On va manger entre copains  De tous les sexes  Dans un quelconque bar-tabac  Et là, on s'en donne a cœur joie  Et sans complexes  On déballe des vérités  Sur des gens qu'on a dans le nez  On les lapide  Mais on le fait avec humour  Enrobé dans des calembours  Mouillés d'acide    On rencontre des attardés  Qui pour épater leur tablée  Marchent et ondulent  Singeant ce qu'ils croient être nous  Et se couvrent, les pauvres fous  De ridicule    Ça gesticule et parle fort  Ça joue les divas, les ténors  De la bêtise  Moi, les lazzis, les quolibets  Me laissent froid, puisque c'est vrai  Je suis un homme, oh!  Comme ils disent    À l'heure où naît un jour nouveau  Je rentre retrouver mon lot  De solitude  J'ôte mes cils et mes cheveux  Comme un pauvre clown malheureux  De lassitude    Je me couche mais ne dors pas  Je pense à mes amours sans joie  Si dérisoires  À ce garçon beau comme un dieu  Qui sans rien faire a mis le feu  À ma mémoire  Ma bouche n'osera jamais  Lui avouer mon doux secret  Mon tendre drame  Car l'objet de tous mes tourments  Passe le plus clair de son temps  Au lits des femmes    Nul n'a le droit en vérité  De me blâmer, de me juger  Et je précise  Que c'est bien la nature qui  Est seule responsable si  Je suis un homme, oh!  Comme ils disent"
53,A Ma Fille,3:34,"Je sais qu'un jour viendra car la vie le commande  Ce jour que j'appréhende où tu nous quitteras  Je sais qu'un jour viendra où triste et solitaire  En soutenant ta mère et en traînant mes pas  Je rentrerai chez nous dans un ""chez nous"" désert  Je rentrerai chez nous où tu ne seras pas    Toi tu ne verras rien des choses de mon cœur  Tes yeux seront crevés de joie et de bonheur  Et j'aurai un rictus que tu ne connais pas  Qui semble être un sourire ému mais ne l'est pas  En taisant ma douleur à ton bras fièrement  Je guiderai tes pas quoique j'en pense ou dise  Dans le recueillement d'une paisible église  Pour aller te donner à l'homme de ton choix  Qui te dévêtira du nom qui est le nôtre  Pour t'en donner un autre que je ne connais pas    Je sais qu'un jour viendra tu atteindras cet âge  Où l'on force les cages ayant trouvé sa voie  Je sais qu'un jour viendra, l'âge t'aura fleurie  Et l'aube de ta vie ailleurs se lèvera  Et seul avec ta mère le jour comme la nuit  L'été comme l'hiver nous aurons un peu froid    Et lui qui ne sait rien du mal qu'on s'est donné  Lui qui n'aura rien fait pour mûrir tes années  Lui qui viendra voler ce dont j'ai le plus peur  Notre part de passé, notre part de bonheur  Cet étranger sans nom, sans visage  Oh! combien je le hais  Et pourtant s'il doit te rendre heureuse  Je n'aurai envers lui nulle pensée haineuse  Mais je lui offrirai mon cœur avec ta main  Je ferai tout cela en sachant que tu l'aimes  Simplement car je t'aime  Le jour, où il viendra"
54,Sa Jeunesse,4:43,"Lorsque l'on tient entre ses mains  Cette richesse  Avoir vingt ans, des lendemains pleins de promesses  Quand l'amour sur nous se penche  Pour nous offrir ses nuits blanches    Lorsque l'on voit, loin devant soi  Rire la vie  Brodée d'espoir, riche de joies et de folies  Il faut boire jusqu'à l'ivresse  Sa jeunesse    Car, tous les instants  De nos vingt ans  Nous sont comptés  Et jamais plus  Le temps perdu ne nous fait face  Il passe    Souvent en vain, on tend les mains  Et l'on regrette  Il est trop tard  Sur son chemin, rien ne l'arrête  On ne peut garder sans cesse  Sa jeunesse    Avant que de sourire et nous quittons l'enfance  Avant que de savoir, la jeunesse s'en fuit  Cela semble si court que l'on est tout surpris  Qu'avant que de comprendre, on quitte l'existence    Lorsque l'on tient entre ses mains  Cette richesse  Avoir vingt ans, des lendemains pleins de promesses  Quand l'amour sur nous se penche  Pour nous offrir ses nuits blanches    Lorsque l'on voit, loin devant soi  Rire la vie  Brodée d'espoir, riche de joies et de folies  Il faut boire jusqu'à l'ivresse  Sa jeunesse    Car, tous les instants  De nos vingt ans  Nous sont comptés  Et jamais plus  Le temps perdu ne nous fait face  Il passe    Souvent en vain, on tend les mains  Et l'on regrette  Il est trop tard  Sur son chemin, rien ne l'arrête  On ne peut garder sans cesse  Sa jeunesse"
55,Cabaretw/ Liza Minnelli,3:56,"What good is sitting, alone in your room? Come hear the music play! Life is a cabaret, old chum! Come to the cabaret! Put down the knitting, the book and the broom It's time for a holiday Life is a cabaret, old chum! Come to the cabaret!  Come taste the wine Come hear the band Come blow your horn Start celebrating Right this way your table's waiting.  What good's permitting some prophet of doom? To wipe every smile away Life is a cabaret, old chum! So come to the cabaret!  I used to have this girlfriend known as Elsie With whom I shared for sordid rooms in Chelsea She wasn't what you call a blushing flower As a matter of fact she rented by the hour. The day she died the neighbors Came to snick her Well, that is what comes from Too much pills and liquor. But when I saw her laid out like a queen She was the happiest corpse I'd ever seen I think of Elsie till this very day I remember how she'd turned to me and say, What good is sitting all alone in your room? Come hear the music play Life is a cabaret, old chum! Come to the cabaret!  And as for me Ha And as for me I made my mind up back in Chelsea When I go I'm going like Elsie.  Star by admitting From cradle to tomb It isn't that long a stay Life is a cabaret, old chum! It's only a cabaret, old chum! And I love a cabaret!"
56,God Bless the Childw/ Liza Minnelli,3:28,"Them that's got shall get  Them that's not shall lose  So the Bible says, and it still is new-ews  Mama may have and papa may have  But God bless the child that's got his own    And the strong get more  While the weak ones fade  Empty pockets don't ever make the gra-ade  Mama may have and papa may have  But God bless the child that's got his own  That's got his own     And when you got money  You got a-lots of friends  All hangin' 'round your door  But when the money's gone  And all your spendin' ends  They won't hang around any more-ore    Rich relations may give you  A crust of bread and such  Sayin' help, go on help help yourself  But don't take too much  Mama may have and papa may have  But God bless the child that's got his own  That's got his own...  That's got his ow...own    Mama may have and papa may ha-ave  But God bless the child who can stand up and say  He's got his... ow-ow-ow-own..."
57,Liza with a Zw/ Liza Minnelli,3:48,"Thank you very much, you're really terrific  And seeing how you are, can I tell ya something, I have a problem  No wait, it's not a big problem, but it is a problem  It's my name, you know I find that still - a lot of people call me Lisa - Wrong  My name is Liza - Liza - has a 'Z' in it  Well, for instance, somebody'll come up to me on the street and say  Hello Lisa how are you, I'll say, I'm fine thank you but it's Liza  Or somebody'll say - Lisa what a nice hat you have on  I'll say thank you very much but my name is Liza and that's my hair  So you can see what I mean  Anyway, I've been trying to figure out a final solution to this whole thing  And I think I've come up with the answer - Jack    It's Liza with 'Z' not Lisa with an 'S', 'Cause Lisa with an 'S' goes SSno'ZZ  It's 'Z' instead of 'S', 'Lie' instead of 'Lee', It's simple as can be, see, Liza  I'll do it again  It's Liza with 'Z' not Lisa with an 'S', 'Cause Lisa with an 'S' goes SSno'ZZ  It's 'Z' instead of 'S', 'Lie' instead of 'Lee', It's simple as can be, see, Liza    Now - if my name were Ada, I'd be Ada, even backwards I'd be Ada  Or if my name were Ruth, then I'd be Ruth because with Ruth what can you do  Or Sally, or Margaret or Ginger or Faye  But when you're a Liza you always have to say    Nn - It's Liza with 'Z' not Lisa with an 'S', 'Cause Lisa with an 'S' goes SSno'ZZ  It's 'Z' instead of 'S', 'Lie' instead of 'Lee', It's simple as can be, see, Liza    Ah - And that is only half of it - there's another way they treat me cruelly  How often I remember someone saying, there"
58,Losing My Mindw/ Liza Minnelli,4:07,"The sun comes up, I think about you  The coffee cup, I think about you  I want you so, it's like I'm losing my mind    The morning ends, I think about you  I talk to friends and think about you  And do they know it's like I'm losing my mind?    All afternoon doing every little chore  The thought of you stays bright  Sometimes I stand in the middle of the floor  Not going left, not going right    I dim the lights and think about you  Spend sleepless nights to think about you  You said you loved me, or were you just being kind?  Or am I losing  Losing my mind?    All afternoon doing every little chore  The thought of you stays bright  Sometimes I stand in the middle of the floor  Not going left, not going right    I dim the lights and think about you  Spend sleepless nights to think about you  You said you loved me, or were you just being kind?  Or am I losing my mind?    Or am I losing my mind?  You said you loved me, or were you just being kind?  Or am I losing my mind?  Or were you just being kind?  Or am I losing my mind?  Losing my mind"
59,Old Friendw/ Liza Minnelli,3:04,"Hey, old friend  What d'ya say, old friend?  Are you okay, old friend?  Are we, are we unique?    Time goes by  Everything else keeps changing  You and I, we can  Continue next week, yeah    Most friends fade  Or they don't make the grade  New ones are quickly made  And in a pinch, sure, they'll do    But us, old friend  What's to discuss, old friend?  Here's to us, who's like us?  Damn few"
