,song,time,lyrics
79,Qui?,3:37,Qui frôlera tes lèvres  Et vibrant de fièvre  Surprenant ton corps  Deviendra ton maître  En y faisant naître  Un nouveau bien-être  Un autre bonheur?    Qui prendra la relève  Pour combler tes rêves  Et sans un remords  D'un éclat de rire  Saura te conduire  À mieux me détruire  Au fond de ton cœur?    Qui peut être cet autre  Qui sera cet intrus?  Dans tout ce qui fut nôtre  Quand je ne serais plus?    Qui prendra ta faiblesse  Avec des caresses  Et des mots d'amour  En couvrant d'oubli  Nos jours de folies?  Qui prendra ta vie  Au bout de mes jours?    Nous vivons à vingt ans d'écart  Notre amour est démesuré  Et j'ai le cœur au désespoir  Pour ces années  Car lorsque mes yeux seront clos  D'autres yeux vont te contempler  Aussi je lutte avec ce mot  De ma pensée    Qui sans que tu protestes  Refera les gestes  Qui ne sont qu'à nous  Lorsque je t'embrasse  Lorsque je t'enlace  Qui prendra ma place  Autour de ton cou?    Qui connaîtra tes scènes  De folie soudaine  Ou bien de courroux?  Qui aura la chance  D'avoir ta présence  Souvent quand j'y pense  Je deviens jaloux    Qui? nul ne peut le dire  Qui? nous n'en savons rien  Et mon cœur se déchire  En pensant que quelqu'un    Te prendra un je t'aime  Et par ce je t'aime  Je le sais déjà  Il prendra ta bouche  Il prendra ta couche  Et m'enterrera  Pour la seconde fois
80,Il  Te Suffisait Que Je T'Aime,3:07,"Nous avions vingt ans toi et moi  Quand on a sous le meme toit  Combattu la misère ensemble  Nous étions encore presqu'enfants  Et l'on disait en nous voyant  Regardez comme ils se ressemblent    Nous avons la main dans la main  Surmonté les coups du destin  Et résolu bien des problèmes  Le ventre vide en privation  Tu te nourrissais d'illusions  Il te suffisait que je t'aime    Nous avons lutté tant d'années  Que la fortune s'est donnée  Mais l'âge a pris ton insouciance  Tu te traînes comme un fardeau  Et ne ris plus à tout propos  Et pleures ton adolescence    Et passes du matin au soir  Des heures devant ton miroir  Essayant des fards et des crèmes  Et moi, je regrette parfois  Le temps où pour forger tes joies  Il te suffisait que je t'aime    Si je le pouvais mon amour  Pour toi j'arreterais le cours  Des heures qui vont et s'éteignent  Mais je ne peux rien y changer  Car je suis comme toi logé  Tu le sais à la meme enseigne    Ne cultive pas les regrets  Car on ne récolte jamais  Que les sentiments que l'on sème  Fais comme au temps des années d'or  Et souviens-toi qu'hier encore  Il te suffisait que je t'aime    Pour moi rien n'a vraiment changé  Je n'ai pas cessé de t'aimer  Car tu as toujours tout le charme  Que tu avais ce jour béni  Où devant Dieu tu as dit: ""oui""  Avec des yeux baignés de larmes    Le printemps passe, et puis l'été  Mais l'automne a des joies cachées  Qu'il te faut découvrir toi-même  Oublie la cruauté du temps  Et rappelle-toi qu'à vingt ans  Il te suffisait que je t'aime"
81,Toi et Moi,3:09,"Toi et moi  Deux cœurs qui se confondent  Au seuil de l'infini  Loin du reste du monde  Haletant et soumis  A bord du lit  Qui tangue et va  Sous toi et moi    Toi et moi  Libérés des mensonges  Et sevrés des tabous  Quand la nuit se prolonge  Entre râles et remous  Nos songes fous  Inventent un nous    Entre chien et loup dans nos rêves déserts  L'amour a su combler les silences  Et nous ces enfants nus vierges de nos hier  Devenons toi et moi, lavés de nos enfers    Porte-moi  Au-delà des angoisses  A l'appel du désir  Du cœur de nos fantasmes  Aux confins du plaisir  Que Dieu créa  Pour toi et moi    J'étais sans espoir et tu as changé mon sort  Offrant à ma vie une autre chance  Les mots ne sont que mots, les tiens vibraient si fort  Qu'en parlant à ma peau ils éveillaient mon corps    Aime-moi  Fais-moi l'amour encore  Encore et parle moi  Pour que jusqu'aux aurores  Aux sources de nos joies  Mes jours se noient  Dans toi et moi"
82,Les Comediens, ,"Viens voir les comédiens  Voir les musiciens  Voir les magiciens  Qui arrivent    Viens voir les comédiens  Voir les musiciens  Voir les magiciens  Qui arrivent    Les comédiens ont installé leurs tréteaux  Ils ont dressé leur estrade  Et tendu des calicots  Les comédiens ont parcouru les faubourgs  Ils ont donné la parade  A grand renfort de tambour  Devant l’église une roulotte peinte en vert  Avec les chaises d’un théâtre à ciel ouvert  Et derrière eux comme un cortège en folie  Ils drainent tout le pays, les comédiens    Viens voir les comédiens  Voir les musiciens  Voir les magiciens  Qui arrivent    Viens voir les comédiens  Voir les musiciens  Voir les magiciens  Qui arrivent    Si vous voulez voir confondus les coquins  Dans une histoire un peu triste  Où tout s’arrange à la fin  Si vous aimez voir trembler les amoureux  Vous lamenter sur Baptiste  Ou rire avec les heureux  Poussez la toile et entrez donc vous installer  Sous les étoiles le rideau va se lever  Quand les trois coups retentiront dans la nuit  Ils vont renaître à la vie, les comédiens    Viens voir les comédiens  Voir les musiciens  Voir les magiciens  Qui arrivent    Viens voir les comédiens  Voir les musiciens  Voir les magiciens  Qui arrivent    Les comédiens ont démonté leurs tréteaux  Ils ont ôté leur estrade  Et plié les calicots  Ils laisseront au fond du cœur de chacun  Un peu de la sérénade  Et du bonheur d’Arlequin  Demain matin quand le soleil va se lever  Ils seront loin, et nous croirons avoir rêvé  Mais pour l’instant ils traversent dans la nuit  D’autres villages endormis, les comédiens    Viens voir les comédiens  Les musiciens  Les magiciens  Qui arrivent    Viens voir les comédiens  Les musiciens  Les magiciens  Qui arrivent    Viens voir les comédiens  Les musiciens  Les magiciens  Qui arrivent    Viens voir les comédiens  Les musiciens  Les magiciens  Qui arrivent    Viens voir les comédiens  Les musiciens  Les magiciens  Qui arrivent"
83,Ave Maria,4:58,"Ave Maria  Ave Maria  Ceux qui souffrent viennent à toi  Toi qui as tant souffert  Tu comprends leurs misères  Et les partages  Marie courage  Ave Maria  Ave Maria  Ceux qui pleurent sont tes enfants  Toi qui donnas le tiens  Pour laver les humains  De leurs souillures  Marie la pure    Ave Maria  Ave Maria  Ceux qui doutent sont dans la nuit  Maria  Éclaire leur chemin  Et prends-les par la main  Ave Maria    Ave Maria, Ave Maria  Amen"
84,La Baraka,2:40,"La baraka  C'est quand tu es entre mes bras, que tu souris  La baraka  C'est notre vie que l'on brûle avec insouciance  La baraka  C'est rien que toi et rien que moi dans l'existence  Et nuit et jour quand tu es là  C'est notre amour, la baraka    La baraka  C'est quand tu es entre mes bras, que tu souris  La baraka  C'est notre vie que l'on brûle avec insouciance  La baraka  C'est rien que toi et rien que moi dans l'existence  Et nuit et jour quand tu es là  C'est notre amour, la baraka    Nul ne connaît son jour de chance  Car le destin, seul en secret  Ouvre le bal, mène la danse  Pour un jour, une heure ou jamais    La baraka  C'est quand tu es entre mes bras, que tu souris  La baraka  C'est notre vie que l'on brûle avec insouciance  La baraka  C'est rien que toi et rien que moi dans l'existence  Et nuit et jour quand tu es là  C'est notre amour, la baraka    Moi j'y crois sans trop y croire  Quand tout à coup ça m'est revenu  Sans s'annoncer, sans crier gare  Quand soudain tu m'es apparue    La baraka  C'est quand tu es entre mes bras, que tu souris  La baraka  C'est notre vie que l'on brûle avec insouciance  La baraka  C'est rien que toi et rien que moi dans l'existence  Et nuit et jour quand tu es là  C'est notre amour, la baraka    La baraka  C'est quand tu es entre mes bras, que tu souris  La baraka  C'est notre vie que l'on brûle avec insouciance  La baraka  C'est rien que toi et rien que moi dans l'existence"
85,La Boheme (La Bohème),3:47,"Je vous parle d'un temps  Que les moins de vingt ans  Ne peuvent pas connaître  Montmartre en ce temps-là  Accrochait ses lilas  Jusque sous nos fenêtres  Et si l'humble garni  Qui nous servait de nid  Ne payait pas de mine  C'est là qu'on s'est connu  Moi qui criait famine  Et toi qui posais nue    La bohème, la bohème  Ça voulait dire  On est heureux  La bohème, la bohème  Nous ne mangions qu'un jour sur deux    Dans les cafés voisins  Nous étions quelques-uns  Qui attendions la gloire  Et bien que miséreux  Avec le ventre creux  Nous ne cessions d'y croire  Et quand quelque bistro  Contre un bon repas chaud  Nous prenait une toile  Nous récitions des vers  Groupés autour du poêle  En oubliant l'hiver    La bohème, la bohème  Ça voulait dire  Tu es jolie  La bohème, la bohème  Et nous avions tous du génie    Souvent il m'arrivait  Devant mon chevalet  De passer des nuits blanches  Retouchant le dessin  De la ligne d'un sein  du galbe d'une hanche  Et ce n'est qu'au matin  Qu'on s'asseyait enfin  Devant un café-crème  Épuisés mais ravis  Fallait-il que l'on s'aime  Et qu'on aime la vie    La bohème, la bohème  Ça voulait dire  On a vingt ans  La bohème, la bohème  Et nous vivions de l'air du temps    Quand au hasard des jours  Je m'en vais faire un tour  À mon ancienne adresse  Je ne reconnais plus  Ni les murs, ni les rues  Qui ont vu ma jeunesse  En haut d'un escalier  Je cherche l'atelier  Dont plus rien ne subsiste  Dans son nouveau décor  Montmartre semble triste  Et les lilas sont morts    La bohème, la bohème  On était jeunes  On était fous  La bohème, la bohème  Ça ne veut plus rien dire du tout"
86,How Sad Venice Can Be [Que C'est Triste Venise],2:59,How sad Venice can be When you return alone And find a memory In a repaving stone  I woke among the bird That fills in Marble Square With a quote of her words Around me in the air  How sad Venice can be When the melodies play A song she sung for me One unforgotten day  Like a magic sea The gondoliers go by But when I try to weep I find my tears are dry  How sad Venice can be When mist is in your eyes And you can hardly see As visions fill the skies  I find the little street And then the old cafe Where we would always meet To dream away the day  How sad Venice can be Beneath the sun's moon That rises from the sea And singles the moon  I hear the vespers chime And cross the bridge of sun I know that it is time To bid my last goodbye  There's nothing more to say I pass beneath the light And then I turn away From Venice in the night  How sad Venice can be It's too lonely to bare When you have lost the love That you discovered there  
87,I Didn't See the Time Go By (Je N'Ai Pas Vu le Temps Passer),3:29,"Now as the wheel of life turns faster  Now as the seasons seem to fly  I see so many things at last, but didn't see the time go by    I've known delight, I've known disaster  The caviar, the humble pie  From the absurd to the sublime  I didn't see the time go by    I didn't see the years roll on  I didn't know the road would bend  Refused to see when youth was gone  Pretending it might never end  Now, there is price to pay for every day I threw away    It seems I've wasted half a lifetime  Within the blinking of an eye  I didn't hear the midnight chime  I didn't see the time go by    In still of nights and brief romances  I kissed the girls and made them cry  While there were balconies to climb  I didn't see the time go by    I was the guy with all the answers,   The halfway-truths, the little lies  So sure, so certain in my prime  I didn't see the time go by    I hit the heights, I bit the dirt  I left some wreckage in my way  I didn't see that lies can hurt  I didn't know how hearts can break  And now, they come to haunt my mind,   The lives I touched and left behind    I've sung a hundred songs of longing,   Of sweet regret and hope run dry  I've searched for melody and rhyme,   But never saw how time can fly,   Newer saw the darkening sky    I was a minstrel of my time  Who did not see the time go by"
88,I'll Be There [Ça Passe],3:33,"You and I must make a pact We must bring salvation back, Where there is love, I'll be there (I'll be there)  I'll reach out my hand to you I'll have faith in all you do. Just call my name and I'll be there (I'll be there)  I'll be there to comfort you, Build my world of dreams around you, I'm so glad that I found you.  I'll be there with a love that's strong, I'll be your strength, I'll keep holdin' on (Holdin' on) Yes I will, yes I will  Let me fill your heart with joy and laughter, Togetherness, girl, is all I'm after, Whenever you need me, I'll be there (I'll be there)  I'll be there to protect you, (yeah baby) With unselfish love that respects you. Just call my name, I'll be there (I'll be there)  I'll be there to comfort you, Build my world of dreams around you, I'm so glad that I found you.  I'll be there with a love that's strong, I'll be your strength, I'll keep holdin' on. Ooh ooh ooh Yes I will (Holdin' on, holdin' on) Yes I will  If you should ever find someone new I know he better be good to you 'Cause if he doesn't I'll be there (I'll be there)  Don't you know baby I'll be there I'll be there I'll be there  Just call my name, I'll be there (I'll be there) Just look over your shoulders honey, ooh! I'll be there, I'll be there, Whenever you need me, I'll be there (I'll be there)  Don't you know baby, I'll be there, I'll be there Just call my name, I'll be there (I'll be there) Oh oh oh oh I'll be there, I'll be there"
89,She (Tous Les Visages d'Amour),2:31,"She may be the face I can't forget  A trace of pleasure or regret  May be my treasure or the price I have to pay  She may be the song that Salome sings  May be the chill that autumn brings  May be a hundred different things  Within the measure of a day    She may be the beauty or the beast  May be the famine or the feast  May turn each day into a heaven or a hell  She may be the mirror of my dream  A smile reflected in a stream  She may not be what she may seem  Inside her shell    She who always seems so happy in a crowd  Whose eyes can be so private and so proud  No one's allowed to see them when they cry  She may be the love that cannot hope to last  May come to me from shadows of the past  That I remember till the day I die    She may be the reason I survive  The why and wherefore I'm alive  The one I'll care for through the rough and ready years  Me, I'll take her laughter and her tears  And make them all my souvenirs  For where she goes I've got to be  The meaning of my life is she, she  Mmm, she"
90,You've Got to Learn (Il Faut Savoir),3:29,You've got to learn to show a happy face   Although you're full of misery   You mustn't show a trace of sadness   Never look for sympathy     You've got to learn although it's very hard   The way of pocketing your pride   Sometimes face humiliation   While you were burning up inside     Facing reality is often hard to do   When it seems happiness is gone     You've got to learn to hide your tears   And tell your heart life must go on     You've got to learn to leave the table   When love's no longer being served   To show everybody that you're able   To leave without saying a word     You've got to learn to hide your sorrow   And go on living as before   What good is thinking of tomorrow  Who knows what it may have in store     You've got to learn to be much stronger   At times your head should rule your heart      You've got to learn from hard experience   And listen to advice   And sometimes pay the price   And learn to live with a broken heart
91,Intoxiqué,2:22,"Tu m'as fait goûter au poison de ton amour   Tout en toi m'a possédé nuit et jour   Pourtant quand j'ai cru toucher le paradis   Sans espoir tu es partie   Tu étais toute ma chance et toute ma joie   Tu étais mon espérance et ma foi   Mais délaissant mon amour et brisant ma vie   Sans espoir tu es partie   Ah! pourrais-je t'oublier   Je ne le crois pas tu fais partie de moi-même   Comment cesser de t'aimer   Autant arracher ce coeur qui t'aime   Tu m'as fait goûter au poison de ton amour   Tout en toi m'a possédé nuit et jour   Pourtant j'ai cru toucher au paradis   Sans rancoeur ni haine   Sans remords ni peine   Sans retour tu es partie   Et toutes mes nuits son privée de sommeil   Et mes jours sont trop longs sans espoir de soleil       Je me sens perdu entouré de passé   Car le monde entier semble m'abandonner   C'est comme une drogue qui manque à ma joie   Car je suis intoxiqué de toi   Toi toi toi toi   Tu m'as fait goûter au poison de ton amour   Tout en toi m'a possédé nuit et jour   Pourtant quand j'ai cru toucher le paradis   Sans espoir tu es partie   Tu étais toute ma chance et toute ma joie   Tu étais mon espérance et ma foi   Mais délaissant mon amour et brisant ma vie   Sans espoir tu es partie   Ah! pourrais-je t'oublier   Je ne le crois pas tu fais partie de moi-même   Comment cesser de t'aimer   Autant arracher ce coeur qui t'aime   Tu m'as fait goûter au poison de ton amour   Tout en toi m'a possédé nuit et jour   Pourtant j'ai cru toucher au paradis   Sans rancoeur ni haine   Sans remords ni peine   Sans retour tu es partie   Ma tête est intoxiquée, mes yeux sont intoxiqués   Ma bouche est intoxiquée, mon coeur est intoxiqué   Mes bras sont intoxiqués, mon corps est intoxiqué   Mon âme est intoxiquée, ma vie est intoxiquée   Tout en moi tu vois, est intoxiqué de toi"
92,Monsieur Jonas,2:22,"Il y avait, il y avait Un monsieur très entouré Un monsieur très admiré Un monsieur très à la page Qui vivait dans un village De son métier chef de gare Et de plus roi du billard Le champion de la contrée Et que nul n'osait contrer Dans le village on disait plein d'égards... gare  Monsieur Jonas Est un as Au billard Faut voir Comme il joue Car ses coups Sont fumants Époustouflants Matin et soir  Sur le comptoir Y'a son verre De bière Les gens se pressent Et acquiescent Ses coulées Ses coups doublés Au coin de la bouche un mégot presqu'éteint On croit qu'il louche pourtant il n'en est rien Il sait très bien calculer ses effets Il sait ce qu'il fait Il ne se presse pas S'énerve pas Mais il prend Son temps Son jeu est sûr Sa figure A le sourire Ce qui fait dire Monsieur Jonas Est un as Au billard A le voir Les gens tout haut Crient bravo C'est un as Monsieur Jonas  Il y a eu, il y a eu Un monsieur qu'est arrivé Un monsieur étranger Un monsieur très à la page Qui venait d'un autre village Contre Jonas il joua Et Jonas perdit cette fois Mais ne pouvant le supporter Un soir il s'est suicidé Et dans le village on ne joue plus au billard... car  Le diable passe C'est Jonas Qui revient Malin Il frappe les joueurs Qui de peur S'évanouissent Font une jaunisse Il boit la bière Casse des verres Mange les bleus Parbleu Sans crier gare Dans le billard Tout de go Fait des accrocs Au lointain on entend gémir les trains Les trains fantômes qui courent dans le matin Sur son passage le vent balaye tout Et crie comme un fou Jonas, Jonas Les villageois Perdent la joie Et le sommeil Et dans leurs oreilles Vite ils enfilent Du coton hydrophile Pour ne plus écouter Un Jonas déchaîné Qui se met à hurler Monsieur Jonas Est un as Au billard"
93,Quand Elle Chante,2:00,"Quand elle chante, quand elle chante   Les anges se taisent pour écouter sa voix   Quand elle danse, quand elle danse   Les amoureux voudraient la tenir dans leurs bras   Quand elle rit, un vent léger vient emporter   L'éclat de rire qu'elle daigné laisser tomber   Et quand je l'aime, oui quand je l'aime croyez-moi   Le monde entier voudrait l'aimer pour moi     Ah oui! c'est vraiment la plus belle   Celle dont je suis amoureux   Elle n'a pas de sœur jumelle   Et c'est tant pis pour vous messieurs   En elle tout n'est qu'harmonie   On ne peut rien lui reprocher   Elle est le souffle de ma vie   Pourquoi? Vous pouvez en juger     Quand elle chante, quand elle chante   Les anges se taisent pour écouter sa voix   Quand elle danse, quand elle danse   Les amoureux voudraient la tenir dans leurs bras   Quand elle rit, un vent léger vient emporter   L'éclat de rire qu'elle daigné laisser tomber   Et quand je l'aime, oui quand je l'aime croyez-moi   Le monde entier voudrait l'aimer pour moi     Elle marche comme en un rêve   Auréolée d'un arc-en-ciel   Et semble perdue sur la terre   Tant elle paraît irréelle   Je l'aime tant je peux le dire   Que prés d'elle je ne vis plus   J'ai même peur quand elle respire   Qu'elle ne s'envole dans la rue     Quand elle chante, quand elle chante   Les anges se taisent pour écouter sa voix   Quand elle danse, quand elle danse   Les amoureux voudraient la tenir dans leurs bras   Quand elle rit, un vent léger vient emporter   L'éclat de rire qu'elle daigné laisser tomber   Et quand je l'aime, oui quand je l'aime croyez-moi   Le monde entier voudrait l'aimer pour moi"
94,Ca Passe,3:52,"Ca passe   Un jour ce mal disparaîtra   Ça passe   Mon cœur peu à peu oubliera   La garce   Qui m'a joué   La farce   La comédie d'aimer   La parodie d'aimer   Ça passe   Viendra l’heure où ne tenant plus   En place   Je remonterai tout ému   La pente   Pour arracher   Vivante   De mes pensées   L'absente   Vivaces   Réapprendrai d'autres chansons     Et même   Mes lèvres à nouveau rediront   Je t'aime je t'aime   Ça passe   Au fil du temps le feu brûlant   Se tasse   Un amour meurt, un autre, prend   Sa place   Qui d'un revers de main cassant   Le chasse, l'efface   Ca passe   Et blême Mes lèvres à nouveau rediront   Je t'aime, je t'aime"
95,Le Souvenir de Toi,3:22,Assis sur le pont de pierre Qui enjambe le ruisseau Je regarde solitaire Courir l'heure et couler l'eau Hier tu m'as fermé ta porte Et ton coeur à double tour Et l'amour que je te porte M'est interdit de séjour  Que le jour meure ou se lève Qu'il neige ou souffle le vent Que le monde vive ou crève Je m'en fous éperdument Tu as ruiné tous mes rêves Tu as mis mon coeur en croix Ne laissant planter en moi Que le souvenir en toi Le souvenir de toi  Dans le courant de mes peines  Je dérive à corps perdu Entre l'amour et la haine L'amour a pris le dessus Tu as dépecé mon âme Simplement avec des mots Plus effilés qu'une lame Et mis ma vie en lambeaux  Comment échapper aux choses? Mon coeur à ma tête ment Le parfum mène à la rose Dont l'épine pique au sang Alors je reste immobile Et ma pensée suit son cours Je crois devenir une île Pétrifié dans mon amour  Assis comme un enfant sage Je regarde le ruisseau Si j'en avais le courage Je me jetterais dans l'eau Et de mon triste passage Sur la terre de nos joies J'emporterais avec moi Que le souvenir de toi Le souvenir de toi
96,Avant la Guerre,3:03,"j’avais vingt ans une âme tendre Toi seize avec tout à apprendre Quand je t’écrivais des poèmes Où tout rimait avec je t’aime Tu étais encore écolière C’était un peu avant la guerre  A l’orée de l’adolescence Le désir bouscule l’enfance Dans l’herbe d’un printemps précoce On s’est uni en simples noces Notre témoin fut dieu le père C’était un peu avant la guerre  Mais au vent  des amours fautives Ce qui doit arriver arrive Ta taille prit de l’importance On nous maria de toute urgence Mais un jour les choses changèrent C’était un peu avant la guerre  Un uniforme sans retouche Un fusil et quatre cartouches Les champs brûlés de la retraite Les barbelés de la défaite Quelque part en terre étrangère Je nous revois avant la guerre  Où sont les seize ans de ta vie Et les printemps de nos folies Quand pour nous s’ouvraient sur la chance Les portes d’or de l’insouciance Et que tout brillait de lumière Avant la nuit, avant la guerre Avant la guerre"
97,Je N'Ai Pas Vu le Temps Passer,3:57,"Plus je m'enfonce dans ma vie  Plus je ne peux que constater  Qu'au vent léger de mes folies  Je n'ai pas vu le temps passer    Entre les draps de la jeunesse  Quand je dormais à poings fermés  À l'horloge de mes faiblesses  Je n'ai pas vu le temps passer    Je n’ai pas vu le temps courir  Je n’ai pas entendu sonner  Les heures de mon devenir  Quand je fonçais tête baissée  Vers ce qu'était un avenir  Et qui est déjà du passé    Aux mille questions que se pose  Mon esprit souvent perturbé  Seule une réponse s'impose  Je n'ai pas vu le temps passer    À faire le tour de moi-même  Dans un rayon très limité  Dans le miroir de mes ""je t'aime""  Je n’ai pas vu le temps passer    Et d'ouverture en ouverture  Au tempo des amours pressées  J'ai dû sauter quelques mesures  Je n'ai pas vu le temps passer    Quand je rêvais les yeux ouverts  En pensant que j'avais le temps  Je n'ai pas entrepris le tiers  Des choses dont je parlais tant  Et j'ai vu s'installer l'hiver  Dans la folie de mes vingt ans    Et puis soudain la cinquantaine  Le demi-siècle consommé  À la table de mes fredaines  Au moment où les jeux sont faits  Que tous mes atouts sont jetés  Je ne peux dire qu'à regret  Je n'ai pas vu le temps passer"
